,Name,About
14,Kemmangundi,"This hill station is located in the Tarikere Taluk. The hill station is situated at an elevation of about 1400 metres. Also known as the Sri Krishnarajendra Hill Station, Kemmangundi was frequented by kings as a summer retreat centre. Krishnaraja Wodeyar IV started this trend during his time of visiting this place in the summers. When Krishnaraja Wodeyar IV first came here, he was awestruck at the magnificent Baba Budan Hills in the backdrop and it is one of the amazing places to see in Chikmagalur.He wished to build a resort in Chikmagalur. He then handed over this resort to the Government of Karnataka. In fact, it was donated to the government as an act of generosity. The Department of Horticulture now oversees and maintains this place. Given this fact, Kemmangundi is a beautiful and outstanding hill station. The gardens laid out in this region are landscaped to perfection. Surrounding Kemmangundi are magnificent mountains, hills and valleys. The scenic beauty on offer is spectacular. You cannot ask for anything better.
There is a guest house named Raj Bhavan in the vicinity. A must-visit attraction is the Rose Garden. The Raj Bhavan is used by visitors to experience beautiful sunrises and sunsets. The view of this magnificent routine of nature is best observed from here. Another interesting place of visit is the Z point. Being a vantage point, you need to trudge upon an inclined plane for close to an hour to get here. This is yet another place to view the sunrise and sunset.If you went uphill, then you need to go downhill to the Hebbe Falls. 8 km from Raj Bhavan, these falls are two-tiered. Descending from a height of over 150 metres, the falls are a sight to remember and cherish. You can also visit the Kallathi Falls, found about 10 km from the hill station. These falls have religious significance.
Height: It is at a height of 1434 metres above sea level

Location: Kemmangundi, Tarikere taluk of Chikkamagaluru

Best Time to visit: The months from September to May remain the most pleasant time to visit here

Distance from Chikmagalur Bus Stand: Kemmangundi is at a distance of 60 kilometres from Chikmagalur"
15,Coffee Museum,"Coffee Museum in Chikmagalur is a haven for experiencing the fresh aroma of original coffee. Chikmagalur is a picturesque spot in Karnataka embraced by the limitless coffee plantations. Coffee Museum is one of the best places to visit in Chikmagalur.  It is here the quality of coffee is tested and analysed. From the first step of plucking the beans to powdering them, all the processes in the coffee making can be observed and studied at this museum. Training materials are prepared to grow and manufacture the finest coffee.  The building is amidst lush greenery and it is surrounded by small coffee plant pots. You can walk around and find the beauty of the place inviting you to a peculiar world of an irresistible aroma of coffee. The staff at the museum will explain everything related to coffee making. The museum also presents many documents and maps that will provide you with insights about the processes and other coffee growing regions in India. You can reach the museum from Zilla Panchayat Bus Stop which is the nearest bus stop to the museum or you can arrive at the museum by taxi as well.The timings may differ according to the season but normally the museum will be open on all days from 10:00 am to 05:00 pm. But it is always advised to plan your trip to the museum after checking the official website of the museum to know the opening timings. Rs.20 per person is the entry fee to enjoy the sights inside the coffee museum. 
Location: Coffee Museum, Dasarahalli, Karnataka 

Best Time to visit: It can be visited anytime throughout the year. 

Entry fee: INR 20/ USD 0.30

Timings:  The timings are between 10:00 am and 1:00 pm and between 2:00 pm and 5:30 pm from Monday to Friday 

Distance from Chikmagalur Bus Stand: The distance between the two places is approximately 6 kilometres."
16,Manikyadhara Falls,"Located in the vicinity of the Baba Budan Giri Hills, Manikyadhara Falls are a highly frequented tourist place. The waterfall is an idyllic location to spend quality time with your family. All around this region, there are impressive trekking trails. Open grounds present the opportunity to camp as well. The waterfalls are located in the Shola Forest. It is a perennial water cascade. At all times of the year, you can see waterfalls here. Beautiful surroundings and greenery characterise this place.There is a legend behind the Manikyadhara Falls. Saint Hazrat Dada Hayath Mir Khalandar came to this region. Accompanying him were four disciples. They were in search of water. On finding no water, they prayed to the almighty to help them. Suddenly, their prayers were answered. A waterfall cascaded down. This is the reason why this cascade is considered holy by many people. When people visit this place, they also offer a silent prayer to Saint Hazrat Dada Hayath Mir Khalandar. Locals bathe in the water as it is believed to have divine therapeutic powers.A special feature about this waterfall is the temperature of the water. Even during the summer season, the temperature of the water is cold. If you want to experience waterfall water at its coldest, then take a dip in the pond here. The experience is rejuvenating. The Manikyadhara Falls are frequented by Muslims from all over the country. It is considered a pilgrimage site for Muslims. Everyone who bathes in these waters leaves back a piece of their garment.They do this so that their wishes are fulfilled by the saint God. Pilgrims offer prayers here for a variety of reasons. One among them is to find alliances for unmarried girls who are finding it difficult to get good grooms. The falls are a fantastic place amongst places to visit in Chikmagalur given that it is holy and at the same time a fun place to be in. So you get a unique experience when you visit this place.
Height: It is at a height of 30 feet above the ground. 

Location: Manikyadhara Falls, Baba Budangiri Hills, Karnataka 

Best Time to visit: September to May is the best time to visit here

Entry fee: Free

Timings:  Tourists are advised to visit Manikyadhara Falls during day time. 

Distance from Chikmagalur Bus Stand: It is approximately 34 kilometres from the bus stand in Chikmagalur."
17,Kadambi Falls,"The Kadambi Falls captures the essence and mood of Chikmagalur. This enchanting region is full of naturalistic splendours. The falls are a region to visit and witness. You need to feel the pristine waters touching your skin. Experience the purest elements of nature in a world that is cocooned in amazing greenery. The Kadambi Falls on account of these attributes have mesmerised local and international visitors. People revisit this place time and again and it is one of the amazing Chikmagalur tourist spots.      The falls are located in Kudremukh, in the Kudremukh National Park. Kudremukh is a hill station in Chikmagalur. This place is known for its mineral deposits amongst all places to visit in Chikmagalur. Therefore, this town is better known as an iron ore mining town than a place that has a national park. Kudremukh is where three rivers have their tributaries. They are namely Bhadra, Tunga, and Nethravati Rivers. There are impressive trekking trails in this hill station. If you do come to the Kadambi Falls, do not make the mistake of not visiting the Kudremukh region. 
One of the highlights of this region is the orchids. There are several varieties of them. You can visit any of these orchids with permission from their owners. See and experience how these orchids are maintained. Kudremukh is also a place of dense jungles when on Chikmagalur sightseeing. Several wild animals are found in these jungles. Some of them are leopards, tigers, Malabar barking deer, and wild dogs.When at the Kadambi Falls, don’t be surprised if you see jackals in and around the region at dawn or dusk. Generally, these wild animals won’t come near human beings. Still, it is best to stay in groups when at the waterfall. After you visit the Kadambi Falls, you can visit the Rajendra Hill which is in close vicinity. The hill is enveloped in coffee plantations. It presents an idyllic setting for trekking, camping and relaxation.Height: 30 feetLocation: Kudremukh National Park, Chikmagalur, IndiaBest time: The best time to visit the Kadambi Falls is during monsoon or after the monsoon."
18,Z point,"Considered as one of the best trek points not just in Chikmagalur but in Karnataka, Z Point is enchanting views of the western ghats. Z point stands at an elevation of 1400 meters and getting to the top is a short trek of 3 kilometres. The walk is a pretty thrilling one but comes at the cost of scenic views of lush green valleys and it is one of the best Chikmagalur places to see.Kemmagundi Raj Bhavan is the start point of this adventurous trek to Z point which also provides the best sunrise as well as sunset skies. Moreover, Shanti waterfalls are enroute the top, so tourists can stop by to take a dip into the chilly waters of this fall.
Doesn’t Z Point sound like the best place to go to in Chikmagalur for every nature lover?.
Height: It is at a height of approximately 1500 metres above sea level

Location: Z Point, Kemmangundi, Tarikere Taluk, Chikkamagaluru

Best Time to visit: The months from September to May remain the best time to visit here for tourists.

Distance from Chikmagalur Bus Stand: Z Point can be found is at a distance of 60 kilometres from Chikmagalur in Kemmangundi"
19,Hirekolale lake,"Away from the city hustle, Hirekolale lake is nestled amidst the hills and coffee plantations of Chikmagalur. This man-made lake is your ideal choice of picnic spot if you are looking for some peaceful environment with relatively fewer tourists in comparison to any other Chikmagalur tourist places.Here, tourists can sit by the lake and enjoy views of the beautiful sun setting in between the surrounding hills. The lake is built with the purpose of providing water to the town of Chikmagalur and thus holds great importance.
It is recommended to carry some food and water here, as there are no restaurants until a few kilometers from the lake. This lake is located in Chikmagalur. Location: Hirekolale lake, Chickmagaluru, Karnataka
Best Time to visit: Hirekolale lake can be visited throughout the year. However, tourists are advised to visit this lake during twilight for the best experience.

Entry fee: Free

Timings:  It is open 24 hours

Distance from Chikmagalur Bus Stand: It is located at an approximate distance of 10 kilometres from Chikmaglur Bus Stand."
20,Jhari Waterfalls,"One of the most popular tourist places in Chikmagalur, Jhari waterfalls is also known as buttermilk falls; courtesy its appearance. It is considered to be one of the best places to visit in Chikmagalur for spending a relaxed day in the lap of nature.The falls are surrounded by dense forest area and coffee plantations that together make for an outstanding view. In the lower area of this waterfall, a pool offers opportunities for tourists to get drenched! Overall, the experience is super fun and a great option for a one day picnic. It is located Near Mullayanagiri, Baba Budangiri, near Attigundi, Chikmagalur.
Location: Datha Peetha Road, Athigundi Village, Chickmagaluru, Karnataka

Best Time to visit:  The best most ideal time to visit Jhari Falls is from August to January, however, Jhari Falls has its peak season from September to December. 

Entry fee: The entry fee for a jeep is INR 600/ USD 9.21Distance from Chikmagalur Bus Stand :- 87 kilometers"
21,Horanadu Annapoorneshwari Temple,"One of the most serene places to see in Chikmagalur is the Horanadu Annapoorneshwari Temple that is settled on the banks of Bhadra river. The entire temple is surrounded by the trails of lush greens and the aura is quite comforting. In the holiness of Agasthya Maharshi, his deity stands here and devotees from different religions come here to seek his blessings and it is one of the serene things to see in chikmagalurIn the earlier times, it was a small temple but with time it was expanded and glorified. If you are looking for a peaceful location, then this is the perfect place for you filled with tranquility.
Location: Annapoorneshwari Temple, Mudigere Taluk, Chikmagalur District, Hornadu, KarnatakaBest Time to visit: October to March is the most preferred time to visit hereEntry fee: FreeTimings: The temple can be visited from 6:30 am to 9.00 pmDistance from Chikmagalur: Approximately 100 km"
22,Kavikal Gandi ViewPoint,"Located in the proximity of Baba Budangiri the Kavikal Gandi ViewPoint offers majestic displays of nature that are a feast for the eye. Also famed as the HorseShoe ViewPoint this a prominent one in the array of Tourist attractions in Chikmagalur. On the notch, you can spot an elegant painting of Swami Vivekanand and also soak up the soothing breeze. The entire Chandra Drona range could be spotted from this point and this is a must-add in the travel list of places to visit in Chikmagalur.Location: Inam Dattathreya Peeta, Karnataka 577131Timings: Open 24 hoursDistance from Chikmagalur: Approximately 18 km"
23,Ayyanakere Lake,"One of the most sought tourist Places in Chikmagalur is the Ayyanakere Lake is a remarkable spot of the Baba Budan Range. Famed as the biggest lake of the Chickmagalur district this place receives tourists year long. It sprawls over a region of 22 hectares and the lush green surroundings magnify its charm. Being enveloped by the mountain range on the three sides the Ayyanakere Lake showcases a melange of scenic wonders. The Shakungiri range is in the backdrops of the lake and that enhances the beauty of views even more. This is a place where you can have a fun time with your friends and family, fishing, camping, and creating everlasting memories.Entry: FreeDistance from Chikmagalur: Approximately 18 km"
24,Seethalayanagiri,"Marking its prominence in the array of most scenic places to visit in Chikmagalur the Seethalayanagiri is a treat for nature lovers. With the sounds of birds chirping to the fresh air, here one can find every little thing. Located at an altitude of 5,000 ft above the ground the views that it offers will just melt your away. It is located on the route from Mullayanagiri to Chickmaglur and a road trip would just be the perfect shot. When here, you can also visit the Seethala Mallikarjuna Swamy temple that features a big Shivlinga surrounded by water on all four sides. Not only this but here you can also witness a cave that is adorned with a number of wildflowers and orchids.Timings: 6 AM - 6 PMLocation: Chikmagalur district, KarnatakaDistance from Chikmagalur: Approximately 36 km"
25,Kodandarama Temple,"Kodandaramaswami Temple, popularly known as the Kodandarama temple is a Hindu shrine which gets its name from the fact that the idols of Lord Rama and Lakshmana are depicted holding arrows. The beautiful temple is a treat to the eyes and has been constructed following the Hoysala and Dravidian architectural style. It is one of the must-visit tourist places in Chikmagalur if you are a history buff or are interested in religion as the temple dates back to at least the 14th century. The temple is steeped in local legend and is known as the place where Lord Parshurama once lived. The beautiful idols of Sita, Rama and Lakshmana positioned inside the temple have inspired poets for centuries and are a sight to behold. Location: Double Rd, Sampangi Rama Nagara, Sampangi Rama Nagar, Bengaluru, Karnataka 560027Timing: Daily from 5:00 AM - 12:00 PM and 4:00 PM - 9:00 PMDistance From Chikmagalur Bus Stand: 246 kilometres"
26,Ballalarayana Durga Fort,"A trek up to the secluded Ballalarayana Durga Fort sitting atop a picturesque hill is probably one of the most scenic things to do in Chikmagalur. The quaint surroundings, rolling hills and views of the magnificent Western Ghats form the scenery as you traverse the landscape and it is one of the finest Chikmagalur attractions.        The fort dates as far back as the 12th century and once belonged to the Hoysala Empire. It follows the  Karnata Dravida architectural style and forms an excellent backdrop for photographs. While at the fort, you can also enjoy picturesque sunsets where the sky changes colour every few minutes, shedding light on the surrounding forest.  
Location: Madugandi, Karnataka 574228Timing: Daily 6:00 AM - 6:30 PM Distance From Chikmagalur Bus Stand: 70 kilometres"
27,Mahatma Gandhi Park,"When in Chikmagalur, you can take a step away from the bustle of the city and step into the well-maintained green environs of the Mahatma Gandhi Park. The park has footpaths which zigzag through the open spaces and large, shady trees where you can put down a picnic spread and enjoy time with friends and family and it is one of the best Chikmagalur places to see.It is one of the most beautiful places to visit in Chikmagalur with the entire family which is located within the city limits. The park has a dedicated children’s play area and a toy train which will keep the kids entertained. You can go for peaceful walks, sit by the pond and soak in the quiet atmosphere when at the Mahatma Gandhi Park. 
Location: Rathnagiri Bore, Chikmagalur, Karnataka 577101Timing: Daily 8:00 AM - 7:15 PMDistance From Chikmagalur Bus Stand: 4 kilometres"
28,Doddabale Siddaragudda Peak,"A trek to the beautiful Doddabale Siddaragudda Peak, sitting 5,500 feet above sea level is the best way to discover the natural treasures of Chikmagalur. An early start will ensure that you reach the summit on time to witness some stunning sunrise views. Even if you begin your trek late, you will be far from disappointed, as the path itself is a sight to behold.You will pass through lush, green forests, manicured plantations and views of the cloud-covered mountains. You can also make a detour to the many nature-based attractions in Chikmagalur that fall on the way, including Lakeville Dam, Baba Budangiri Hills, Bhadra Lake, and Kebbedoddi Village. Location: Chikmagalur Ho, Chikmagalur - 577101Timing: Open throughout the day Distance From Chikmagalur Bus Stand: 50 kilometers"
29,Sringeri Sharada Peetha,"Sringeri is one of the most essential places to visit in Chikmagalur, in terms of pilgrimage sites. It is renowned for being home to Sharada Peetham - the first ever peetham of a total of four peethams established by Sri Adi Shankaracharya in the 8th century and it is one of the serene Chikmagalur attractions.   Surrounded by western ghats, Sringeri Mutt lies on the banks of river Tunga and is a place of great scenic beauty. It is a perfect amalgamation of natural beauty, art, history, mythology, and architecture.
Sringeri is also famous for several other temples like Vidya Shankara temple, Mallikarjuna temple and a few waterfalls like Sirimane falls and Hanuman Gundi falls.Location: ChikmagalurLocation: Sri Math, Sringeri, Karnataka 577139Time: Mon-Sat: 10am–2pm, 4–8pm , sundays - 10am–2pmEntry fee: No entry feeDistance from Chikmagalur Bus Stand :-  80 kilometers"
30,Sri Veeranarayana Temple,"Another classic example of the Hoysala style of architecture, Sri Veeranarayana temple is a trikuta - meaning a  temple with three shrines. The three shrines are dedicated to lord Veeranarayana, Gopalkrishna, and Yoga Narasimha; all three of which are avatars of Lord Vishnu and it is one of the finest Chikmagalur tourist places.The walls of this temple are plain but the roofs are beautifully carved - with geometrical designs, structures of gods and warriors. Moreover, this temple also has its mention in Mahabharata as the place where Bheema killed Bakasura and protected the villagers.
Sounds like an interesting place already, right?. Location: Belavadi - Kalasarpa road, Chikmagalur. Timings: 8AM - 7:30PMDistance from Chikmagalur Bus Stand :- 29 kilometers"
31,Belavadi,"Belavadi - a scenic village in Chikmagalur holds great significance because of the presence of Veer Narayana temple, which is a temple constructed by Hoysalas. The temple was made for the legendary Belavadi Mallamma, a warrior known for his courage and for the then queen who fought against Shivaji and Maratha and it is one of the finest Chikmagalur places to see.This stunning village is a national heritage site and one of the best places to visit in Chikmagalur. The place all together sets as a beautiful example of mythology, history and architectural excellence and is worth spending some time at! Tourists from not just from Karnataka but from across the whole of South India visit Belavadi often. This place is located in Chikmagalur.
Distance from Chikmagalur Bus Stand :- 26 kilometers"
32,Sringeri Mutt,"Sringeri is one of the most essential places to visit in Chikmagalur, in terms of pilgrimage sites. It is renowned for being home to Sharada Peetham - the first ever peetham of a total of four peethams established by Sri Adi Shankaracharya in the 8th century. Surrounded by western ghats, Sringeri Mutt lies on the banks of river Tunga and is a place of great scenic beauty.It is a perfect amalgamation of natural beauty, art, history, mythology, and architecture. Sringeri is also famous for several other temples like Vidya Shankara temple, Mallikarjuna temple and a few waterfalls like Sirimane falls and Hanuman Gundi falls. Location: ChikmagalurDistance from Chikmagalur Bus Stand :- 80 kilometers"
33,Belur,"The town of Belur is known for its architectural excellence that is sure to take you back in time to witness the marvel of the Hoysala empire. The ancient city is situated on the banks of river Yagachi and is most famous for its temple - Chennakesava which is dedicated to Lord Vishnu and it is one of the serene Chikmagalur attractions.     In the same complex are two other temples called Kappe Chennigaraya and Ammanavara temple where the same level of architecture can be seen. Majority tourists who take a trip to Belur, often extend their journey to Halebid which is referred to as a twin town of Belur and is located at a distance of just 18 kilometres.
Location: Belur, Karnataka
Best Time to visit: The months from October to April is the best time to visit Belur

Distance from Chikmagalur Bus Stand: It is about 25 kilometres from Chikmagalur"
34,Kalasa,"The town of Kalasa which lies on the banks of river Bhadra is fondly known as the temple town in Chikmagalur. It has derived its name from Sri Kalaseshwara temple which is dedicated to Lord Shiva and is a must visit in Kalasa and also one of the best Chikmagalur places to see.Surrounded by lush greenery and western ghats, this town enjoys pleasant weather all round the year and thus serves as one of the best tourist places in Chikmagalur. A visit to Kalasa can be clubbed with a visit to Horanadu which is popular for Annapoorneshwari temple.
Legends say that a visit to Kalasa pays greater religious importance than a visit to Varanasi. So, have you packed your bags?.Distance from Chikmagalur Bus Stand :- 92 kilometers"
