,Name,About
33,Ekvira Devi Temple,"Ekvira Devi Temple is an enchanting hilltop temple dedicated to Goddess Ekvira and held in high reverence by the fishing community here, the Koli community.  This is a very old temple and it is located near the Karla Caves. The structure dates back to the 2nd Century BCE. There are over 200 man-made steps leading up to the temple. Once you reach the top, the sweepingview of the valley is mesmerizing. The Temple is one of the best of Lonavala sightseeing  places during the monsoon season. The Koli community celebrate Navaratri and Chaithra festivals in a grand way at this Temple. Location: Ekvira Devi Rd, Karla, Maharashtra 410405Timing: 6 AM to 8 PMEntry Fee: None"
34,Kaivalyadhama Ashram,"Kaivalyadhama ashram is one of the best attractions in Lonavala. The Ashram is a unique combination of mysticism and modern science.The Ashram has a Natural Care Center, a Yogic educational institute and naturopathy therapy institute. The College of Yoga and Cultural Synthesis follows a unique method of education which combines traditional yogic sciences with modern education system. Students are provided accommodation within the Ashram. The library here holds over 25000 books on yoga which is the largest in the world. Guests can visit and observe the wonderful way of life that is learnt and taught at the Ashram.Location: Swami Kuvalayananda Marg, Parsi Colony, Lonavla, Maharashtra 410403Timing: 8 AM to 6 PMEntry Fee: Admission fees according to course"
35,Waghjai Devi Temple,"Waghjai Devi Temple is located in the beautiful Tiger Valley and it is dedicated to Goddess Waghjai. The unique feature about this temple is that the idol of the Goddess here is quite different from the idols of other temples. Navaratri is the main festival celebrated here with a lot of pomp and festivities. The temple itself is a peaceful refuge and you can enjoy the blissful quietude of its beautiful surroundings. Around the back of the temple, there is a point overlooking the valley. This clifftop viewpoint offers a spectacular panoramic view of the surrounding lush green hills and valleys.Location: Tiger Valley, Khandala, Lonavla, Maharashtra 410302Timings: All dayEntry fee: None"
36,Gagangiri Ashram,"If you want to spend the day in a peaceful and serene environment then Gagangiri Ashram is just the place for you. This Ashram is a place where Mahayogi Shri Gagangiri lived and meditated. Gagangiri Ashram is surrounded by wonderful greenery which is well maintained. The most wonderful feature of the Ashram is a river flowing right in the middle of the property. The whole premises of the ashram is well maintained and kept clean making it an ideal place for peaceful meditation. It is a wonderful place to enjoy a day out and indulge in some peace and quiet time.Location: Laxmi Nagar, Khopoli, Maharashtra 410204Timings: All DayEntry Fees: None"
37,Shrivardhan Fort,"Shrivardhan Fort is one of the twin forts of Rajmachi. It is at a height of 900 meters above sea level and offers a panoramic view of the surrounding hills and valleys. The area around the Fort has many trekking routes favored by regular trekkers. The structure of the Fort features typical Maratha style of architecture. The forests and lush greenery around the Fort is home to several species of birds making this place a great one for avid bird watchers. Shrivardhan Fort is a great place to spend some quality time with friends and family. Location: Rajmachi Village, LonavalaTimings: All dayEntry Fees: None"
38,Manaranjan Fort,"Located on Rajmachi Peak in Sahyadri Mountain Range, Manaranjan Fort is one of the two forts that grace the peak with their presence. For sightseers, the fort complex constitutes watchmen houses, a square lake, and ammunition depots. But the real charm of the place lies in the highest point of the fort which lets you enjoy sweeping views of the valley and the undulating hills. If you are planning a Lonavala getaway with family or friends, Rajmachi Fort is an excellent option you can devote half of your day to. You can reach the base camp by vehicle, after which reaching the fort requires a climb which makes it a perfect choice for those willing to add a feeling of adventure to their weekend experience.Location: Rajmachi, MaharashtraTimings: 9 am to 6 pmEntry Fee: No fee"
39,Phanasrai,"A gorgeous campsite located in the midst of nowhere! If that is the definition of your ideal holiday, then Phanasrai is the ideal place for you. Surreal greens, mossy woodlands and an occasional stream of water ambling by merrily’; these facets combine to offer you an unparalleled experience of having landed in the nurturing lap of nature.Marvel the beautiful excellence of the spellbinding slope and mountains around this beguiling hill station while spending overnight in a camp. While here, you can also take an interest in adventures like flying fox and devour the stunning airborne perspectives of the region.Different exercises like waterfall rappelling will present you with the rush of excitement and adrenaline that is hard to come by!Location: Phanasrai, Lonavala.Timings: All day.Entry fee: None."
40,Bhor Ghat,"Bhor Ghat is a mountain pass that connects Khandala with Palasdhari and Khopoli. The area around Bhor Ghat has some campsites and picnic spots that are perfect for day outs with friends and family. These sites also provide several options for all kinds of activities such as ziplining, trekking, Burma bridge, trekking, hiking and other group games and activities. The Bhor Ghat area is one of the most picturesque areas in the region and offers many picture worthy opportunities besides the adventure sports and other activities. Location: Tiger Valley, Khandala, LonavalaTiming: AnytimeEntry Fees: None"
41,"Umberkhind, Chhavani","Umberkhind is an iconic landmark in the history of the Maratha Empire. This is the place where Chatrapati Shivaji defeated a large army of the invading Mughals led by Kartalab Khan. Today, this area is famous as a trekking route and one of the best Lonavala tourist places. The Trekking trail passes through Kurvande Village and goes on to the famous War Memorial erected to honour the great feat of the Marathas. It goes past the spellbinding beauty of the Sahyadris mountains covered in lush green forests and trails of lovely waterfalls and streams along the way. This trek is ideal to explore during monsoon season when the greenery is at its peak and the streams are gushing from the mountains.Location: Khopoli Pali Road, Chavani, Maharashtra 413519Timings: All dayEntry Fees: None"
42,Ghangad - Tailbaila,"Ghangad is a fort cosseted in the Sahyadris, close to the lovely Mulshi stream which is in Pune District near Lonavala. Otherwise called Korbarase Maval, the region of the fortification albeit little, is rich with natural magnificence. The fort is nestled between different fortresses of the locale, for example, Korigad, Tailbaila, and Sudhagad.Being in the heart of Tamhini Ghat, the hike up to the fort is misleadingly simple. There are two titanic rocks gaps at the way of the post and as of now, some remodel work is in progress to update the structure. There are also some delightful rocky patches which prompt you to indulge in some level of rock climbing! However, there is also a ladder now which makes crossing it far less demanding.Tailbaila, on the other hand, is a monolithic structure, which takes after a cobra head. Situated at a separation of around 94km from Pune, it is a bastion that is ideal for climbing lovers and experience seekers. The summit offers great perspectives of the Konkan Valley which are truly beautiful!Location: Bhabarde - Ekole Road, District Pune, Ekole 412108Timings: All day.Entry fee: None."
43,Canyon Valley,"Along the Ulhas River, there is a beautiful valley filled with a variety of unique flora and fauna which attracts avid trekkers from the nearby cities. This valley is called the Canyon Valley. The peculiarity of this particular valley is that to start trekking here you will first need to descend to the valley and ascend to return. This is just the opposite of normal trekking routes. The route going down is rocky and passes through a thick forest area. The route going up is equally steep though picturesque. There is a waterfall at the end of the trek that is one of the most beautiful waterfalls in the area. This is one of the most amazing Lonavala tourist attractions. Location: Kune Village, Khandala, Maharashtra 410302Timings: All DayEntry fees: None"
44,Zenith Waterfall,"Zenith Waterfall is a beautiful mountain waterfall located near Khopoli, Lonavala. It is one of the best Lonavala tourist attractions and popular for its amazingly wonderful scenic surroundings. It draws a lot of visitors, especially during the monsoon season. Trekkers and adventure seekers favour visits to the Zenith Waterfalls to indulge in trekking, hiking, rappelling, rock climbing and many other activities in and around the area of the waterfall.Other than the main waterfall, there are several small waterfalls nearby if you want to look for a more private and secluded spot to enjoy the scenery. There are also several makeshift stalls near the waterfall selling tea and sweet corn.Location: Khopoli, Maharashtra 410204Timings: All dayEntry Fees: None"
45,Scorpion's Sting,"Scorpion’s Sting is an expansive area shaped like the sting of a scorpion and covered in a thick green carpet of moss. It is a wonderful place where you can enjoy a panoramic view of the surrounding hills and valleys. During the monsoon season, you will find clouds floating so close that you can practically touch them. This is one of the most favoured Lonavala sightseeing places, especially by trekkers and nature photographers. The peak is part of the Lohagad Fort and during the olden days, it served as a lookout for the approaching army attacking the fort.Location: Lohagad Fort, LonavalaTiming: AnytimeEntry Fee: None"
46,Sausage Hills,"Covered in lush green forests, Sausage Hills is home to a wide variety of colorful birds. It is one of the best Lonavala sightseeing places and a must visit for bird watchers and nature enthusiasts. Sausage Hills offers some of the most spectacular views of the valleys, hills and lakes in the surrounding area. You also get an excellent view of the famous Tunga Fort and the beautiful Pawna Lake from this beautiful location. This place is also the starting point of many trekking and hiking expeditions. You can also indulge in rock climbing and mountaineering while you are here. Location: Lonavala, MaharashtraTiming: Any time Entry Fee: NoneRecommended Reads: 10 Best Places to Visit in Lonavala at Night"
47,Valvan Village Pond,"Valvan Village pond is an artificial water body near the Valvan Dam. It is located in the middle of a beautiful valley surrounded by spectacular scenery of hills covered in dense green forests. It is one of the best Lonavala sightseeing places to enjoy with family and friends. Enjoy the magnificent sights of several colorful birds that have made this area their homes. Nearby there is a beautiful garden where you can enjoy a peaceful afternoon. There are various options to satisfy your hunger pangs in the area as well. If you wish, you can also pack a picnic lunch and enjoy your meal outdoors with great views and fresh air to whet your appetite. Location: Valvan Village, LonavalaTiming: All dayEntry Fee: None"
48,Shivling Point,"Next, in the list of Lonavala tourist places, this is a conical peak where one should for sure make an appearance. With references from the mythological stories, this place has some significance related to the Shivling.  Also this peak, close to the Lions Point in Lonavala, is no exception. But, its exciting position presents it as one of the readily identifiable milestones in Maharashtra.Location: Lonavala, Maharashtra 412108Timings: All day.Entry fee: None"
49,Durshet,"Resting peacefully in the laps of the Sahyadris, Durshet bursts forth as an ideal and laidback weekend destination adorned in all the nature’s beauty. If going back to the roots is what you wish to experience, then Durshet is the ideal place to see in Lonavala. The destination is crowned in a tiara of perfectly green and lush forests.While in Durshet, there are a number of activities that can keep your travel-loving heart occupied! The jaded woodlands present the perfect setting to enjoy activities like bird watching, wildlife spotting or just a calming hike to collect your scattered thoughts. Moreover, the soils of the region being fertile and salubrious, present an ideal opportunity for agriculture.The bloom of these farms rollicking in the fresh breeze is truly a sight to behold. You can also experience rice plantation as well as various adventure activities in Durshet!Location: Durshet,	Khalapur.Timings: All day.Entry fee: None."
50,Kamshet,"A perfect adventure spot in Pune is Kamshet, located at a distance of 45 km from Pune. Also, they are very close to the famous twin hills in the region, Khandala and Lonavala. Kamshet presents small villages built in traditional style, with mud, thatch, and reeds. Tourists, especially adventure junkies come to Kamshet to partake in the unending thrill and excitement provided by paragliding, trekking, hiking, camping etc.Paragliding, being the most favorite adventure in Kamshet, has numerous admirers from all over the world. The best time to paragliding in Kamshet is from October to the end of May. Multiple paragliding schools and providers are existing in the town. They offer authentic training or tandem flights to those who seek for it.Location: Kamshet, Maval.Timings: All day.Entry fee: None.Popular Reads: 4 Best Lonavala Water Parks"
51,Tunga Fort,"Tunga Fort is one of the best attractions in Lonavala. Located at 24 km from Lonavala, Tunga Fort is an ancient hill fort built by the rulers of the Adilshahi Dynasty in the late 1500s CE. It was later captured by Shivaji Maharaj of the Maratha empire. The fort became a major watchtower as it offers a panoramic view of the Pawna Valley and Mulshi area. The route up the Fort is a highly popular trekking and hiking trail. The fort itself is conical shaped and surrounded by water on three sides. It is a steep climb up on a narrow mountain route to reach the fort. Location: Near Pawna Dam, Lonavala, MaharashtraTiming: AnytimeEntry Fee: NoneMust Read: 16 Best Camping Tours in Lonavala"
52,Korigad Fort,"Korigad Fort is a beautiful hill top Fort offering fantastic views of the surrounding area. It is one of the most popular places to visit in Lonavala and it also offers an excellent trekking route. It is located at about 25 km from Lonavala and is at an elevation of about 3028 feet making it the highest fort in the country. It is a beautiful place to spend an afternoon. You can also indulge in paragliding and outdoor camping in the nearby area. There is a Koraidevi Temple near the Fort which can also serve as a shelter for trekkers. Location: Lonavala,Aamby Valley, Maharashtra 412108Timing: 9 AM to 6 PMEntry Fee: None"
53,Prati Pandharpur,"Prati Pandharpur is a beautiful temple located near Pawna backwater and Lohagad Fort. This temple is a replica of the Vitthal Temple of Pandharpur and it has been constructed very tastefully. The temple is wonderfully peaceful with an aura of deep spirituality. The grounds around the temple are very well maintained. You can enjoy a packed lunch in the grassy lawn here after offering your prayers. There is also a canteen in the premises from where you can get food and snacks if you have not brought your own. Children will have a good time at the play area that has some swings and slides put up for them. This temple is an ideal Lonavala tourist places to enjoy a nice and peaceful day with family and friends.Location: Dudhiware Khind, Apati, Maharashtra 410401Timing: Mahaprasad timings are from 12 noon to 2 PMEntry Fees: None"
54,Tungarli Lake,"Tungarli Lake is a scenic spot not too far away from the city centre of Lonavala. It is a beautiful lake which once served as a major source of water for the nearby areas. The lake also has a dam which was built during the British era. This is one of the ideal places to visit in Lonavala if you are looking for some peace and quiet amidst beautiful surroundings. There are many activities you can enjoy around Tungarli Lake as well. It is a great picnic spot and also offers opportunities for hiking and camping around the area. During the rainy season, the lake is brimming with water and it serves as a perfect backdrop for some amazing photography. Location: Near Tungarli Village, Rajmachi, LonavalaTiming: AnytimeEntry Fee: None"
