,Name,About
26,Miramar Beach,"""Golden
beach” is what this beach is famed for which has an array of alluring palm
trees and, is one of the must-see places in Panjim.Lying
close to the confluence point of Mandovi river and the Arabian Sea this beach
is an amazing place to delve in a relaxing aura. The freshness in the air is
just splendid and, one experiencing this can rejuvenate each and every rim of
the body.Reaching
out to the beach and not witnessing a sunset and sunrise is just not fair!Here,
you can witness the impressive spectrum of hue as the sun sets down.Not
only this, but you also indulge in various adventure sports like jet-skiing,
water gliding, water skiing and many more to add up to the enchanting
experience.Location: 3 km from Panaji Centre | Near
Dayanand Bandodkar Marg, Panjim, IndiaTimings: All days of the week (12:00 AM - 12:00 PM)Distance from Panjim Bus Stand: Approximately 5 km"
27,Siridao Beach,"Also
known as the Shiridon this beach of North Goa is one of the most mesmerizing
places to visit in Panjim. This course sand beach is famed as the “Shell
Collectors Beach” lying in the mouth of Zuari river. Taking about shells, here
you can find the most unique shells and a wide range of oysters and pearl
shells.Embellished
with rock and sand, at this beach you can also find some mysterious caves.To add
up to the glam and charm of the Siridao Beach there is also a “Chapel of Jesus
of Nazareth” seated at the top of the verdant hillock. The best time to visit
this place is from October to March as at this time the beauty of the beach at
its peak.Location: Near Zuari Estuary, Siridao, IndiaDistance from Panjim Bus Stand: Approximately
9 km"
28,Goa State Museum,"Those who love art, history, and culture shall not miss Goa State museum and observe a different set of antiques and an impressive collection of artefacts. Of all museums of Goa, this one exhibits items pertaining to religious expression, history of printing in the state, lottery printing, cultural anthropology, contemporary and Christian art, furniture, sculptures and information on Goa’s struggle for freedom. Gallery display is not the only thing you will find but also screenings for students on prior intimation. These screenings display short videos of various cultural, heritage and anthropological facts about Goa.Location: Mahatma Gandhi Road, PanajiTimings: Monday to Saturday, from 10.00 AM to 6.00 PMEntry Fees: To your surprise, it's none!"
29,Benz Celebrity Wax Museum,"Doesn't wax museum sound familiar to you? Yes, it is the museum that houses wax structures of various celebrities of national and global. Opened very recently, the museum is being taken care of by well-trained staff and the glittering red and golden entrance attracts all, right from its entry point making it one of the best North Goa places to visit.  Take some time out to see lifelike wax statues of Marvel heroes, Mahatma Gandhi, Narendra Modi, and other Bollywood and Hollywood celebs. One can see the amazing detail work that artists have put into in making these statues and shall pay a visit to observe the efforts they have made so far.Location: Near Arpora Junction, CalanguteTimings: 10.00 AM to 10.00 PMEntry Fees: Rs. 30 per person."
30,Dona Paula Beach,"A lover’s paradise, the name of the location got its designation after a tragic love story, making the place more interesting and catchy. This former village is a heaven on earth that provides picturesque spots and huge space for sunbathing while relaxing in the calm beaches adjacent to clean blue waters. Travellers love to be here to indulge in water sports like parasailing, kayaking etc. and gets the adrenaline rush at beaches like Dias beach and Dona Paula beach. Moreover, the markets for shopping are also vibrant and gets shiny names of food and drinking spots to attract visitors. For a perfect stay, one can also book their own resort or hotels here which are also loaded with amenities and good services.Location: 6 km from Panaji city.Water Sports: water scooter, and motorboat rides"
31,Backwaters of Chapora River,"Experience Goa differently, away from the beaches and party spaces while taking a backwater ride in Chapora river. This ride may make you meet distinct birds and fishes along with the breathtaking sunset and sunrise. Coconut and palm trees will be your companion all through the trail and romantic time with your partner can just make the day spellbinding.Entry Fees: From a 2-hour boat ride to overnight stay in well-furnished rooms, packages vary accordingly."
32,Basilica of Bom Jesus,"A world heritage monument and a UNESCO recognized the site, the facade of the church is quite dull and rusty in its first look giving a very different impression at first. Despite its rustic look, the church is famous as the relics of Saint Xavier was enshrined here long back. Moreover, its art, architecture and historical touch make it unique in another manner. The contrasting interiors is a worth to look at, having the marbled floor, precious stones, gorgeous silver statue, carved and gilded columns and old paintings which will all make one go awestruck. This place is undoubtedly topmost places to visit in North Goa and a place that ought not to be missed at any cost.
Location: 10 km east of Panaji at Bainguinim
Timings: 10.30 AM to 6.30 AM, every day
Entry Fees: free of cost."
33,Chapora Beach,"The wonderful Chapora beach in North Goa is an ideal spot for the leisure lovers and peace searchers. Catching the fishes with an astounding perspective of the lovely nightfall ahead is truly an alleviating background which you can witness at the Chapora Beach. One of the most important landmarks of Portuguese era, the Chapora Fort is located on the stretch of this beach. 
It remains one of the most crowded beaches of Goa flocked with tourists looking for a calm stroll on the sand, sunbathing or enjoy the warm currents at the shore. Hungry tourists can find a number of restaurants and beach cafes near the Chapora beach that serve some flavorsome seafood and drinks. 

 Water Sports: Fishing, jet skiing, wind surfing, para gliding, ringo rides, para sailing, crocodile spotting at certain pre- defined locations and dolphin watching
Nightlife: Sunita Bar, The 9 Bar, Camlin Bar And Restaurant, Sunset Bar And Restaurant, Big Chill Goa, Ferns Bar And Restaurant, Mango Tree Bar And Restaurant, Siddheshwar Darbar Bar And Restaurant, Green Bar And Restaurant, Nyan Bar, Disco Valley, 9 Bar, Helinda Bar And Restaurant
Location : Chapora Beach, North Goa
Distance from Panaji: It is located at a distance of 21.1 km from Panaji. 
How to reach from Panaji: The nearest railway station is at Karmali, just 11 km away from Panaji. From Panaji you can hire car or taxi to reach Chapora."
34,Querim Beach,"This disconnected beach draws in less guests, and in this manner less hawkers than most Goa shorelines. On the off chance that you long for a void shoreline with pleasant scene, this is the place for you. Dotted with historical structures, this beach is found quite recently north of Arambol beach which is popular among the hippies and Russians.
 It is one of the most tranquil beaches and ideal for unwinding as it is still obscure to the world and is separated without any vacationers. This beach is also the spot where Terekhol River joins the ocean. Barely any rough outcrops and columns of pine trees finish the scene of this place. You can spend your day under a shady tree watching the waves slamming on the shore and drinking coconut water at Querim Beach on your vacation. 

Water Sports: Paragliding is a popular water sport here. Swimming is not advisable at Querim Beach.
Nightlife: Here you can find some entertainment at night on the beach shacks. 
Location : Querim Beach, North Goa
Distance from Panaji: Querim Beach is located at a distance of 50 kilometers from Panaji. 
How to reach from Panaji: Querim Beach is well connected via bus from Panaji. You can drive by yourself to reach the Querim Beach by your own vehicle."
35,Ozran Beach,"Ozran shoreline is a standout amongst the most picturesque Goan Beaches. This beach is particularly a hotspot for foreign sightseers and boasts of a postcard perfect view of the coastline. Because of its confined area, frequently voyagers come here to make an escape from the whole murmur drum around them and go back revived and upbeat. 
This secluded beach is an extension of the famous Vagator Beach. The rocky beach is an ideal spot for picnics where you can enjoy the scenic beauty under the shade of palm trees. Here you can enjoy the sunsets as the sky turns golden from the sundecks outside the beach shacks. Tourists also engage in sports like volleyball and football at the beach. One of the attractions on this beach is the rock sculpture which people popularly call the Shiva Face which was carved by one of the tourists. 

Water Sports:  Water scooters, Banana boat rides, Swimming, Fishing
Nightlife: Mezcal, Mango Tree, Disco Valley, Tin Tin Bar, The Alcove 
Location : Ozran Beach, Bardez, North Goa
Distance from Panaji: It is located at a distance of 20 km from Panaji. 
How to reach from Panaji: Ozran Beach which is more or less a part of Vagator Beach is connected to Panaji through Mapusa and Calangute. You can easily catch a bus or drive by yourself to reach the Vagator Beach and then visit the Ozran Beach."
36,Kalacha Beach,"Kalacha is a standout amongst the most picturesque beaches in North Goa. This shoreline IS situated toward the south of Querim beach and is known for its sweet water lagoon. Kalacha is renowned for its pleasant new water tidal pond and casual, bohemian vibe. Music sessions frequently happen around an open air fire and it becomes an extraordinary place to meet different voyagers. This is an untouched haven, far from the bother of merchants and expansive vacationer’s gatherings.
The untainted beach is encompassed by a background of overgrown, green slopes toward the end of the shoreline. You may be lucky to spot some entrancing natural life, for example, exotic birds and monkeys amidst the tropical foliage around the lake.

Water Sports: Paragliding, Hang Gliding
Nightlife: Most often beach parties and live music sessions are spontaneously arranged by backpackers. 
Location : Kalacha Beach, Pernem, North Goa
Distance from Panaji: Panaji is 42 kilometers away from Kalacha Beach. 
How to reach from Panaji: Kalacha Beach is connected to Panaji via Mapusa to Arambol beach. From Arambol Beach, one can easily take a bus or walk along the northern part to reach Kalacha. Buses leave for Arambol from Mapusa every hour from 6 AM till 7 PM. The beach is then accessible only via foot."
