,Name,About
15,Kamshet,"Kamshet is a beautiful hill station in Pune which is renowned for its natural beauty and a number of adventure activities. Located in the Western Ghats, Kamshet is replete with lush green hills and beautiful lakes. Kamshet is nestled between the gorgeous paddy and sunflower fields and offer a postcard-perfect landscape as a visual delight. It is located close to the two famous hill stations of Maharashtra-Lonavala and Khandala and offers a refreshing getaway to beat the heat and enjoy the surreal ambience.
Kamshet is most famous for being a paraglider’s paradise. There are various paragliding schools and world-class facilities to offer an unforgettable experience for the adventure junkies. Being an adventure hub, Kamshet is a must visit if you wish to challenge yourself with some pulse-racing adventures on your visit to Pune. Apart from paragliding, tourists here can embark on an exciting trek to the Kondaleshwar Cliff, Tower Hill or Shelar. Some other famous places to visit in Kamshet are Kondeshwar Temple, Bhairi Caves, Bhedsa Caves, Pawna Lake and Bhandar Dongar for a wholesome experience.
 

Location: Kamshet, Pune District, Maharashtra
Best Time to visit: The best time to visit this place is from October to June
Entry fee: N/A
Timings: N/A"
16,Dehu Gatha,"With an imposing statue of Sant Tukaram Maharaj, Dehu Gatha is known for being one of the biggest temples in Pune. The wonderful statue greets the visitors at the entrance of the temple and this place makes for a memorable visit in Pune. One of the most notable sights at Dehu Gatha is the various carvings from all the Gathas on Sant Tukaram embellished on the walls of this temple. It is often said that tourists who visit the temple must read at least 3 Gathas.
Dehu Gatha draws in pilgrims from far and wide and its spiritual ambience is totally tranquillizing. Built in 1723, this temple is believed to be the place where Sant Tukaram resided during his life. The most preferred time to visit Dehu Gatha is during palakhi in the month of ashadh which is held every year.
 

Location: Dehu, Pune, Maharashtra
Best Time to visit: The best time to visit this place is during monsoon and winter season.
Entry fee: There are no entry fees for the visitors at Dehu Gatha
Timings: The timings are from 6:30 am to 10:30 am in the mornings and then from 5:30 am to 8:30 pm in the evenings. For Saturdays, pilgrims can enjoy their darshan at Sant Tukaram temple up till 9 pm"
17,Taljai Hills,"Maharashtra is blessed with a number of picturesque travel destinations that has a magnetic pull to nature lovers and adventure enthusiasts. Whether it is the verdant hills or dense forests, monsoon adds a mystical charm to these places when they look rejuvenated and green. Taljai Hills is a popular weekend getaway in the city of Pune, which is a favourite of tourists for its abounding natural beauty and exotic fauna. Tucked in the Western Ghats with a pleasant climate virtually round the year, the place has a number of attractions for environmentalists and shutterbugs. The open forest area provides a relaxing haven for morning and evening walks.Taljai Hills is popular among the Punekars for the famous temple of Taljai Mata Devi located atop the hill. The road to the temple is a zigzag bituminous trail along the forest area which you have to hike as no vehicles reach up to the summit of the hill. Since the forest is not dense, you have a good opportunity to explore the place as you hike up to the temple. During your trip you can spot number of migratory birds, rare species of butterflies, peacocks and rabbits in their natural habitat. The temple area is well maintained with paved sitting area where travellers can sit and rest for a while. En route the Taljai Mata temple you will come across a pond where you can see ducks swimming in playful moods. It is a rare sight to delight! Taljai Hills is a perfect spot for outdoor picnic and excursions where you can be one with nature and unwind your fetters for some time. From the temple top, you can enjoy a 360 degree panoramic view of the Pune city at the backdrop of the emerald green Western Ghats."
18,Sky Jumper Trampoline Park,"As the name suggests, SkyJumper Trampoline Park is a one-stop centre for amusement, thrill, fun activities on over a hundred interconnected trampolines. The park promotes fun along with sports, fitness and makes for a perfect picnic destination with friends and family. Although it restricts the entry of kids below the age of two years, it is suitable for everybody above the aforementioned age. It has designated trampoline play areas for older kids as well as adults in different age brackets, thus covering all age groups. The park is a famous pick for locals of Pune and tourists alike; especially amongst tourists from nearby cities like Mumbai and Nagpur. There are a number of special activities and events that are organised for teens and parents and for other homogeneous groups. Some of the attractions here include the basketball hoops, wall climbing, foam pits, leap of faith and vertical slide. The park is also considered as a perfect venue for birthday parties, get-togethers, reunions and other celebrations with closed ones. The park also has an elevated cafeteria where visitors can munch on snacks and drinks whilst enjoying the views of the trampoline park. In order to maintain the utmost safety measures, the park has a set of do’s and don’t that visitors are expected to follow on their visit here. SkyJumper Trampoline Park is perfect for a quick break and fun-filled dose of energy. It is where you must go flying up in the air, climb walls, and fall to bounce back, literally!"
19,Pashan Lake,"Enjoy a surreal evening at Pashan Lake in Pune away from the clamor of city life. It is a man-made lake and one of the most picturesque places to visit in Pune. Dating back to the British times, this lake was built as a water reservoir to meet the needs of water in the neighborhood. The place can be visited for a picnic to enjoy the natural scenery and the cool breezes. Boating and fishing are other popular activities that one can enjoy at Pashan Lake
Pashan lake boasts of hosting many beautiful migratory birds and has become a popular spot for bird watching in Pune. One can see many rare and exotic birds here like a gray heron, little egret, white-breasted kingfisher, open billed stork etc. With the great landscape replete with greenery and natural surroundings, Pashan Lake is a wonderful bird sanctuary which you can visit in Pune.

Location: Pashan Lake is located at a distance of 12 kilometers from Pune city center
Best Time to visit: The months from December to February are the best for visiting Pashan Lake
Entry fee: No tickets are required to enter Pashan Lake
Timings: The timings are 8:00 am to 11:30 pm"
20,National Defence Academy,"If you’re fascinated by the defense forces of our country, the National Defence Academy is one of the most unmissable places to visit in Pune. It is a joint training institute for the members of Indian Navy, Indian Airforce, and Indian Army. A visit to National Defence Academy offers an interesting glimpse into the lives of valiant men who receive their training here. The place has been famous for producing for some of the finest military personnel who have gone on to champion in various fields like sports, arts, Olympics etc.
A visit to National Defence Academy is an unforgettable experience for children who can learn more from the place where future Indian soldiers are made. The place is also popular for its magnificent architecture, the largest inter-service museum in the country and the Weapon Technology Park that are great places for tourists.

Location: National Defence Academy is situated in Khadakvasla which is around 15 km from Pune
Best Time to visit: It can be visited throughout the year as per your convenience
Entry fee: There are no entrance fees, however, one has to take prior permission 48 hours before visiting.
Timings: It can be visited only on Sundays between 10:00 am and 12:30 pm by the tourists."
21,Peacock Bay,"Peacock Bay is a spectacular place to visit in Pune when you are touring National Defence Academy. It is adjacent to the lake at Khadakvasla Dam and owned by the National Defence Academy. With a large number of peacocks which could be spotted in the area, Peacock Bay got its well-deserved name. Along with the peacocks, the place has been known for offering glimpses of various flora and fauna like deer, Lion-tailed monkeys, and civets.
Peacock Bay has been famous for hosting a number of challenging competitions and activities of NDA. The place has many facilities which range from sailing boats, windsurfers to different whalers and dinghies. Peacock Bay offers a surreal ambiance and offers a wonderful visit distinct from many other places to visit in Pune.

Location: Peacock Bay is located at National Defence Academy in Pune
Best Time to visit: The ideal time to visit Peacock Bay is from the month of July to February
Entry fee:  Tourists are not required to pay any entrance fees for visiting Peacock Bay
Timings: Although there is no specific time to visit this place, it is advisable to plan your visit in the morning or evening."
22,National War Museum,"Offering an astounding getaway to commemorate the memory of brave Indian soldiers who lost their lives in the line of fire, National War Museum is one of the most amazing Pune tourist places. Engulfed by a blanket of greenery, National War Museum is the only war memorial in South Asia that was built by the contributions of common citizenry.
National War Museum is an interesting visit to appreciate the efforts of citizens in Pune in acknowledging the valour of Indian soldiers. One who visits here can get a chance to get a glimpse of a MiG-23BN which was used in the Kargil war. Another fascinating thing on display here is the replica of INS Trishul which offered its services in the India-Pakistan War of 1971 and Liberation of Goa. National War Museum offers a great trip for students and people interested in Indian defence history.

Location: Prince Of Wales Drive, Ghorpuri Lines, Dobarvadi, Ghorpadi, Pune, Maharashtra 
Best Time to visit: July to March are the best months of the year for seeing this place on a trip to Pune
Entry fee: There are no entrance fees to visit here
Timings: National War Museum can be visited any day of the week from 9:00 am to 5:30 pm"
23,Kamala Nehru Park,"One of the finest places in Pune, Kamala Nehru Park is the place to go for enjoying the company of nature. The park has been frequented by locals and tourists who want to enjoy some peaceful moments. One can spot many people jogging and doing yoga in the mornings here. The park also boasts of having a children’s playground, a fountain and two laws.
The star attraction of Kamala Nehru Park is the military jet which tourists can see in one of the lawns. The place is filled with green trees and offers a pleasant weekend outing with friends and families. When visiting here, tourists can also explore the temple of Lord Dutta which is located next to the park. The presence of various food stalls and eateries makes it a lively place for enjoying a nice evening in Pune.  

Location: Babulnath, Dadi Sheth Wadi, Malabar Hill, Mumbai, Maharashtra 
Best Time to visit: Winter is the best season to visit this place when the climate is cool and ideal for sightseeing.
Entry fee: There are no entry fees for going to Kamala Nehru Park
Timings: The timings at Kamala Nehru Park is from 5:00 am to 9:00 pm"
24,Diamond Water Park,"Enthrall yourself with an eventful day at Diamond Water Park the next time you are visiting Pune. It is one of the main attractions in Pune where you can be assured of a wonderful day and jam-packed enjoyment for kids. Diamond Water Park is visited by the people for a refreshing retreat with water sports and other fun activities. It boasts of having more than 7 swimming pools and more than 32 international water rides and attractions.Some popular attractions at Diamond Water Park are kiddies pool, family play station, wet bubble, Tortuga Falls etc. the fun rides offer a thrilling experience to all the tourists and there is also an unlimited lunch which you can enjoy at Diamond Water Park.Location: Water Park Road, Lohegaon, Pune City, Maharashtra.Best Time to visit: Diamond Water Park is a great place to visit in Pune throughout the yearEntry fee: The entry ticket for the weekdays is INR 600/ USD 9.25 and for the weekends & public holidays is INR 700/ USD 10Timings: Tourists can visit Diamond Water Park from 10 am to 5:30 pm every day"
25,Katraj Lake,"Located near the Rajiv Gandhi Zoological Park, Kataj Lake is one of the most beautiful lakes in the city of Pune. Developed and maintained by the Pune Municipal Corporation, the lake is a must visit for all the nature lovers who are on a vacation in Pune. It is an artificial reservoir and has a pleasant jogging track around it drawing in a number of fitness enthusiasts. Offering a relaxing retreat away from the hustle and bustle of city life, Katraj Lake has been hailed for its beautiful surroundings. One of the prominent attractions of this lake is the incredible statue of Shivaji Maharaj that is in the middle of the lake. Katraj Lake is a treat to the eyes where you can enjoy the spectacular views of Sahyadri Mountain ranges and also spot some beautiful birds. The beauty of the lake is best enjoyed at the time of sunset which makes it a postcard-perfect setting to be captured by your cameras.

Location: Katraj Vasahat, Katraj, Pune, Maharashtra
Best Time to visit: The best time to visit this place is during the monsoon season.
Entry fee: There is no entry fee for visiting Katraj Lake in Pune
Timings: Katraj Lake can be visited between 6:00 am to 9:00 pm"
26,Shaniwar Wada Palace,"Shaniwar Wada is an excellent example of the Maratha Imperial architecture used in India in the bygone era. It tells the historical tale of the Maratha Kingdom as it has seen every event that occurred in Peshwas Life over time. It was built by the Peshwas’ symbolizing the brave hearts of the Marathas, who strived hard to keep its glory alive. Though the fort couldn’t tolerate the battering from the wrong time but the stone boundaries still recite the untold tales of the colourful journeys lead by the heroic Marathas.However, some ruins still remain reciting the remarkable stories and contorted tales. You can witness the enormous stone boundaries made to protect the beautiful Shaniwar Wada, which shows the level of security provided to the people of the kingdom. The walls have a magnificent wooden gate reflecting the Mughal architecture, which is another example of how secure the palace was made. There are long iron spikes tucked into the gate, which could reduce the attack of the enemy and kept elephants away.Besides this, you can see a garden which follows the style of the Mughal architecture. It also has a lovely fountain resembling a 16 petaled lotus, right in the middle of the garden. Adding to that, you can see the boundaries marked on the ground, which could tell about all the rooms. There is nothing more than this havoc of time, which changed the face of the mighty Shaniwar Wada into nothing. But you can still make these remains your window into the past to relive what has happened in history.History of Shaniwar Wada:
The foundation stone of the Shaniwar Wada was laid in 1730 by Peshwa Bajirao I. Initially, it was intended to be a colossal palace of seven stories made out of stone. But the people of the national capital argued that only King can have a castle made of stone. So, the construction of Shaniwar Wada began using bricks. It took two years to complete this elegant structure, which displayed an excellent blend of the Maratha Imperial architecture with the Mughal architecture. The interiors had valuable furniture and decorations along with carvings of flowers and paintings of scenes from the Mahabharata and Ramayana. The first major fire in the year 1791 destroyed a significant part of the fort, which was re-constructed again. Then the next explosion in 1808 burnt all the necessary artifacts and documents in the palace. Then another fire in 1812 destroyed the upper two stories of the castle, followed by a fire in 1813 which destroyed the Royal Hall. All this destruction was taken to another level in the year 1818. The British attacked Shaniwar Wada, which resulted in collapsing all the top stories. Finally, in the year 1828, a fire caught the whole palace, which burned for a week and wrecked it. Architecture of Shaniwar Wada:
Architecture of Shaniwar Wada is an excellent example of Maratha style of construction blended with authentic Mughal architecture. The main gate, also known as Delhi Darwaza, is adorned with iron spikes to restrain the enemy attack as it is enormous enough to pass an elephant through it. There is a small aisle on the top of the door which has dome-shaped windows definitely taken from the Mughal architecture. Besides this gate, the Wada has four more gates, namely Mastani Darwaza, Khidki Darwaza, Ganesh Darwaja, and Narayan Darwaza. The walls have floral carvings and paintings resembling the Mughal architecture style. Scenes from Ramayana and Mahabharata are also found painted at various significant spots. The windows and doors are also dome-shaped contributing to the traces of Mughal architecture. Archaeologists believe that initially, the fort was six-floored before it was destroyed by the fire. Finally, the garden has a 16 petaled lotus representing the grace of the bygone era."
27,Mulshi Lake and Dam,"Originally a dam used for irrigation and hydroelectricity generation, Mulshi Lake and Dam is now one of the most notable attractions in Pune. The place attracts a number of visitors who wish to relax in the serene ambience of nature and rejuvenate their soul away from all the hubbub of city life. Mul shi Lake and Dam gets its picturesque landscape as it is nestled beautifully between two hills and verdant forests. One can’t help but appreciate the natural beauty of this place which is replete with various flora and fauna along the dam and lake. Some popular activities for the tourists Mulshi Lake and Dam are hiking the hills, picnicking with your loved ones or enjoy boating in the lake. Although the place is located at a short distance away from the main city, it offers a perfect escape for the nature lovers in Pune.

Location:  It is located in the Mulshi taluka administrative division of the Pune district of Maharashtra State.
Best Time to visit: The ideal time to visit Mulshi Lake and Dam is during the monsoon months.
Entry fee:  There are no entrance fees to visit this place in Pune
Timings: It can be visited during the day from 9 am to 6 pm."
28,Dagdusheth Halwai Temple,"Dedicated to the Hindu God Ganesha, Dagdusheth Halwai Temple is one of the most famous Pune Tourist Places if you wish to add some spiritual essence to your vacation. The temple is one of the oldest Ganesh temples in India and was built by a local halwai called Shri Dagdusheth. It is considered that it was his dedication that inspired the construction of the temple and encouraged his friend Lokmanya Tilak celebrating the Ganesh festival. This festival paved to be an important event in India’s history and today celebrated with great fervour and gaiety. The beautiful temple has a humble architecture but resonates greatly with history and culture of this place. Being located in the centre of the city, Dagdusheth Halwai Temple is an important place in Pune to appreciate and take part in various events like music concerts, bhajans, and Atharvasheersh recitation which are held here.

Location: Shivaji Road, Budhwar Peth, Pune, Maharashtra
Best Time to visit: The most preferred time to visit this temple is from August to September
Entry fee: There are no entry fees to visit Dagdusheth Halwai Temple
Timings: Tourists can plan their visit here from 6.00 am to 11.00 pm"
29,Raj Dinakar Kelkar Museum,"Gear up to be fascinated by an amazing collection of Indian artefacts at Raja Dinkar Kelkar Museum in Pune. The museum boasts of having more than 20,000 artefacts which Baba Kelkar collected during his lifetime to leave behind a legacy for the future generations. One can see various paintings, handicrafts, musical instruments and a number of other objects of art collected from all over the world.A must visit for all the tourists in Pune, Raja Dinkar Kelkar Museum showcases various items that will leave you spellbound. One can see anything and everything here from door frames to musical instruments. For lovers of history, there are many artefacts which date back to the 18th and 19th century and makes for a wonderful revisit down the lanes of past.Location:  Bajirao Road, near Abhinav Kala Mandir, Pune, Maharashtra.Best time to visit: The museum is great for visiting throughout the year.Entry fee: The ticket fees to enter here are INR 15/ USD 0.23Timings: Raj Dinakar Kelkar Museum can be visited any day of the week from 9 am to 6 pm"
30,Rajiv Gandhi Zoological Park,"Go for an amazing outing with your friends and family to Rajiv Gandhi Zoological Park when you are in the city of Pune. The famous park is known for having a snake park, an animal orphanage and a zoo that makes it totally worth a visit for lovers of wildlife and nature. Whether you are an adult or a kid, a visit to Rajiv Gandhi zoological park is an exciting trip to learn more about snakes and reptiles and come back with more knowledge about these elusive creatures. Some famous animals which can be spotted here are a white tiger, leopard, blackbucks, elephants, sambhars etc. There is also a 13 ft cobra which gathers the most attention by tourists visiting the snake park inside the Rajiv Gandhi Zoological Park.Location: Satara Road, Near Bharati Vidyapeeth, Katraj, Pune, Maharashtra.Best Time to visit: Anytime throughout the year is good for visiting Rajiv Gandhi Zoological Park.Entry fee: The entry fees for an adult is INR 15/ USD 0.23 and for the children, it is INR 5/ USD 0.07Timings: It can be visited by tourists between 9.30 and 5 pm"
31,Lal Mahal,"This red colored palace is one of the most prominent attractions in Pune that you must add to your bucket list when you are visiting Pune. The place was built by the father of Shivaji, Shahaji Bhosale with the intention to revive the recently destroyed city of Pune in 1630 CE. However, the original structure was completely demolished in a series of attacks that befell Pune and now the structure that stands was only a part of original Lal Mahal once. The new Lal Mahal was thus rebuilt in an entirely new way near the Shaniwar Wada in Pune. When visiting the Lal Mahal, tourists can see a great collection of oil paintings that showcase various events in the life of Shivaji Maharaj. There is also a statue of Shivaji’s mother Jijamata and there is a popular place for recreation for kids at Jijamata Garden. Lal Mahal is also famous as the place in history where Shivaji Maharaj cut the fingers of Shaistekhan, the Mughal invader when he was trying to escape from the Lal Mahal.Location: Lal Mahal, Kasbapeth area, Pune, Maharashtra, India.Best Time to visit: Tourists can plan their trip to Lal Mahal any time throughout the year in Pune.Entry fee:  The cost of entering the place is INR 3/ 0.046 USD Per Person.Timings: The timings for the mornings are from 9:00 AM to 1:00 PM and for the evenings, the timing is from 4:00 PM to 8:00 PM"
