,Name,About
36,Baba Bhalku Railway Museum,"This museum is your best deal to gain knowledge on the reasons of construction of rail line in Shimla. There are several displays of machines and engines. Things like umbrellas, coats, and caps are exhibited in the museum which belongs to the time when the rail line was constructed and these were left in the waiting room. 
You will come across many interesting stories related to this construction which was life-changing for the people of Shimla and around.
Suggested length of visit: An hour is enough.
Timing: 9:30 AM to 4:30 PM on all days of the week except Monday.
Location: Old Bus Stand, Shimla, Himachal Pradesh 171001, India
Cost: Free of cost.
Distance from Shimla bus stand: Around 47 KM."
37,Scandal Point,"It is a major attraction on the westernmost tip of Shimla which falls between the mall road and the ridge at Shimla.  It lies right in the centre of the two busiest spots of Shimla and is difficult to overlook and it is one of the famous places to go in Shimla.The place has a very interesting love story associated with its name involving the Maharaja of Patiala, Bhupinder Singh the then viceroy’s daughter.Suggested length of visit: 2 hours.Timing: 6 AM to 8 PM on all days of the week.Location: Mall Road, Near Railway Building, Shimla, Himachal Pradesh, 171001, IndiaCost: No entry fee.Distance from Shimla bus stand: Around 2 KM."
38,Shimla Reserve Forest Sanctuary,"This reserve is around 11 KM from Shimla and is a hotspot for the nature lover. Tourists commonly spot barking deer, jackals, monkeys, bear, and leopards etc. You can find the best views of Himalayan peaks like Chota Shali, Deo Tibba, Bandar Poonch, Rakta Dhar and even the Pir Panjal ranges of Jammu and Kashmir from this forest reserve. 
It is an amazing place for photographers as well.Suggested length of visit:around 4 to 5 hours.
Timing: 9 AM to 6 PM on all days of the week.
Location: NH 22, Chharabra, Mashobra, Himachal Pradesh 171012
Cost: 25 per person, INR 10 for students with I-cards. INR 150 per Vehicle Charge, INR 100 for two-wheelers, INR 50 for Still Camera
Distance from Shimla bus stand:  15 Kms."
39,Skiing in Kufri,"Shimla is a winter sports capital of India and a skier’s paradise. The snow-laden mountain slopes in Shimla are the perfect destination for people who love skiing. There are various skiing stretches in Shimla which is blanketed in white snow and Kufri is one of them. 
Shimla is flocked with a tourist who enjoys winter sports for having the best slopes to roll down.Suggested length of visit: 2 to 3 hours.
Timing: 9 AM to 6 PM on all days of the week.
Location: Shimla, India
Cost: Starts at INR 300 onwards.
Distance from Shimla bus stand: Skiing is best done in Kufri and the ski ground is located around 13 KM from Shimla Bus stand."
40,Tattapani,"Tattapani is situated around 60 KM from Shimla and is one of the famous Shimla tourist places. Tattapani brims with options for a traveler like quaint temples, Himalayan caves, hot water springs, stunning trekking trails, suitable terrain and rivers to carry out activities like river rafting and rock climbing etc. 
The place is blessed with the presence of Sutlej River which adds a different charm to the entire valley.
Suggested length of visit: 2 to 3 hours.
Timing: 7 AM to 6:30 PM on all days of the week.
Location: Tattapani | Karsog, Mandi, 175009, India
Cost: river rafting starts from INR 1500 per head.
Distance from Shimla bus stand: Around 51 KM."
41,Pabbar Valley,"Pabbar valley is a little ahead of Shimla and can be accessed from Theog. The beauty of the valley lies in its meandering streams, lush green hills, and the pretty apple orchard belt. It has numerous trekking trails, some of which are unexplored and some of which are being taken up by many trekking companies and it is one of the best places to see in Shimla.The famous temple of Hatkoti is situated in this valley which attracts hordes of pilgrims during festivals.Suggested length of visit: Half a day.Timing: 6 AM to 6 PM on all days of the week.
Location: National Highway 22 By-Pass | Shimla District, Rohru 171207,
Cost: No entry cost.
Distance from Shimla bus stand: Around 3.2 KM."
42,Naldehra,"This small scenic town in Himachal Pradesh is known for its 9 hole Golf course. If you feel like splurging on such skillful sport then Naldehra is the places for you. Tourist also explores the famous points of this quaint town on a pony or by walking and it is one of the best places to go in Shimla.
The town is small and boasts of many verdant expanses of hills and vegetation.
Suggested length of visit: 2 hours minimum.
Timing: 8 AM to 6 PM on all days of the week.
Location: Post Office, Durgapur, Naldehra, Shimla, Himachal Pradesh, 171007, India
Cost: No entry fee but playing starts from INR 1000 per person.
Distance from Shimla bus stand: Around 25 Kms."
43,Horse Riding in Shimla,"Horse riding in Shimla is available at the ridge or in Kufri where you are taken to the Kufri Zoo, through mesmerizing Apple Orchard, dense forest of Hassan valley, Mahasu Peak etc and it is one of the best Shimla tourist places to visit.You are taken to points from where you get an uninterrupted view of the Pir Panjal and Dhauladhar ranges.Suggested length of visit: Depends on your itinerary and choice of hours.
Timing: 9 AM to 6 PM on all days of the week.
Location for horse riding: Shimla and Kufri.
Cost: Around 400 to 500 per half an hour.
Points covered: Apple orchard in Shimla, Kufri zoo, Kufri snow point etc."
44,Jakhu Ropeway,"The ropeway covers a distance of 8 KM from the ridge that comes along the way to Jakhu Temple and reaches the temple in around 5 minutes. The introduction of ropeway in Shimla has made traveling easy for the once trying to climb to be at the prestigious Jakhu temple and it is one of the best tourist attractions in Shimla.You get to ride the ropeway at 8054 feet above sea level which bestows some jaw-dropping views of the valley. The ropeway cabins are imported from Switzerland and it is the best way to traverse through some of the popular Shimla tourist places like Jakhu valley and Jakhu temple.Suggested length of visit: Around 1 to 2 hours.Timing: 9:30 AM to 7 PM on all days of the week.
Location: Jakhu, Shimla, Himachal Pradesh 171001, India
Cost: INR 250 for adults and INR 200 for children.
Distance from Shimla bus stand: Around 7 Kms."
45,Rothney Castle,"Rothney castle was the house of A.O. Hume, who was a political reformer and a very knowledgeable ornithologist. This architectural marvel is situated on the Jakhu hills and is very near to the Jakhu temple in Shimla and it is  one of the best places to see in Shimla.
The house boasts of extraordinary sceneries and green landscapes and is one of the major Shimla tourist places.Suggested length of visit: at least around 2 hours.Timing: 24 hours.Location: Sheeshe Wali Kothi, Jakhoo Rd, Lakkar Bazar, Shimla, Himachal Pradesh 171001, IndiaCost: Entry is free.Distance from Shimla bus stand: Around 8.5 Kms."
46,Prospect Hill,"Prospect hill is dotted with green meadows, numerous water bodies, and stretches of lush green panoramic valley. Prospect Hill is one of the religious places to visit in Shimla as it holds a very strong significant among the tourists who believe in Goddess Kamna Devi. 
The hill is shrouded with many stories of the Goddess and there is an ancient temple situated on the hills which are dedicated to Goddess Kamna Devi. If you are seeking a green escape, Prospect hill awaits your visit.
Suggested length of visit: An hour and a half.
Timing: 24 hours.
Location: Kamna Prospect Hill, Kamna Devi Temple Road, Chakkar, Shimla, Himachal Pradesh 171005, India
Cost: No entry cost.
Distance from Shimla bus stand: Around 4 KM."
47,Hawa Ghar,"Hawa Ghar is one of the very interesting places to visit in Shimla as it serves as an open balcony to fascinating vistas of Shimla. It is located at the ridge in Lakkar Bazaar which has quite a height and that enables some breathtaking views of the valley to the tourists. 
It is fondly called as the “Mall view balcony,” and is a hub for many activities in winters when the entire town is covered in snow.
Suggested length of visit: An hour.
Timing: 9 AM to 6 PM on all days of the week
Location: Kufri Chail Road, Near Himalayan Nature Park, Shimla, Himachal Pradesh, 171012, India
Cost: INR 10 per adult and INR 5 per child.
Distance from Shimla bus stand: Around 6.5 Kms."
48,Hip Hip Hurray Amusement Park,"This unique amusement park is located in Kufri at an elevation of 8500 feet above sea level. It offers a range of activities like Burma Bridge, Flying Fox, Rock climbing, Commando Net, Bumping boats, Rowing and Valley crossing etc and it is one of the best tourist attractions in Shimla.You can also indulge in ice skating, and boat on the snow-laden terrain in winters. If you get hungry by doing all this then there are multi-cuisine restaurants and coffee shop along with some local shops selling Himachali handloom work. 
The best part of this amusement park is the telescope which enables incredible views of the valley. It is one of the must-go places to visit in Shimla without any doubt.Suggested length of visit: at least 3 hours.Timing: 8:30 AM to 7:30 PM on all days of the week.
Location: 1 KM ahead of Kufri Bazar, Towards Fagu, Shimla, Himachal Pradesh 171001, India
Cost: INR 100 per person, INR 350 per person including rides,  and 160 per person including Go Karting.
Distance from Shimla bus stand: around 10 Kms."
49,Kasauli,"Kasauli is one of those picturesque places to visit in Shimla that offer an exclusive experience by themselves. Home to stunning colonial houses, splendid orchards, and the eminent Christ Church, the hill town is covered with pine and cedar trees.  Walking around the landscape of Kasauli, you are highly likely to come across several exotic and endangered species of fauna.Some of the must-visit places within Kasauli include but aren’t limited to Baptist Church, Monkey Point, Timber Trail, and Sunset Point at lover’s lane.Suggested length of visit: 2 daysTiming: All day, every dayLocation: 71.1 kilometres from Shimla in the district of SolanCost: No Entry FeeDistance from Shimla bus stand: 71.1 kilometres"
50,Solan,"Popularly known as the ‘mushroom capital of India’, Solan lies on the lower parts of the Himalayas and is a low-key destination, mostly suitable for travellers who wish to steer clear of the hustle and bustle of city life. During your visit to Solan, you will get a chance to explore several ancient temples and monasteries which are visited by several hundred worshipers from all around the country and it is one of the best tourist attractions in Shimla.Its massive contribution to the production of tomatoes has also yielded the town the title of the ‘city of red gold’. While here, do not miss the chance to pay a visit to the 300-year-old fort and the Shoolini Mata Temple and Jatola Shiv Temple.Suggested length of visit: 1 to 2 daysTiming: All day, every dayLocation: Himachal Pradesh, IndiaCost: No Entry FeeDistance from Shimla bus stand: 44.8 kilometres"
51,Mashobra,"One of the smaller towns located within Shimla, Mashobra is a must-visit among the many tourist places in Shimla. Dominated by misty hills, towering trees of pine, cedar, and oak, and a glistening stream gushing down the valleys, the place is pure bliss for weekend travellers as well as nature lovers. One of the most offbeat places to visit in Shimla, Mashobra is a haven for adventure lovers for it offers plenty of adventure activities to be enjoyed. Some of the activities that you can enjoy during your time here include trekking, quad biking, paragliding, rappelling, and skiing.Suggested length of visit: 1 dayTiming: All dayLocation: Shimla, Himachal Pradesh, IndiaCost: No Entry FeeDistance from Shimla bus stand: 12.1 kilometres"
52,Fagu,"Located 2,500 meters above the sea level, Fagu is blessed with snow-clad peaks, breezy atmosphere, and the majestic Himalayan range. Almost always encompassed by mist and fog, Fagu is as magical as it is romantic. Being so close to the clouds, it gives you a feeling that you are literally walking on the clouds when you are exploring the stunning peaks of Fagu and it is one of the best Shimla tourist places to visit.Home to a myriad of flora and fauna, Fagu boasts of many pine and cedar trees and beautiful apple orchards.Suggested length of visit:1 dayTiming: Anytime, any dayLocation: Shimla, Himachal Pradesh, IndiaCost: No Entry FeeDistance from Shimla bus stand: 19.9 kilometres"
53,Shoghi,"A small town in the suburbs of Shimla, Himachal Pradesh, Shoghi is a perfect place for overnight camping. There are several hotels and resorts offering camping facilities around the area, however, you can choose to enjoy camping at the Shoghi camp.  Shoghi is also one of those tourist places in Shimla which is blessed with lush greenery and an amazing climate. Suggested length of visit: 1 to 2 daysTiming: AnytimeLocation: Shoghi is a small town in Himachal Pradesh which is located 14.1 kilometres from Shimla.Cost: No Entry FeeDistance from Shimla bus stand: 14.1 kilometres"
54,Johnnie’s Wax Museum,"Popularly known as Himachal Pradesh’s first wax museum, Johnnie’s Wax Museum ranks highly in the list of Shimla Tourist Places. A great hit among children and family vacationers, the wax museum houses wax replicas of many notable movie stars and important personalities of India and the rest of the world.Some of the most likeable wax replicas at the museum include Mahatma Gandhi, Steve Jobs, Harry Potter, James Bond, and Tony Stark. To make your visit to the museum truly memorable, Johnnie’s Wax Museum lets you get a wax replica of your hand. Suggested length of visit: 1 to 2 hoursTiming: 10:00 AM to 10:00 PM, All the days of the weekLocation: Near willow Bank, Mall Road, The Mall, Shimla, Himachal Pradesh, IndiaCost: INR 250 per person, children below 5 enter freeDistance from Shimla bus stand: 1.8 kilometresAlso Read: Best Trekking Trails in Shimla"
