,Name,About
0,The Lake Palace,"The Lake Palace in Udaipur is located on the Jag Niwas Island on a sprawling 1.5-hectare land. This magnificent structure was built on the Lake Pichola by Maharana Jagat Singh in 1734. Once a summer palace for the royalty of Udaipur, it has now been converted into a heritage hotel.Still retaining the grandeur, it resembles a fairy tale kingdom. Enhancing the magical aura are the rippling waves and the beautiful sunset. The intricate craftsmanship and aesthetic handicrafts and textiles add to the beauty this place. The elegant white marble palace is a fantasy as it arises softly from the blue waters. 4 acres of rock have been used to lay the foundation of this palace and was known as Jag Niwas after its founder. The palace highlights include fountains, gardens, pillared terraces, painted mirrors, pink stone work, lotus leaves and cusped arches. Dhola Mahal, Bada Mahal, Phool Mahal, Ajjan Niwas and Kush Mahal are some of the apartments in here.There are various facilities available in the palace for the guests like the swimming pool, bar, restaurants, café and conference hall. There is also a 24-hour business center and 8 meeting rooms with fully updated equipment for corporate meetings and conferences. In here are 12 banquet halls for cocktail parties, wedding and other related functions. Distance from the City:2 kmsLocation: Pichola, Udaipur, Rajasthan 313001"
1,City palace,"The City Palace in Udaipur in the state of Rajasthan has a lot in its store to reveal the age-old history it possesses. The royal building is a huge complex with plenty of rooms and pillars inside. It took more than 300 years to complete the structure properly. Started during the time of Maharana Udai Singh II. The lake Pichola nearby is the highlight when you get ready for a tour of the greatest places to visit in Udaipur. Since it is the biggest building in Udaipur it is considered as one of the best sightseeing destinations.  The flamboyant structure with a blend of Mughal and Rajasthani architectural style dominates other famous palaces and buildings around the city very authentically. It is located on a hilltop where you can enjoy a real panoramic view of lake Pichola and the Lake Palace on the banks of this particular lake.
Distance from the City: 3kmsLocation: Udaipur, Rajasthan, India"
2,Lake Pichola,"This is one of the most important places to visit in Udaipur. Lake Pichola is the reason we call Udaipur the ‘City of Lakes’. Built in 1362, and extending 3 miles in length and 2 miles in breadth, this lake is an essential part of Udaipur and far by its best feature. Astonished and amazed by the beauty of Lake Pichola, Rudyard Kipling once wrote: ""If the Venetian owned the Pichola Lake, he might say with justice, `see it and die'"".
Take Kipling at his word and visit Lake Pichola when in Udaipur, both in the day and at night. the lake takes on a whole new character depending on the time of the day. In the morning, lake and palaces are quiet. The lake is speckled with tourist boats and people clicking selfies line the shores. As night creeps in, all the Palaces around the lake light up and illuminate the lake. No boats, no birds, nothing to see except the lit-up palaces as they stand impressively around the lake. It is an awe-imposing spectacle.
The iconic sites around the lake include Udaipur City Palace, Mohan Mandir, Eklinggarh Fort, Jag Mandir, Pichola Palace etc. The Sitamata Game Sanctuary is located on its western shore.Distance from the City: 5 kmsLocation: Udaipur, Rajasthan"
3,Jagdish Temple,"Built by Maharana Jagat Singh in 1651, Jagdish Temple, situated within the Udaipur City Palace is another one of the great works of architecture from the olden days. It has finely carved pillars, beautifully decorated ceilings, gorgeously painted walls, and spacious halls and corridors. Apart from this, the architectural expertise also extends itself to the pyramidal spire, mandap (prayer hall) and the porch. There are 50 finely carved pillars, each on the first and the second floors of the three storey temple.
The main shrine, dedicated to Lord Vishnu, is reached by climbing 32 marble steps and it is encircled by minor shrines of Lord Ganesha, Sun God, Goddess Shakti and Lord Shiva respectively. All the fine details of the palatial temple are built in accordance with the Vedic Vaastushastra, which speaks of the science of building. The entire structure today serves not only as a place of worship but also as an initiation into the culture of the people of the past.
It shows how highly they regarded architecture as a means of expression of sentiments; the construction of this temple cost Jagat Singh 1.5 million rupees. It is a magnificent temple and a must see when in Udaipur. Do include a visit to this temple on your visit to the City Palace. It is open practically all day- from 5.30 am to 10pm.Distance from the City: 3.3 kmsLocation: City Palace, Udaipur"
4,Monsoon Palace,"Sitting on a hill just outside the main Udaipur city is the Monsoon Palace, undisputedly one of the best places to visit in Udaipur. The palace was built in 1884 by Maharana Sajjan Singh in order to be able to monitor the approaching monsoon clouds better. Monsoon Palace is a majestic piece of architecture. It is built with white marble and has light, wide corridors and rooms within. But the best thing about the palace is the view from its windows.
Monsoon Palace looks down at Lake Pichola and beyond the lake is a panoramic, birds-eye view of the city of Udaipur embraced by the Aravalli range. Words cannot describe the beauty of this scene adequately enough. The view is enhanced multi-folds s during the monsoon season. During the rainy season, Monsoon Palace is uniquely suited to present to the visitor the majesty of Udaipur as dark clouds descend upon it.
It is truly a scene to remember. But on the other hand, sunsets here are also absolutely fantastic. Try to include at least one sighting on your visit. The palace is circled by the Sajjangarh Wildlife Sanctuary, so you can stroll through the sanctuary inhabited by Tiger, Nilgai, Sambhar Deer and various other animals.
Distance from the City: 5km from the main town
Location: Outskirts of Udaipur
Open: 9.40am to 6.30pm"
5,Fateh Sagar Lake,"The Fateh Sagar Lake is known to be the second largest lake in this city, is located on the northern side of Lake Pichola and is just opposite the entrance to Moti Magri Mahal. This artificial lake was built by Maharana Jai Singh in 1678 and got its name from Maharana Fateh Singh. This water body has a depth of 11.5 metres and extends 2.4 km in length and 1.6 km in breadth.There are three intake channels and one overflow channel in the lake that actually comes in play during the monsoon season. The three small islands on the lake can be easily reached by a boat. The large island on the lake has a garden and a boat shaped restaurant named Nehru Park. This island also has a small zoo and is a favourite picnic place for the local people. The second island on the lake has been converted into a beautiful garden with a lot of water jet fountains and is looked after by the government of the state. The third island is managed by the Udaipur Solar Observatory which is known as the best solar observing site in Asia.This is a quiet place and one can enjoy a boat ride here. The beautiful lake is encircled by hills on all the three sides and offers a stunning view which is considered to be places to visit in Udaipur.
Distance from the City: 6 kms"
6,Vintage Car Museum,"The vintage car museum in Udaipur was unveiled for the general public on 15th February 2000 and is one of the places to visit in Udaipur. This inauguration has allowed the local and foreign visitors to appreciate the collection of cars of the Maharanas of Mewar. The vehicles in the museum are more than 70 years old but each have been beautifully restored and live in to tell the story.
The vintage car collection is placed in the Mewar State Motor Garage. This place is also home to a famous garden restaurant, The Bougainvillea. This motor garage is semi-circular in shape and with its forecourt is housed inside a bigger courtyard. There is an old Shell petrol pump inside the garage which is still in working condition. This garage was built during a time when only the Maharanas of Mewar had owned the cars.Location: Near By The Garden Hotel, Gulab Bagh Rd, Shakti Nagar, Udaipur, Rajasthan 313001Distance from the City: 3.2 kmsTimings: 9 am to 8 pm"
7,Jaisamand Lake,"Lake, also popular as Jaisamand Lake. This is the second largest artificial lake in Asia with an area of 87 square kilometres. The lake is surrounded by the Jaisamand Wildlife Sanctuary. As a result, the entire location is very scenic and peaceful. The huge lake was built in the 17th century by Rana Jal Singh, who constructed a marble dam across the Gomti River, thereby creating this lake. There are three islands in this lake which are home to the tribes of Bhil Minas.
Thanks to the nearby sanctuary, the aquatic life of the Jaisamand Lake is fertile too. The whole lake is a magnificent structure but its bund is perhaps its most striking feature. It is no exaggeration to call it gigantic at 202 feet long, 116 feet high and 70 feet broad (at the base). All along the marble dam are quaint little attractions like the Shiva temple, the elephant statue made of marble, and six exotic cenotaphs (marble chattris).
And crowning the lake stands the grand palaces of the Queens of Udaipur. The lake is a marvellous example of riverine architecture and a place to behold. Visit it in the winter months for the best possible experience. You can take boat rides on the lake for as little as 30/- INR. And then you can stop by the Jaisamand Wildlife Sanctuary and experience the wildlife there.Distance from Udaipur: 75 kmsLocation: South of Udaipur, Udaipur District"
8,Jagmandir,"Known as Lake Garden Palace, Jag Mandir has been built on the island of Lake Pichola. The construction of this structure has been credited to the three Maharanas of Mewar. This palace was started by the Maharana Amar Singh in the year of 1551 and was later carried on by Maharana Karan Singh and completed by Maharana Jagat Singh. Hence it is called Jagat Mandir or Jag Mandir.
Serving as a summer resort and pleasure area for the royal family of Mewar, this place is also famous for holding parties and wedding functions. In here you will find Gul Mahal, Darikhana, Garden Courtyard, Bara Patharon ka Mahal, Zenana Mahal, and Kunwar Pada ka Mahal.   
Jag Mandir is the main palace and it includes the Gul Mahal. The towers at the corner are octagonal in shape and have cupolas on the top. Residential suites, reception halls and internal courts adorn the palace.
The architecture of the building reflects Mughal and Rajput style. The Zenana Mahal is constructed adjoining to the main temple and the Kunwar Pada ka Mahal is located at the western end of the structure. The Gul Mahal was built by Maharana Amar Singh and it was developed by Maharana Jagat Singh for housing the Mughal prince Khurram. The palace has been built with sandstone, black marble, and has a crescent of Islam fixed on the dome of the structure.Location: Pichola, Udaipur, Rajasthan 313001Distance from the City: 1.2 Kms"
9,Maharana Pratap Memorial,"This is one of the famous, low-key sites in Udaipur. The Maharana Pratap Memorial was built by Maharana Bhagwat Singh Mewar in memory of the legendary Maharana Pratap. The central figure of the memorial site is that of Maharana Pratap mounted on his horse and loyal friend, Chetak. The statue is symbolic because it tells a story of courage and faithfulness and deep love between humans and animals. Both Maharana Pratap and Chetak are the heroes of this story.Apart from this statue, the memorial also has statues of other members of Pratap’s court like Hakim Khan Sur, Bhamashah, Bhilu Raja, and Jhalaman. The memorials are set in the landscaped Japanese Rock Garden. You can take a pleasant stroll around the entire garden, stretch your legs, and look down from Moti Magri to the city around you. The remains of an old Udaipur Fort nearby are an added attraction to the already picturesque landscape.Photographers, make sure your batteries are charged and your focus is set because you are going to take a lot of pictures out here. The place just calls for them. Early morning or evening is a good time to visit the memorial. Avoid scorching afternoon heat and if you go in the evening, you get to watch the light and sound show too. A win-win situation.Location: Moti Magri, Udaipur
Distance from the City: 2 Km"
10,Haldighati,"This place deserves a visit for the dramatist and historian in you. Haldighati is a mountain pass in the Aravalli range, connecting the districts of Rajsamand and Pali. It gets its renown for the battle of Haldighati that took place between Rana Pratap Singh of Mewar and Raja Man Singh of Amber in 1576. It was a singularly ferocious battle that is still alive in the memory of Rajasthan. A marble chattri is located 4km from the site with a marble statue of Chetak, the faithful horse of Rana Pratap Singh, nearby. Chetak is said to have fallen during this battle. This statue honouring his death was put up by Maharana Pratap in 1576.The place gets its interesting name from the yellow colour of the sand which looks like turmeric (haldi). Other interesting places close to Haldighati that you can tour are Balicha Village which is famous for its terracotta crafts and Badshahi Bagh, famed for its Chattri-Gulab and a place where you can get your hands on some rose water and Gulkand which is touted to have amazing medicinal properties.Distance from Udaipur: 40 kmsLocation: Haldighati"
11,Saheliyon Ki Bari,"Saheliyon ki Bari is a beautiful garden in the city of Udaipur and is one of the popular Udaipur tourist places. Fountains, marble art and the lush lawns attract the public each time. Saheliyon ki Bari in English means the ‘garden of maids’. This garden represents a green retreat of Maharana Sangram Singh in the desert lands and was built in the 18th Century for the royal ladies of Mewar. It is situated on the banks of the lake Fateh Sagar and is one of the stunning places to visit in Udaipur.
According to the legend here, the garden was personally designed by the king and gifted to his queen. The queen had 48 maids accompanying her after the marriage and to offer them peace and happiness away from the regular life, this garden was built.
There are four water pools, marble elephants, fountains and kiosks around the here. The bird fountains and the lotus pool are very popular. The stunning and romantic view of the garden makes it a special place for lovers. Rain fountains were added to the garden later by Maharana Bhopal Singh.Location: Saheli Marg, New Fatehpura, Panchwati, Udaipur, Rajasthan 313001Distance from the City: 4.5 kms"
12,Shilpgram Fair,"Shilpgram is a crafts fair and is organized annually in the west side of the city of Udaipur. It aims to promote the art, craft, textile and handicrafts of Rajasthan. This state is famous for handicrafts, bandhej, tie and dye, mirror work and embroideries. Camel leather items, hand woven clothes are some other items that are highlight of this fair.
The gala is usually held during the month of November or December and continues for 10 days. This fair encourages local designers, potters and other visual artists. There are a lot of workshops held for those who are interested in learning the art and craft of Rajasthan.
Shilpdarshan is also organized at the Shilpgram fair in Udaipur. This program is organized to make the public understand the traditional skills and help in selling the local art works. There is a Crafts bazaar at this fair that helps in selling the Rajasthan handicrafts and souvenirs. Tourism is the main stay of income in this state and the government desires to uplift the condition of the rural areas of the state.
Fair held in: November or December"
13,Udaipur Solar Observatory,"Udaipur Solar Observatory is known to be the best solar observing arena in the whole Asia and is one of the celebrated places to visit in Udaipur. This is situated in the island of the Fateh Sagar Lake and has been designed on the model of the Solar Observatory, Big Bear Lake in California.
This place was established under the care and expertise of Dr. Arvind Bhatnagar and the Vedshala Trust of Ahmedabad. The observatory aspires to do research in Modern science and is the main lace to develop the solar physics in India.
As the island is surrounded by water on all sides it offers a perfect atmosphere for solar observations. Sharp images of the sun can be acquired easily on an island because the air turbulence is lesser on an island than on the normal ground. The other advantage is that this observatory is located in Rajasthan that receives maximum exposure to sun.    
There is a range of telescopes on display that will give a person perfect observation of sun. This observatory has added a new instrument namely, the “solar vector magnetograph”. This instrument will be helpful in determining the magnetic field of the active regions.Location: Rani Rd, Near Fatehpur Lake Fatehpur to Badi Talai, Shilpgram, Udaipur, Rajasthan 313001Distance from Udaipur: 7.5 kms"
14,Crystal Gallery,"The Crystal Gallery is housed inside the Fateh Prakash Palace and is a world famous gallery. It is spread across the upper gallery of the main Durbar Hall Sabhaghar and has been hailed as the single largest private collection of crystal across the world.
This is a very exclusive and exquisite crystal collection and was built by Maharana Sajjan Singh in 1877. It was ordered from a company based in Birmingham. This collection includes perfume bottles, dinner ware, glasses, objects d’art, furniture, decanters and much more. It also has a crystal bed which is only a single piece in this world. This crystal collection has been customised for the royalty of Mewar and all the objects have the crest of Mewar etched on it carefully.  
There is an audio guide service available at the gallery for the tourists. It narrates the history and small anecdotes about the Shriji Arvind Singhji, the crystal ware and the royal Mewar family. There is a restaurant at the gallery for refreshments and photography is strictly prohibited.
Timings: 9am to 7 pmPhotography: Not allowedEntry Fee: YesAudio Guide: Yes"
15,Dudh Talai Musical Garden,"Dudh Talai Musical Garden is a small pond surrounded by a rock garden which is supposed to have a musical fountain in it. This garden is situated within the city and you can easily stop by for 10 to 15 minutes. While the setting of the garden is good, the best part about it is the wide-ranging view visible from here. Lake Pichola is located nearby and you get to see the Udaipur City Palace at a very good angle from this point.Camel rides and horse rides are also available and you may also go boating on the pond. One high point of the location is the ropeway connecting it to the Karni Mata Temple. The location of this garden is good for photography.Location: Near Lake Pichola
Visiting Hours: 8.00 A.M. to 10.00 P.M."
16,Bagore Ki Haveli,"Bangore ki haveli is a beautiful palace in Udaipur on the waterfront of Lake Picholi and is an amusing spot among the tourist places in Udaipur.  It was built during the 18th century and still holds the pride and majestic attitude of the royal family of ancient rulers in a perfect manner. It consists of more than a hundred rooms along with the displays of costumes and modern art. It houses the famous paintings of the Mewar regime inside the Queen's chamber. In addition, the palace is filled with pieces of art on glass. Wide corridors, windows and spacious rooms enhances the attractiveness of the palace to a higher level. The Rajput clans' presence is still preserved inside the palace in the forms of jewellery boxes, hukkas, pan boxes and the furniture items used during that period. This is a perfect place to witness the proper Rajput architectural styles displayed very well.Distance from the city: 4.5 kmsLocation: Gangaur Ghat Marg, Udaipur, Rajasthan"
17,Eklingji Temple,"The Eklingji Temple Complex is one of the architectural sights you need to put on your list of places to visit in Udaipur. It is a complex whose foundation dates back to 734 AD. The first temple of the complex was built back then by Bappa Rawal and dedicated to Eklingji. Eklingji is a form of Shiva and the complex is full of figurines of Shiva along with figurines of Parvati, Saraswati, Ganesh, Kartik and Nandi.
Over the time, the complex has grown to house 108 temples, all of them are made out of marble and granite with complex designs cut into the stone. The sole temple of the Lakulish sect in India, known simply as the Lakulish Temple and built in 971 is also housed here. This complex is a not just a place for history enthusiasts and people who want to pay their respects in the temple. It is a place full of memories of a distant past; a time when modern technology could not aid in the construction of complicated buildings.
The main temple, built in the 15th century, has a structure topped with elaborate domes that will boggle your mind. Appreciation for the marvellous stone work will be the overwhelming sentiment you experience when you walk around the 108 temples. You can understand the time at which the temples were built through the plaques outside the respective temple or you could hire a local guide to walk you around the complex.Distance from the City: 22km from UdaipurLocation: Kailash Puri, Udaipur District"
18,Bada Mahal,"Among the most prominent places to visit in Udaipur, the Bada Mahal or the City Palace is a 17th-century architectural magnificence that is a splendid structure that stands for the royalty that is characteristic of the state of Rajasthan. This 27 meters high framework has been embellished with intricate designs, beautiful carvings and mirror art throughout the complex. Several fountains inside the complex give it a refreshing feel. There are high vaulted ceilings, sprawling corridors, courtyards, beautiful balconies and several carefully manicured gardens that add to its grandeur.Location: City Palace, Udaipur, Rajasthan 313001Distance from city: 6 kmTimings: 9:30 AM to 5:30 PM throughout the weekPrices: Rs 30/- for adults             Rs 15/- for children             Rs 200/- for camera"
19,Mansapurna Karni Ropeway,"The Mansapurna Karni Ropeway connects the Sri Karni Mata Temple at Machala Hill and the Deendayal Upadhyay Park in Udaipur. The Temple which was on top of a hill was not easily accessible for many, especially the elderly because of the tedious climb up the steep hill. But with the launch of the ropeway has been easier for many to visit the Temple. Besides its obvious usefulness, the ropeway is a perfect way to get the most spectacular view of the City of Lakes. The cable car ride offers the best view of the most popular places to see in Udaipur such as the City Palace, Lake Pichola, Fateh Sagar Lake, Sajjangarh Fort and the surrounding Aravalli Ranges. Location: Jawahar Nagar, Pichola, Udaipur, Rajasthan 313001

Distance from city: 5.4 kmTimings: 9 AM to 9 PMPrices: Indians- Rs 72/- (adult), Rs 36/- (children)             Foreigners- Rs 300/- (adult), Rs 150/- (children)"
20,Tiger Lake,"Tiger Lake is also popularly known as Badi Lake and it was built in the 17th century by Maharana Jai Singh to counter the after effects of droughts in the area. Today it has become one of the most visited tourist places in Udaipur for its serene beauty and cleanliness.The area around the lake is perfect for a picnic and there is also a hiking trail that leads on a refreshing walk past the villages and up a hill. It is located about 12 kms away from the city center and offers a tranquil and calm environment away from the hustle and bustle of the main city. It is called Tiger Lake because of the many tigers that used to wander around the area a long time ago. Location: Lake Badi, Udaipur, 313011Distance from city: 12 km"
21,The Wino,"The Wino is a popular bar in Udaipur serving some of the best selection of international wines, whiskies, vodkas and local drinks. It is one of the best places in Udaipur to unwind and relax after a full day of sightseeing and explorations. It has a very relaxing and refreshing ambience suitable for friends and family.  The bar is a great place to enjoy an evening out and it has something special to offer for everyone. They serve a great selection of both alcoholic and non-alcoholic beverages. For those looking for some fresh organic vegetable or fruit juices to rehydrate after a day in the sun, The Wino is the perfect place to be. Location: Daulat Chamber, 65, M.G.college Near, Sardarpura, Udaipur, Rajasthan 313001Distance from city: 4 km"
22,Panera Bar,"This place has a marvelous view of the Udaipur sunsets. Customers enjoy mouth-watering delicacies while watching the sun bleeding colors into the sky, turning it into a whirl of hues blending into one another. The place has a traditional décor that is inviting and the outdoor area has a pool too. A large variety of alcoholic drinks are available here that one can enjoy with their feet dipped in the chilly water of the pool. They also serve several cuisines, local as well as international. It is one of the most popular places to visit in Udaipur among the youth. Location: The Shiv Niwas Palace, Udaipur, RajasthanDistance from city: 3.5 km"
