,Name,About
23,Tehkhana RestroBar,"Tehkhana RestroBar is one of the most popular bars in town. The ambiance and the crowd are chic and happening. The retro bar is famous for its Happy Hours and DJ nights held on a fairly regular basis. Another attractive feature that this bar has is they put up a large screen TV for major sporting events where friends and families can get together to watch their favorite sport while sipping on their choice of beverages. It is also one of the best tourist places in Udaipur to enjoy a relaxing evening without putting a big dent in your holiday budget.Location: Hitawala Complex - IInd, 1/A, Saheli Marg, Panchwati, Udaipur, Rajasthan 313001Distance: 4.5 km"
24,Club Volcano,"Club Volcano is exactly what its name suggests, volcanic. It is a high energy, youthful, chic nightclub with the best collection of Jazz music and creative cocktails. It is a great place to unwind and spend the night grooving to some loud trendy music. The decor here is more chic and upmarket catering mostly to the urban youth. It is one of the best places in Udaipur for a nightcap. The Mojitos and Sangrias here are specially recommended. Club Volcano is large and spacious, perfect for a party or get-together as well. Location: New Fatehpura, Panchwati Udaipur, 313004Distance from city: 5 km"
25,Aangan Bar,"Aangan Bar is one of the best places to visit in Udaipur. It is completely different from all the other bars and nightclubs in the city. The bar has an open kitchen and while you sip on some chilled beer, you can enjoy the wonderful cultural performances such as folk dances, puppet shows, horse dance and other cultural delights. The Rajasthani decor adds to the ambience and the food served is authentic Rajasthani cuisine. They also serve a wide selection of wine, vodka, rum, whisky, gin, cocktails and mocktails. The terrace bar also offers a fantastic view and excellent ambience for a relaxing evening. The traditional Indian puppet show is the highlight of Aangan Bar.Location: B-1 Ambamata Scheme Opp. Aravali Hospital, Malla Talai, UdaipurDistance from city: 7 km"
26,Charcoal by Carlson,"As the name implies, they are specialists in everything cooked on Charcoal. They cook veg and non-veg on their barbecue and in tandoor. They even grill up some vegan options. They also provide genuine Rajasthani food and always have something new and exciting on the menu. At Charcoal, by Carlson, they love to try new food and love it, even more, when they find something they like to share with you. Some dishes are seasonal and will never find its way into their menu and will only be presented here and on the restaurant blackboard. Once in a while they also have a special food festival weekend with a certain theme of food and music, so make sure to check back for new things. This is one of the places to visit in Udaipur to get your taste buds tingling.
Distance from airport: It is 22km from the airport and can be reached by taking a cab or a bus which will not be hard in your pocket.
Location: 12, Behind Jagdish Temple, Lal Ghat Rd, Udaipur, Rajasthan 313001
Open Timings: 7AM–11PM
Cost: Above INR 2000(USD 30 and above) for two.
Main Cuisine: A range of meats and vegetables are cooked on charcoal grills at this stylish BBQ restaurant."
27,Sheesh Mahal,"Sheesh Mahal is a two-level, open-air fine-dining Indian restaurant, overlooking the lake. Sheesh Mahal mirrors the true essence of the kitchens of India and elevates fine dining to another level. They welcome you to feel like royalty as you enjoy Indian flavours to their authentic best. Using recipes mastered in royal kitchens, with contemporary nuances added to them, the two-level restaurant takes diners through a journey of exquisite Indian flavours. The ambience of the open-air restaurant glitters under a clear sky full of stars. Added to it, the evening glow of candles in various hues adds a resplendent touch of a bygone era.
Distance from airport: It is 25 km from the airport and can be reached by taking a cab at a price of INR 200(USD 3).
Location: The Leela Palace, Lake Pichola, Udaipur, Rajasthan 313001
Cost: Above INR 2500 (USD 35 and above)
Open timings: 11 AM–11PM
Main Cuisine: The Alfresco settings caressed by the cool breeze from the lake, and the magical charms of the city views will redefine the essence of fine dining here."
28,Aravali Lakeview by Radisson,"Aravali Roof Top is a luxury dining restaurant that falls under the prolific Carlson Group of Hotels and offers multi-cuisine dishes of fine taste and supreme quality. The menu offers various offerings, especially handpicked by the skilled chefs so that you can enjoy a posh dinner or lunch with your family and friends, without giving a second thought to how the dishes would taste. The fabulous ambience that is out of this world fully complements the standards of the place and instantly lightens up your mood. An addition to the offering is a well-set bar and a breezy rooftop that make the place best of both the worlds.
Distance from airport: It is 26 km from the airport and be reached by taking a cab or an auto rickshaw at pocket-friendly prices.
Location: B-1, Near Fateh Sagar Lake, Opp. Aravali Hospital, Ambamata, Udaipur, Rajasthan 313001
Cost: Above INR 3000 (USD 45) for two.
Open Timings: 7PM–11PM.
Main Cuisine: Aravali Roof Top Restaurant pairs contemporary cuisine with stunning lake views and amazing palette of food."
29,Khamma Gani Restraunt,"Khamma Ghani Restaurant having 5-star ambience is one of the best fine dining destination. Appealing to the eye this multi-cuisine restaurant does stimulate the senses fully. They serve delicious flavours from all across the globe be it Traditional Indian, Chinese, Continental Vegetarian and Non-Vegetarian food with an exotic range of mocktails all under one roof with the soothing environment. You will find the best place to dine with your friends and family and it is one of the fabulous places to visit in Udaipur for exquisite dining.
Distance from airport: It is 25 km from the airport and be reached by taking a cab or an auto rickshaw at pocket-friendly prices witching an hour.
Location: No 63, Rang Sagar Lake, Udaipur, Rajasthan 313001
Cost: Above INR 2500 and above ( USD 40 and above)
Open Timings: 8PM–11PM
Main Cuisine: Khamma Ghani Restaurant having 5 star ambience is one of the best fine dining destination."
30,White Terrace Restaurant,"White terrace restaurant brings together both modern comforts and traditional style. Ideally located with a panoramic view of Jagdish Temple, Gangaur Ghat, City Palace, Lake Palace, Jag Mandir and Sajjangarh Fort. White terrace serves excellent multi-cuisine delicacies to the guests. Pamper your taste buds with the mouthwatering food of the White terrace during your stay in Udaipur. One who wants to stay with Lake View and peace they prefer this most visited tourist attraction in Udaipur. Restaurant White terrace is a place where you can experience the five basic elements of the body - Earth, Water, Air, Sky and Fire to wholly absorb your body and soul.
Distance from airport: It is 26km from the airport and can be reached by taking a cab for INR 250 (USD 3).
Location: 85, Gangaur Ghat, Udaipur, Rajasthan 313001
Cost: Above INR 1200 (USD 20 approx) for two.
Open Timings: 11AM–11PM
Main Cuisine: White Terrace Restaurant is a popular tourist destination in Udaipur which serves a wide range of Rajasthani and continental foods."
31,Hathi Pol Bazaar,"Hathi Pol is a local market in Udaipur that you should definitely visit when looking for indigenous arts and crafts as the place epitomises the rich Rajasthani culture at its best. It's most famous for its folk art, miniature paintings, authentic souvenirs and wooden handicrafts and if you're an art lover, you cannot miss the Phad and Pichwai paintings in particular. Also look out for colourful ‘Nagra’ slippers that are made from camel skin and are beautifully embroidered and is one of the important tourist attractions in Udaipur.
Distance from airport: It is 30 Kms from the airport and can be reached taking a cab.
Location:  Hathipole, Chamanpura, Udaipur, Rajasthan 313001
Open Timings: 9.30 am to 5.30 pm
Main Cuisine: The famous Pichwai and Phad paintings of Rajasthan, apart from other miniature paintings and traditional Rajasthani artwork can be purchased here.
Entry fees: Free entry."
32,Bada Bazaar,"This vibrant Indian bazaar is full of small shops selling textiles, leather and jewellery. Visitors are likely to find some great local crafts at extraordinarily cheap prices. Pick up a pair of evening slippers for INR 700(USD 5), souvenirs for pennies or a kurta blouse. Conservative shoppers who are willing to pay for designer clothing, quality and reliability should stick to the Rajasthan Government Emporium, located just outside the City Palace Complex, or the more expensive Shopping Arcade located inside the complex. Brightly coloured traditional clothes available every 20 steps you take through the bazaar would make great souvenirs for your loved ones. These traditional clothes are available in batik and handprints. Dyed saris and textiles are also a good deal and this is one of the compulsory places to visit in Udaipur.
Distance from airport: It is km from the airport.
Location: 12, Maldas St, Nada Khada, Udaipur, Rajasthan 313001
Open Timings: 9.30 am to 5.30 pm
Main Cuisine:  Lake Pichola, Lake Palace, City Palace and City Palace Government Museum, Eklingji Temple and Fateh Sagar Lake surrounded the market. Rajasthani silks like bandhani and batik prints are available at cheap rate.
Entry fees: Free entry."
33,Chetak Circle,"Chetak Circle is a popular market in Udaipur. The hub of shopping in the City of Lakes, foreign and domestic visitor crowd the market. It is reputedly one of the places to buy beautiful remembrances of holidays in the appealing city. The popular product found within the retailers of Chetak Circle are folks toys, enamel or Meenakari work, dhurries, tie-dye and block-printed materials, decorated baggage and wear, silver jewellery and paintings. Brass wares, salutation cards, valuable stones, traditional jewellery boxes that are superbly painted, hand stitched papers are the most sought items. Don’t miss this enriching expertise since it provides tourists the chance to urge an inspiration a few typical native bazaar of Rajasthan.
Distance from airport: It is 22 km from the airport and can be reached by hiring a cab in an hour.
Location: Chetak Cir, Zinc Park, Udaipur, Rajasthan 313001
Open Timings: 9.30 am to 5.30 pm
Main Cuisine: Chetak Circle makes a wonderful display of Paintings, especially miniature paintings created on marble, wood and silk, ivory and silk and paper which are the major draw of the bazaar. Entry fees: Free entry."
34,Rajasthali,"If you are running short on time and want to do some quick shopping, head to Rajasthali, a handicraft emporium run by the Rajasthan Government to promote the folk arts and handicrafts of the state. Showcasing everything from fabrics to puppets and jewellery to footwear, Rajasthali is a good place to discover all the myriad colours of Rajasthan. Pick up that colourful jootis that caught your fancy and that oxidised silver pendant you have been wanting forever. Save yourself the hassle of bargaining as these shops are fixed price and assure the value of your money.
Distance from airport: It is 22km from the airport.
Location:  Hospital Road, Chetak Circle, Near Chetak Cinema, Madhuban, Udaipur, Rajasthan 313001
Open Timings: 10AM–7PM
Main Cuisine: It is a one-stop shop for both traditional and contemporary crafts of Rajasthan – Furniture, Textiles and Furnishings, Brassware.
Entry fees: Free entry."
35,Nathdwara Temple,
36,Bapu Bazaar,"The colorful Bapu Bazaar has everything that tourists look for during the shopping excursions in Udaipur. The market has several local handicrafts, authentic and intricately decorated Rajasthani fabric and traditional dresses, exquisite pieces of jewelry, local utensils, traditional footwear, etc. This place is a must-visit among all the places to visit in Udaipur. It also has a taste of the street food of Rajasthan with mouth-watering gol-gappas and so much more. It also has several souvenir shops and shops selling beautiful Rajasthani paintings such as the Phad paintings and the Pichwai miniature paintings.Location: Bapu Bazar, Jawahar Nagar, Udaipur, Bapu Bazar Road Udaipur, Rajasthan 313001, IndiaDistance from city: 3 km"
37,Ahar Cenotaph,"Ahar Cenotaphs represents the courage and valor of the Mewar Dynasty. The place is famous for its history as well as for its architectural importance. The arched roofs and fine carving will remind you of the 15th-century temples. There are 19 cenotaphs carved out of the finest marbles. You will even find a beautiful sculpture of Lord Shiva and a figure of Maharana with his ‘Satis’- all of his wives who gave their lives in his cremation flames.Location: Ayad, Ganapati Nagar, Udaipur, Rajasthan 313001Distance from city: 1 km"
38,Mewar Biodiversity Park,"Mewar Biodiversity Park is one of the best places to visit in Udaipur to witness the rich biodiversity of this enchanting city. The park is home to about 300 different types of plants which include 300 to 400 years old mango, mahua and banyan trees. The park is also inhabited by a wide variety of birds, reptiles, amphibians and animals. This place is a perfect destination for bird lovers, wildlife enthusiasts, researchers and nature lovers. Adventure sports facilities have also been included within the park for visitors. These include zip lines, valley crossing, tree walk and ground obstacles. There are also provisions for eco-tourism, swings for children and an interpretation center. Visitors can also camp here for the night. Location: Udaipur Bypass, Amberi, Rajasthan 313024Distance from Udaipur: 17 km"
39,Under the Sun Aquarium,"Under the Sun Aquarium is first of its kind in India which houses more than 100 different species of fish. Besides fish, you can also witness other exciting sea creatures like Albino Frogs, Indonesian Crabs, Fire Belly Newts and Fresh Water Scampi, etc. The best thing which attracts tourists is A OMG!! Tank where you step into the aquarium and get a closure look into the life under sea and witness some beautiful fish swim by.Location: Fateh Sagar Overflow, Fateh Sagar Lake, Udaipur, Rajasthan 313001Distance from city: 3 km"
40,Ambrai Ghat,"This place is emblematic of the architectural splendor and natural beauty that Udaipur is characterized with. It overlooks the Pichola Lake that generously splashes its waters on the Ghat and mesmerizes the viewer. There are several birds and a lovely wind flowing here. It gives a spectacular view of Udaipur which is a sight to behold. The place becomes the most crowded in the evening when people come to relax and it is also a beautiful spot for lovers. This is no doubt one of the most spellbinding places to see in Udaipur. Location: Chandpole Maji Ka Mandir, Cheerwa, Ambamata, Udaipur, Rajasthan 313001Distance from city: 4.5 km"
41,Marvel Water Park,"Marvel Water Park is the first water park in the city and one of the best places to visit in Udaipur for a fun filled day with family and friends. Nestled amidst a shelter of lush green trees, the water park makes for a perfect destination for a day of adventure. The water slides, simulated rain dances, splash pools, toddlers’ lagoon, sky slides and so many other rides are available for visitors of all ages. The staff is well trained, there is a cafe and multi-cuisine restaurant, suits are available on rent and there are several seating areas under the shade. There are safety lockers and separate changing rooms for ladies and gents as well. Location: Saras Parlor, NH 8, Goverdhan Villas, Sector 14, Udaipur, Rajasthan 313001Distance from city: 9 km"
42,Bhartiya Lok Kala Museum,"This place is a haven for Indian folklore and culture, carefully preserved and exhibited in a beautiful manner. It is one of the most famous places to see in Udaipur. It has a collection of art and folklore of Rajasthan and the neighboring states of Gujarat and Madhya Pradesh. There are various beautiful masks, dolls, musical instruments, traditional rural dresses, paintings, puppets, and ornaments to look at.Location: Saheli Marg, Madhuban, Udaipur, Rajasthan 313001Timings: 9 AM to 6 PM"
43,Aravali Nature View,"Udaipur is popular as a holiday destination for its beautiful lakes, majestic palaces and royal gardens. But there is also another side to Udaipur’s beauty and that is its magnificent nature views. Being in the vicinity of the Aravalli hills, Udaipur offers excellent hiking and trekking trails up these majestic hills. The Aravalli range is home to some of the most spectacular wildlife and there are several sanctuaries and national parks within this belt. The area also offers excellent rock climbing opportunities and the view from the top is nothing to be compared with. The nature view in Udaipur has so much to offer for any adventure enthusiast. Here you will find easy and difficult treks, exploring villages on the foothills of the Aravallis and beautiful unspoilt lakes. Location: Udaipur, RajasthanDistance from Udaipur: 12 km"
44,Gangaur Ghat,"Gangaur Ghat is located in the old city on the banks of the famous Lake Pichola and it is one of the main ghats in Udaipur. The area is a great place for photography and the sunset and sunrise views are absolutely stunning. The Gangaur Ghat is one of the most popular tourist places in Udaipur. The ghat truly comes alive during the colorful celebrations of the famous Gangaur Festival and Jal Jhulni Ekadashi. Other festivals celebrated here are Navratri and Ganesh Chaturthi and the idols are immersed here after the pujas. The best time to visit this beautiful place is at sunset or at night. A visit to Udaipur would be incomplete without a trip to Gangaur Ghat. Location: Old City, Pichola, Udaipur, Rajasthan 313001"
45,Kumbhalgarh Fort,"The Kumbhalgarh Fort is another attraction and tops the list of the places to visit in Udaipur. It is 64 km away from the main city and is the second important structure after the Chittorgarh fort. This magnificent structure lies in the lap of Aravalli Ranges and was built in 15th Century by Rana Kumbha.
Due to hostile topography of the region this fort has remained unconquered and served as a refuge for the ruler of Mewar during the times of conflict. This place also served as a refuge to baby king Udai of Mewar and is the birthplace of the King Maharana Pratap. The walls of the fort are very thick and stretch across 36 km. Maharana Fateh Singh of Mewar renovated the fort during the 19th Century. Only once has this fort fallen prey to the reign of Amber and Mughal Empire.    
There are beautiful buildings, temples and other architecture inside the fort. Badal Mahal is of great significance as this place offers a great view of the surrounding areas.Distance From Udaipur: 64 KmsLocation:  Rajsamand"
46,Udaipur Ghat,"Udaipur Ghat represents the religious and spiritual side of Udaipur. The ghat witnesses a horde of devotees throughout the year and especially so during major festivals. They travel from far and near to take a holy dip in the waters of the Udaipur Ghat. The place also attracts lots of tourists coming from other parts of the country as well as abroad. Udaipur Ghat is ideally located in the heart of the old city and the area around it is filled with excellent options for accommodation. The area also has several cafes and restaurants serving excellent food selections. This is one of the most fascinating places to visit in Udaipur.Location: 23-25, Lal Ghat Road, Lal Ghat, Behind Jagdish Temple, Silawatwari, Udaipur, Rajasthan 313001Distance from city: 4.7 km"
47,Kumbhalgarh Wildlife Sanctuary,"Kumbhalgarh Wildlife Sanctuary is the main attraction for the people visiting the city of Udaipur. It falls in the district of Rajasamand in Rajasthan and lies 65 km away from the main city. This reserve spreads on a sprawling 578 sq km land and encircles the fort of Kumbhalgarh. It covers a broad area that includes the Rajasamand, Pali and the city of Udaipur.
This sanctuary was built to provide shelter to the endangered animals like jackal, jungle cat, sloth bear, wolf, leopard, sambhar, hyena, chital, wild boar, Chausingha, Chinkara and many more. This is the only sanctuary in Rajasthan where you can actually trace the activities of the wolf. It is an important attraction in the Udaipur tourist places list.
Distance from Udaipur: 65 kmsLocation: Rajsamand"
48,Chittorgarh Fort,"Chittorgarh Fort lies 112 km away from the city of Udaipur and is a true embodiment of the pride and chivalry of the Rajput tribes making it one of the places to visit in Udaipur. The fort tells a long story of sacrifice, courage, romance and determination. The marvellous site has a well- designed palace, towers and cenotaphs.
Built by the Mauryan rulers in the 7th Century, this fort is a huge structure that is secured with strong gates. It covers a total area of 700 acres and is near to the Gamberi River. The fort has seen a total of three battles in the lifetime. There are seven giant pols that you will come across while travelling towards this place.Reflecting the splendour of Rajput architecture are the Padmini Palace and Rana Kumbha Palace. Padmini Palace is the place that served the beautiful queen of the king Rattan Singh. Rana Kumbha Palace has underground cellars where Rani Padmini committed Jauhar (self-sacrifice to protect one’s dignity) with her children and other ladies of the household.There are a lot of temples inside the fort namely Jain Temple, Meera Bai, Sammidheshwara, Kumbha Shyam, Kalika Mata, and Mahadev. The architecture of the ancient temples has intricate work and carvings all over.  Bhimtal Tank and Gaumukh Reservoir are some other places in the fort that are worth visiting. The Gaumukh Reservoir is a huge tank of water where water gushes from the mouth of a cow shaped rock. This is the place where Allaudin was allowed to see the reflection of Rani Padmini.
Distance From Udaipur: 112 KmsLocation: Chittor Fort Road, Chittorgarh, Rajasthan 312001"
49,Ranakpur Temples,"Ranakpur is one of the five holy places for the Jain community across the world. The temple of Ranakpur was created in the 15th Century during the reign of Rana Kumbha. The Chaumukha or four faced central structure is dedicated to Lord Adinathji. This revered place of worship has 29 halls and 1444 pillars all delicately carved enhancing the beauty of the place. All the temples inside Ranakpur four faced structure are with intricate engravings.This place partly reflects the art and architecture of the Dilwara temples in Mount Abu. Parsavanath and Neminath are the main temples with exquisite architecture and delicate carvings similar to the Khajuraho. In here is the famous Sun Temple which is dedicated to the Sun God.  It is a polygonal structure with richly embellished walls and carvings depicting the warriors, sun, other nakshtras and the horses. Ranakpur is a place that strives to provide peace and tranquillity to the pilgrims and tourists.
Distance From Udaipur: 91 KmsLocation: Desuri, Ranakpur Rd, Sadri, Rajasthan 306702"
50,Saas Bahu Temple,"The quirky name of this temple complex is actually a corruption of the original name- Sahastra Bahu temples, meaning Lord of One Thousand Arms. These temples belong to the 10th Century and are dedicated to Lord Vishnu. Though the temples are almost in ruins now, the architecture of the olden days still shines through, revealing the delicate, detailed artistry that went into creating them. The temple complex is located near the Eklingji Temple complex so visitors can make a combined visit to them.Though it has been termed as a heritage monument, the temple site is a forgotten tourist spot so you will find it mostly deserted except for birds. But if you want to spend some silent, meditative time away from tourists, nothing can be better than this temple complex. It will offer you a retreat where you can energise yourself in conversation with yourself, the birds and the ancient stones. Pay a homage to the art and architecture of the olden days by visiting the Saas Bahu Temple.Distance from the City: 20kmLocation: Near Eklingji, Udaipur District"
51,Sajjangarh Wildlife Sanctuary,"Surrounding the Sajjangarh or Monsoon Palace, Sajjangarh Wildlife Sanctuary is a favorite destination of tourists who go to enjoy the sights of the best places in Udaipur. Very rare species of wild animals can be spotted here such as sambars, wild boars, chitals, hyenas, jackals, panthers, hares and blue bulls. In the background of the sanctuary, you can see the Bansadra hill that will let your heart get replenished. There is the Tiger Lake which is also known as Bari Lake or Jiyan Lake supports the ecosystem present inside the sanctuary. It is home to another kind of animals such as panthers, hyenas, and jackals. Jhar water hole is situated in the western region of Bansadra Hill and also there is a temple dedicated to Lord Shiva. Machla Magra which has the shape of a fish is a hill situated near to the sanctuary from where you can spot the collection of wild animals in the sanctuary.Distance from Udaipur: 12 kmsLocation: It will take almost 30 minutes to reach the location from Udaipur City."
