business_status,formatted_address,name,permanently_closed,place_id,plus_code,rating,types,user_ratings_total,opening_hours,tag,price_level,results,lat,long
OPERATIONAL,"Hawa Mahal Rd, Badi Choupad, J.D.A. Market, Pink City, Jaipur, Rajasthan 302002, India",Hawa Mahal,-1,ChIJpQvTG0uxbTkRDLLMHlNdDoY,"{'compound_code': 'WRFG+HM Jaipur, Rajasthan', 'global_code': '7JRQWRFG+HM'}",4.4,"['tourist_attraction', 'premise', 'point_of_interest', 'establishment']",83706,{'open_now': False},tourist_attraction,-1,-1,26.9239363,75.8267438
OPERATIONAL,"Amer Rd, Jal Mahal, Amer, Jaipur, Rajasthan 302002, India",Jal Mahal,-1,ChIJlXJ26RuxbTkR0qsToxFP05c,"{'compound_code': 'XR3W+9F Jaipur, Rajasthan', 'global_code': '7JRQXR3W+9F'}",4.2,"['tourist_attraction', 'point_of_interest', 'establishment']",17949,{'open_now': True},tourist_attraction,-1,-1,26.953456,75.8462124
OPERATIONAL,"Tulsi Marg, Gangori Bazaar, J.D.A. Market, Pink City, Jaipur, Rajasthan 302002, India","City Palace, Jaipur",-1,ChIJwbAghgu0bTkRYHt9ATEVgEQ,"{'compound_code': 'WRGF+8F Jaipur, Rajasthan', 'global_code': '7JRQWRGF+8F'}",4.4,"['tourist_attraction', 'premise', 'museum', 'point_of_interest', 'establishment']",34674,{'open_now': False},tourist_attraction,-1,-1,26.9257713,75.8236581
OPERATIONAL,"Gangori Bazaar, J.D.A. Market, Pink City, Jaipur, Rajasthan 302002, India",Jantar Mantar - Jaipur,-1,ChIJaXD1f0yxbTkRvquNoSkESuk,"{'compound_code': 'WRFF+WR Pink City, Jaipur, Rajasthan', 'global_code': '7JRQWRFF+WR'}",4.5,"['tourist_attraction', 'point_of_interest', 'establishment']",24408,{'open_now': False},tourist_attraction,-1,-1,26.924762,75.82456
OPERATIONAL,"Krishna Nagar, Brahampuri, Jaipur, Rajasthan 302002, India",Nahargarh Fort,-1,ChIJ0fNH81yxbTkRi56uF-amqgo,"{'compound_code': 'WRP8+W6 Brahampuri, Jaipur, Rajasthan', 'global_code': '7JRQWRP8+W6'}",4.5,"['tourist_attraction', 'point_of_interest', 'establishment']",38834,{'open_now': True},tourist_attraction,-1,-1,26.9373127,75.8155259
OPERATIONAL,"Devisinghpura, Amer, Rajasthan 302028, India",Jaigarh Fort,-1,ChIJx0lfsbGxbTkRgVOhxJ7EGbw,"{'compound_code': 'XRPW+26 Amer, Jaipur, Rajasthan', 'global_code': '7JRQXRPW+26'}",4.5,"['tourist_attraction', 'museum', 'point_of_interest', 'establishment']",21124,{'open_now': True},tourist_attraction,-1,-1,26.9850877,75.8455928
OPERATIONAL,"Museum Rd, Ram Niwas Garden, Kailash Puri, Adarsh Nagar, Jaipur, Rajasthan 302004, India",Albert Hall Museum,-1,ChIJXyn5OrC2bTkRaGk8EzNDuwU,"{'compound_code': 'WR69+JQ Adarsh Nagar, Jaipur, Rajasthan', 'global_code': '7JRQWR69+JQ'}",4.5,"['tourist_attraction', 'museum', 'point_of_interest', 'establishment']",37679,{'open_now': True},tourist_attraction,-1,-1,26.9115755,75.8194875
OPERATIONAL,"Prithviraj Rd, Rambagh, Jaipur, Rajasthan 302007, India",Central Park,-1,ChIJV9GWIae2bTkR3tu5UFSOwk0,"{'compound_code': 'WR34+WW Rambagh, Jaipur, Rajasthan', 'global_code': '7JRQWR34+WW'}",4.6,"['tourist_attraction', 'park', 'point_of_interest', 'establishment']",16009,{'open_now': True},tourist_attraction,-1,-1,26.9047845,75.8072858
CLOSED_TEMPORARILY,"C-16, Bhagwan Das Rd, Panch Batti, C Scheme, Ashok Nagar, Jaipur, Rajasthan 302001, India",Raj Mandir Cinema,TRUE,ChIJeSsYKBqzbTkRkOA72_U4lAw,"{'compound_code': 'WR86+53 Jaipur, Rajasthan', 'global_code': '7JRQWR86+53'}",4.5,"['movie_theater', 'tourist_attraction', 'point_of_interest', 'establishment']",29233,-1,tourist_attraction,-1,-1,26.9154985,75.8101639
OPERATIONAL,"plot no.74 ,2nd floor ahead akshardham mandir, Vaishali Nagar, Jaipur, Rajasthan 302021, India",The Dance Union,-1,ChIJM02m2pm0bTkRzl6a8MU4Kd8,"{'compound_code': 'WP2R+V6 Vaishali Nagar, Jaipur, Rajasthan', 'global_code': '7JRQWP2R+V6'}",4.7,"['hindu_temple', 'tourist_attraction', 'place_of_worship', 'point_of_interest', 'establishment']",8013,{'open_now': True},tourist_attraction,-1,-1,26.9022189,75.7406225
OPERATIONAL,"Laxman Dungri, Natata Mode Delhi Road, Kunda, Jaipur, Rajasthan 302028, India",Khole Ke Hanuman Ji Temple,-1,ChIJPd5eDNW2bTkRRLivoMYzwak,"{'compound_code': 'WVM3+JH Jaipur, Rajasthan', 'global_code': '7JRQWVM3+JH'}",4.8,"['hindu_temple', 'tourist_attraction', 'place_of_worship', 'point_of_interest', 'establishment']",7362,-1,tourist_attraction,-1,-1,26.9341049,75.8539884
CLOSED_TEMPORARILY,"Ghat Ki Guni, Jaipur, Rajasthan 302017, India",Vidyadhar Bagh,TRUE,ChIJq5wk2R-3bTkRLw-MpqvXGMg,"{'compound_code': 'VVX3+WC Jaipur, Rajasthan', 'global_code': '7JRQVVX3+WC'}",4.2,"['tourist_attraction', 'point_of_interest', 'establishment']",555,-1,tourist_attraction,-1,-1,26.8997912,75.853619
OPERATIONAL,"Agra Rd, Ghat Ki Guni, Jaipur, Rajasthan 302023, India",Sisodia Rani ka Bagh,-1,ChIJkzbjKhm3bTkRNiCT5-dA6vU,"{'compound_code': 'VVX5+QF Ghat Ki Guni, Jaipur, Rajasthan', 'global_code': '7JRQVVX5+QF'}",4.3,"['park', 'point_of_interest', 'establishment']",3052,{'open_now': True},tourist_attraction,-1,-1,26.8994218,75.8587309
OPERATIONAL,"Noor Building, S-34, MI Road, near indian Coffee house, Jaipur, Rajasthan 302001, India",Elefunenjoy| Elephant Sanctuary Jaipur,-1,ChIJFTu7a6y2bTkRqXNxQgc95sw,"{'compound_code': 'WR87+JH Jaipur, Rajasthan', 'global_code': '7JRQWR87+JH'}",5,"['tourist_attraction', 'car_rental', 'travel_agency', 'point_of_interest', 'establishment']",190,{'open_now': True},tourist_attraction,-1,-1,26.9165642,75.8139164
CLOSED_TEMPORARILY,"2, Jawaharlal Nehru Marg, Opp Commerce College, Jhalana Doongri, Jaipur, Rajasthan 302004, India",Jawahar Kala Kendra,TRUE,ChIJxVyo7oC2bTkRMJbp0SqUAdA,"{'compound_code': 'VRG5+GM Jaipur, Rajasthan', 'global_code': '7JRQVRG5+GM'}",4.6,"['tourist_attraction', 'museum', 'point_of_interest', 'establishment']",8856,-1,tourist_attraction,-1,-1,26.8763612,75.8091692
OPERATIONAL,"309B, Mangala Rd, Bada Akhada, Krishna Nagar, Brahampuri, Jaipur, Rajasthan 302002, India",Gaitor Ki Chhatriyan,-1,ChIJxUfgi0GxbTkR5Vqeib76O00,"{'compound_code': 'WRVF+5V Brahampuri, Jaipur, Rajasthan', 'global_code': '7JRQWRVF+5V'}",4.5,"['tourist_attraction', 'point_of_interest', 'establishment']",1511,{'open_now': True},tourist_attraction,-1,-1,26.9429931,75.8246384
CLOSED_TEMPORARILY,"S4, Tirthraj Apartment, Jacob Road, Civil Lines, Jaipur, Rajasthan 302006, India",Things to do in Jaipur,TRUE,ChIJvzp3pBi0bTkRcItQNNvqvRc,"{'compound_code': 'WQ6Q+4W Jaipur, Rajasthan', 'global_code': '7JRQWQ6Q+4W'}",4,"['travel_agency', 'point_of_interest', 'establishment']",32,-1,tourist_attraction,-1,-1,26.9103243,75.7898378
CLOSED_TEMPORARILY,"Amer Palace and Fort, Amer Road, Devisinghpura, Amer, Jaipur, Rajasthan 302028, India",Chand Pol (Moon Gate),TRUE,ChIJNWQbG7OxbTkR3i3awnO4lOE,"{'compound_code': 'XVP2+V9 Jaipur, Rajasthan', 'global_code': '7JRQXVP2+V9'}",4.4,"['tourist_attraction', 'point_of_interest', 'establishment']",63,-1,tourist_attraction,-1,-1,26.9871777,75.8509255
CLOSED_TEMPORARILY,"Jaisingpurakhor jaipur Ner, Link Rd, Jaipur, Rajasthan 303027, India",Raj tour&travels jai sing pura khor jaiput,TRUE,ChIJwzRV5FuxbTkRTr6ldx78sXM,"{'compound_code': 'WRHC+R5 Jaipur, Rajasthan', 'global_code': '7JRQWRHC+R5'}",0,"['tourist_attraction', 'point_of_interest', 'establishment']",0,-1,tourist_attraction,-1,-1,26.9295936,75.8203955
OPERATIONAL,"Museum Rd, Ram Niwas Garden, Kailash Puri, Ramniwas Bagh, Jaipur, Rajasthan 302004, India",Jaipur Zoo,-1,ChIJlUU0la22bTkRYjOPfx2lY9E,"{'compound_code': 'WR6C+WF Jaipur, Rajasthan', 'global_code': '7JRQWR6C+WF'}",3.4,"['zoo', 'tourist_attraction', 'point_of_interest', 'establishment']",5525,{'open_now': False},zoo,-1,-1,26.9123097,75.8211759
OPERATIONAL,"Village Sanjharia, Before Toll Gate, Via Vatika City Thikaria, 22 Milestone,, Ajmer-Jaipur Expressway, Jaipur, Rajasthan 302026, India",SwapanLok Resort,-1,ChIJEQ9GvxFJbDkRYOQzp22y85A,"{'compound_code': 'VH7Q+RX Jaipur, Rajasthan', 'global_code': '7JRQVH7Q+RX'}",3.9,"['amusement_park', 'lodging', 'point_of_interest', 'establishment']",1217,{'open_now': True},amusement_park,-1,-1,26.8645821,75.5898846
OPERATIONAL,"village - sohanpur , alwar - sikendra -jaipur highway, RJ SH 25, Alwar, Rajasthan 301001, India",SARISKA FUN CITY,-1,ChIJH3MHz3iFcjkRXmBeWRQMJ6w,"{'compound_code': 'CJV7+V7 Alwar, Rajasthan', 'global_code': '7JVRCJV7+V7'}",4.1,"['amusement_park', 'point_of_interest', 'establishment']",25,{},amusement_park,-1,-1,27.4447346,76.6131825
CLOSED_TEMPORARILY,"Laxmipura, Jaipur, Rajasthan 303305, India",Aalyali Ki Talayi,TRUE,ChIJmxdXpN2SbTkReda_txStBaU,"{'compound_code': 'V6RM+J5 Dayal Pura, Rajasthan', 'global_code': '7JRRV6RM+J5'}",4,"['amusement_park', 'point_of_interest', 'establishment']",3,-1,amusement_park,-1,-1,26.8915835,76.2329011
CLOSED_TEMPORARILY,"Kasra no 105/1 Village charanwas, tala road, Delhi - Jaipur Expy, Jaipur, Rajasthan 303002, India",Riverarch Wetlands Water & Play Park,TRUE,ChIJJ1h8NqChbTkR-4S8A5x_clw,"{'compound_code': '52F2+52 Chak Charanwas, Rajasthan', 'global_code': '7JVR52F2+52'}",5,"['amusement_park', 'point_of_interest', 'establishment']",10,-1,amusement_park,-1,-1,27.1729611,76.0000841
CLOSED_TEMPORARILY,"Jaipur, Rajasthan 303603, India",पंप हाउस पचकोडिया,TRUE,ChIJHwx38dZfbDkRaCMfF2XqjH8,"{'compound_code': '39CJ+2P Pachkodiya, Rajasthan', 'global_code': '7JVQ39CJ+2P'}",0,"['amusement_park', 'point_of_interest', 'establishment']",0,-1,amusement_park,-1,-1,27.0700885,75.381777
OPERATIONAL,"Ringus Road,Khatushyamji, Sikar, Near N.H-52,Jaipur-Sikar road,Bikaner, Highway, Khatoo, Rajasthan 332602, India",Golden Waterpark Khatu Shyam Ji,-1,ChIJIdqtLNrtbDkRZSkUk2zmeCk,"{'compound_code': '9CCH+W7 Khatoo, Rajasthan', 'global_code': '7JVQ9CCH+W7'}",4.4,"['amusement_park', 'point_of_interest', 'establishment']",1745,{'open_now': False},amusement_park,-1,-1,27.3723125,75.4282055
CLOSED_TEMPORARILY,"Rajasthan 303119, India",Highway Water Park &Resort,TRUE,ChIJk91POEkTbTkRSBpYJnxq_Bw,"{'compound_code': 'F3P2+J7 Neelka, Rajasthan', 'global_code': '7JVRF3P2+J7'}",4.4,"['amusement_park', 'point_of_interest', 'establishment']",12,-1,amusement_park,-1,-1,27.486612,76.0506362
CLOSED_TEMPORARILY,"Jaipur, Rajasthan 303604, India",The water park in korsina,TRUE,ChIJtSs9x5p3bDkRUWerr-HfyDs,"{'compound_code': 'V2QP+58 Korsina, Rajasthan', 'global_code': '7JRQV2QP+58'}",5,"['amusement_park', 'point_of_interest', 'establishment']",1,-1,amusement_park,-1,-1,26.8879074,75.0358085
CLOSED_TEMPORARILY,"State Highway 57, Tejya Ka Bas, Rajasthan, India",Water Park Irolav,TRUE,ChIJ30ckBfpubDkR26RUqg1RibQ,"{'compound_code': 'V6V5+33 Tejya Ka Bas, Rajasthan', 'global_code': '7JRQV6V5+33'}",3.9,"['amusement_park', 'point_of_interest', 'establishment']",23,-1,amusement_park,-1,-1,26.8926307,75.2076404
OPERATIONAL,"Golden Bagh Hotel Kati Ghati, Bhakera, Alwar - Jaipur Rd, Alwar, Rajasthan 301001, India",Golden Mizzle,-1,ChIJATzvZK6bcjkRlA5Y1VPjRI8,"{'compound_code': 'GH9R+92 Alwar, Rajasthan', 'global_code': '7JVRGH9R+92'}",3.9,"['amusement_park', 'lodging', 'point_of_interest', 'establishment']",140,{'open_now': False},amusement_park,-1,-1,27.5184002,76.5900815
OPERATIONAL,"43rd Milestone, Main Delhi-Jaipur Expressway, NH-8, Gurugram, 122001, India",Aapno Ghar Resort & Amusement Park,-1,ChIJ_7Pj9jU8DTkRK0UCrUnTjmY,"{'compound_code': '9W6R+XC Gurugram, Haryana', 'global_code': '7JWR9W6R+XC'}",4.7,"['lodging', 'point_of_interest', 'establishment']",3,-1,amusement_park,-1,-1,28.3624847,76.9410195
CLOSED_TEMPORARILY,"Rajasthan, India",Ranthambore National Park,TRUE,ChIJF1XWaPbYcTkRJcm6YIv3uW4,"{'compound_code': '2G83+W2 Prempura, Rajasthan', 'global_code': '7JRR2G83+W2'}",4.4,"['tourist_attraction', 'park', 'point_of_interest', 'establishment']",3042,-1,campground,-1,-1,26.0173274,76.5025742
CLOSED_TEMPORARILY,"Gurugram, Haryana 122105, India",Amity MTC,TRUE,ChIJ6XEkwlQ5DTkRXjA9aoZnepI,"{'compound_code': '8WC7+M5 Gurugram, Haryana', 'global_code': '7JWR8WC7+M5'}",4.3,"['campground', 'lodging', 'park', 'point_of_interest', 'establishment']",455,-1,campground,-1,-1,28.321642,76.9129121
CLOSED_TEMPORARILY,"A 19 Beniwal Kata Opp Hospital Ramgarh Mode, Jal Mahal, Amer, Jaipur, Rajasthan 302002, India",Jannat,TRUE,ChIJXyzQ4_uwbTkR5zdZdCOCvOY,"{'compound_code': 'WRWX+CH Amer, Jaipur, Rajasthan', 'global_code': '7JRQWRWX+CH'}",4.1,"['clothing_store', 'point_of_interest', 'store', 'establishment']",14,-1,campground,-1,-1,26.9460857,75.8489244
CLOSED_TEMPORARILY,"1358, Raval Ji Ka Bazar, Gangapol, Jaipur, Rajasthan 302002, India",Rajputana Tour Cab,TRUE,ChIJS9Hz-_axbTkR2Dtp_2X4lZM,-1,5,"['travel_agency', 'point_of_interest', 'establishment']",113,-1,campground,-1,-1,26.9357847,75.8336128
OPERATIONAL,"R-14, Yudhister Marg, C Scheme, Ashok Nagar, Jaipur, Rajasthan 302001, India","Hotel Shikha, Jaipur",-1,ChIJ_VzhwRq0bTkRGbEjlkfBc9M,"{'compound_code': 'WQ4W+CQ Ashok Nagar, Jaipur, Rajasthan', 'global_code': '7JRQWQ4W+CQ'}",4,"['lodging', 'point_of_interest', 'establishment']",1628,{'open_now': True},campground,-1,-1,26.9061,75.7969864
OPERATIONAL,"WW69+J9, Dhibba Para, Amar Sagar Pol, Jaisalmer, Rajasthan 345001, India",Jaisalmer Desert Camps,-1,ChIJhRdnRyW8RzkR17XYdqrLr2c,-1,4.4,"['campground', 'lodging', 'park', 'point_of_interest', 'establishment']",75,{'open_now': True},campground,-1,-1,26.9115625,70.9184375
OPERATIONAL,"21, 2nd Floor, Shivaji Marg, Facing, Rama Rd, Kirti Nagar Industrial Area, Najafgarh Road Industrial Area, New Delhi, Delhi 110015, India",Great Rocksport Private Limited,-1,ChIJqSCzxb8CDTkRP0BWg_uAJ2g,"{'compound_code': 'M575+MQ Najafgarh Road Industrial Area, New Delhi, Delhi', 'global_code': '7JWVM575+MQ'}",4.5,"['campground', 'lodging', 'park', 'point_of_interest', 'establishment']",276,{'open_now': True},campground,-1,-1,28.6642166,77.1594276
CLOSED_TEMPORARILY,"C-56, Mahavir Marg, C-Scheme, Sangram Colony, Ashok Nagar, Jaipur, Rajasthan 302001, India",Garden House,TRUE,ChIJqSZraQO3bTkRc_YAlcAv1VY,"{'compound_code': 'WR55+7Q Ashok Nagar, Jaipur, Rajasthan', 'global_code': '7JRQWR55+7Q'}",0,"['point_of_interest', 'establishment']",0,-1,campground,-1,-1,26.9081537,75.8093829
OPERATIONAL,"Ranthambhor Rd, Vivekanandapuram Colony, Sawai Madhopur, Rajasthan 322001, India",Ranthambore Jungle Safari,-1,ChIJJ2gicnWzbTkRgVWlQySeJMI,"{'compound_code': '299H+VJ Sawai Madhopur, Rajasthan', 'global_code': '7JRR299H+VJ'}",4.4,"['travel_agency', 'park', 'point_of_interest', 'establishment']",553,{'open_now': True},campground,-1,-1,26.0197274,76.3790659
CLOSED_TEMPORARILY,"Robin Private Tour Plot no 3, parash, Sita Ram Puri, Jaipur, Rajasthan 302002, India",Banana Express Tours Jaipur,TRUE,ChIJbXCrtzmxbTkRPgmMDDCi8qw,-1,0,"['travel_agency', 'point_of_interest', 'establishment']",0,-1,campground,-1,-1,26.9357847,75.8336128
OPERATIONAL,"Uttar Pradesh 203201, India",Muddy Boots,-1,ChIJT0L4OovHDDkR9D1m-En1iI4,"{'compound_code': '8H65+M7 Yeida, Uttar Pradesh', 'global_code': '7JWV8H65+M7'}",4.5,"['campground', 'lodging', 'park', 'point_of_interest', 'establishment']",99,-1,campground,-1,-1,28.3116318,77.5581866
CLOSED_TEMPORARILY,"Jantar Mantar Road, Janpath, Connaught Place, New Delhi, Delhi 110001, India",MTFD Jantar Mantar,TRUE,ChIJ7R1B9Er9DDkRDHIcQNWvrSw,"{'compound_code': 'J6G8+88 Connaught Place, New Delhi, Delhi', 'global_code': '7JWVJ6G8+88'}",4.5,"['campground', 'lodging', 'park', 'point_of_interest', 'establishment']",11,-1,campground,-1,-1,28.625831,77.215827
CLOSED_TEMPORARILY,"Sam, Rajasthan 345001, India",Jaisalmer desert tour packages,TRUE,ChIJvzMf8UTfRzkRk6nCoG8PlX0,"{'compound_code': 'RGJ4+5V Sam, Rajasthan', 'global_code': '7JRGRGJ4+5V'}",5,"['campground', 'lodging', 'park', 'point_of_interest', 'establishment']",3,-1,campground,-1,-1,26.8304527,70.5071565
CLOSED_TEMPORARILY,"8/A, Nirmal Path, Ajmer Rd, Jaipur, Rajasthan 302006, India",New Apostolic Church,TRUE,ChIJKXwKvq22bTkRYTZ_celIqyQ,"{'compound_code': 'WQ6P+XW Jaipur, Rajasthan', 'global_code': '7JRQWQ6P+XW'}",5,"['church', 'place_of_worship', 'point_of_interest', 'establishment']",5,-1,church,-1,-1,26.9124702,75.7872739
CLOSED_TEMPORARILY,"Niwaru Rd, Ashok Nagar, Jhotwara, Jaipur, Rajasthan 302012, India",Holy Redeemer Church,TRUE,ChIJI-jeNt-ybTkRHqEUJSLtGhw,"{'compound_code': 'XP6J+2P Jhotwara, Jaipur, Rajasthan', 'global_code': '7JRQXP6J+2P'}",4.7,"['tourist_attraction', 'church', 'place_of_worship', 'point_of_interest', 'establishment']",61,-1,church,-1,-1,26.9600666,75.7318648
CLOSED_TEMPORARILY,"Teachers Colony, Heera Nagar, Mahatma Gandhi Nagar, Jaipur, Rajasthan 302021, India",Church,TRUE,ChIJd132iZG0bTkRGZvYgqz7IHc,"{'compound_code': 'VPWW+JQ Mahatma Gandhi Nagar, Jaipur, Rajasthan', 'global_code': '7JRQVPWW+JQ'}",4.7,"['church', 'place_of_worship', 'point_of_interest', 'establishment']",12,-1,church,-1,-1,26.8965746,75.7469518
CLOSED_TEMPORARILY,"b 1, B-1, Central Jail, Fateh Tibba, Adarsh Nagar, Jaipur, Rajasthan, India",Sacred Heart Church,TRUE,ChIJy_HacMi2bTkRS69dNUYCeWQ,"{'compound_code': 'WR6J+HV Adarsh Nagar, Jaipur, Rajasthan', 'global_code': '7JRQWR6J+HV'}",4.5,"['church', 'place_of_worship', 'point_of_interest', 'establishment']",6,-1,church,-1,-1,26.9113985,75.8321878
CLOSED_TEMPORARILY,"Plot No 689, Sector-3, Vidyadhar Nagar, Jaipur, Rajasthan 302023, India",Bethel AG Church,TRUE,ChIJS55FHcqzbTkR75oQ4VBMFR0,"{'compound_code': 'XQ5M+6Q Vidyadhar Nagar, Jaipur, Rajasthan', 'global_code': '7JRQXQ5M+6Q'}",4.3,"['church', 'place_of_worship', 'point_of_interest', 'establishment']",40,-1,church,-1,-1,26.9580273,75.7844358
OPERATIONAL,"11, Ganpati Marg, Mamta Nagar, Suraj Nagar, Nirmal Vihar, Jhotwara, Jaipur, Rajasthan 302012, India",Hebron pentecostal Church,-1,ChIJrSGnAvCybTkROh0bE22ogFs,"{'compound_code': 'XPCX+QG Jhotwara, Jaipur, Rajasthan', 'global_code': '7JRQXPCX+QG'}",4.6,"['church', 'place_of_worship', 'point_of_interest', 'establishment']",10,-1,church,-1,-1,26.9719882,75.7488186
CLOSED_TEMPORARILY,"Hotel Shree Residency, 122, Dhuleshwar Garden, Panch Batti, C Scheme, Hathroi, Jaipur, Rajasthan 302001, India",Real Connect Church,TRUE,ChIJ3TD8aUW1bTkRECEzoh890LU,"{'compound_code': 'WQ8X+7F Hathroi, Jaipur, Rajasthan', 'global_code': '7JRQWQ8X+7F'}",5,"['church', 'place_of_worship', 'point_of_interest', 'establishment']",11,-1,church,-1,-1,26.9156967,75.7986518
CLOSED_TEMPORARILY,"7, Queens Rd, Moti Nagar, Nityanand Nagar, Vaishali Nagar, Jaipur, Rajasthan 302021, India",Family Life Ministries,TRUE,ChIJId9kX4-0bTkR5JfDGFP_4PQ,"{'compound_code': 'WQ33+58 Vaishali Nagar, Jaipur, Rajasthan', 'global_code': '7JRQWQ33+58'}",5,"['church', 'place_of_worship', 'point_of_interest', 'establishment']",22,-1,church,-1,-1,26.9028998,75.7533702
CLOSED_TEMPORARILY,"C 56, Dhawas Rd, Ekta Nagar, Ward Number 18, Jaipur, Rajasthan 302034, India",Church of God in India,TRUE,ChIJ93ETQ7O0bTkR-FvyBsdEAAA,"{'compound_code': 'VPV8+J2 Jaipur, Rajasthan', 'global_code': '7JRQVPV8+J2'}",4.7,"['church', 'place_of_worship', 'point_of_interest', 'establishment']",6,-1,church,-1,-1,26.8940797,75.7150785
CLOSED_TEMPORARILY,"Vidhyadhar Nagar Marg, C Block, Vidhyadhar Nagar, Jaipur, Rajasthan 302039, India",The Pentecostal Mission Church,TRUE,ChIJoXkpScyzbTkRcdLU3dkiXsE,"{'compound_code': 'XQ6R+5P Jaipur, Rajasthan', 'global_code': '7JRQXQ6R+5P'}",4.2,"['church', 'place_of_worship', 'point_of_interest', 'establishment']",43,-1,church,-1,-1,26.9604342,75.7918252
CLOSED_TEMPORARILY,"10-11 Shankar vihar, front of Sani Krishi Farm, 302013, Murlipura Scheme, Murlipura, Jaipur, Rajasthan, India",St. Mary's Orthodox Church,TRUE,ChIJn5TNNveybTkR506XeZ284tg,"{'compound_code': 'XQF4+H3 Murlipura, Jaipur, Rajasthan', 'global_code': '7JRQXQF4+H3'}",4.4,"['church', 'place_of_worship', 'point_of_interest', 'establishment']",37,-1,church,-1,-1,26.9739204,75.7552239
CLOSED_TEMPORARILY,"Dharam Park, Sushilpura, Jaipur, Rajasthan 302019, India",St. Mary's Malankra Catholic Church,TRUE,ChIJ1WnJDYq0bTkRSQZLSOZ3hQM,"{'compound_code': 'VQW5+MW Sushilpura, Jaipur, Rajasthan', 'global_code': '7JRQVQW5+MW'}",4.4,"['church', 'place_of_worship', 'point_of_interest', 'establishment']",19,-1,church,-1,-1,26.896679,75.7598345
CLOSED_TEMPORARILY,"Kalwar Rd, Laxmi Nagar III, Jagannath Puri, Suraj Nagar, Jhotwara, Jaipur, Rajasthan 302012, India",Christian Believers' Church,TRUE,ChIJ91-xDBezbTkRe6BO07WKPNg,"{'compound_code': 'WPWR+F5 Jhotwara, Jaipur, Rajasthan', 'global_code': '7JRQWPWR+F5'}",4.6,"['church', 'place_of_worship', 'point_of_interest', 'establishment']",20,-1,church,-1,-1,26.9462408,75.7404824
CLOSED_TEMPORARILY,"A 219, 220, Ajmer Rd, Jagdamba Nagar, Heerapura, Vaishali Nagar, Jaipur, Rajasthan 302021, India",Life Academy Academy AG Church,TRUE,ChIJL6gyTLe0bTkRXvf-1rM1NAg,"{'compound_code': 'VPVF+HR Vaishali Nagar, Jaipur, Rajasthan', 'global_code': '7JRQVPVF+HR'}",5,"['church', 'place_of_worship', 'point_of_interest', 'establishment']",2,-1,church,-1,-1,26.8939063,75.7246083
CLOSED_TEMPORARILY,"36-A Krishna Vihar, New Sanganer Rd, Jaipur, Rajasthan 302015, India",Bethel Fellowship Church,TRUE,ChIJbxhs_AS1bTkRvV8WDeFJ4HY,"{'compound_code': 'VQ52+VG Jaipur, Rajasthan', 'global_code': '7JRQVQ52+VG'}",4.6,"['church', 'place_of_worship', 'point_of_interest', 'establishment']",27,-1,church,-1,-1,26.8596487,75.7512913
CLOSED_TEMPORARILY,"Sector 21, Mansarovar, Jaipur, Rajasthan 302020, India",Assembly of Believers Church,TRUE,ChIJiZnOW_q0bTkRH-Bgm1CFLIY,"{'compound_code': 'VQH2+4R Mansarovar, Jaipur, Rajasthan', 'global_code': '7JRQVQH2+4R'}",4.4,"['church', 'place_of_worship', 'point_of_interest', 'establishment']",7,-1,church,-1,-1,26.8777706,75.7521105
CLOSED_TEMPORARILY,"Ajmer Rd, Madrampur, Civil Lines, Jaipur, Rajasthan 302006, India",Rajasthan Bible Institute,TRUE,ChIJPcLDPnO0bTkRSt1_oi9g_Ek,"{'compound_code': 'WQ6J+3Q Civil Lines, Jaipur, Rajasthan', 'global_code': '7JRQWQ6J+3Q'}",4.3,"['church', 'place_of_worship', 'point_of_interest', 'establishment']",16,-1,church,-1,-1,26.9101589,75.7818947
CLOSED_TEMPORARILY,"302, 23-30,Officers' Campus, 012, Sirsi Rd, Khatipura, Jaipur, Rajasthan 302012, India",MBS Of Seventh Day Adventist,TRUE,ChIJY_NfYl2zbTkRRqyrYiOOAr0,"{'compound_code': 'WPCP+XR Khatipura, Jaipur, Rajasthan', 'global_code': '7JRQWPCP+XR'}",4.5,"['church', 'place_of_worship', 'point_of_interest', 'establishment']",25,-1,church,-1,-1,26.9223999,75.7370853
CLOSED_TEMPORARILY,"Metro Station, Elevated Ajmer Rd, Jai Ambey Colony, Civil Lines, Jaipur, Rajasthan 302006, India",Cavalary Bible Church,TRUE,ChIJ9TiI9ZW1bTkRgyt6_7UulKs,"{'compound_code': 'WQ6J+2J Civil Lines, Jaipur, Rajasthan', 'global_code': '7JRQWQ6J+2J'}",0,"['church', 'place_of_worship', 'point_of_interest', 'establishment']",0,-1,church,-1,-1,26.910097,75.7815778
CLOSED_TEMPORARILY,"69 govjndpuri, Ajmer Rd, Sodala, Jaipur, Rajasthan 302006, India",Living Christian Movement Fellowship,TRUE,ChIJnyNkN8O1bTkRjGfQYe9zt2c,"{'compound_code': 'WQ4C+48 Sodala, Jaipur, Rajasthan', 'global_code': '7JRQWQ4C+48'}",4.6,"['church', 'place_of_worship', 'point_of_interest', 'establishment']",11,-1,church,-1,-1,26.9052963,75.7707729
CLOSED_TEMPORARILY,"Association Hall, Sudarshanpura, Jaipur, Rajasthan 302006, India",Sudarshanpura Mandir,TRUE,ChIJlzRriha0bTkRCJ9YPqStq94,"{'compound_code': 'VQXR+77 Jaipur, Rajasthan', 'global_code': '7JRQVQXR+77'}",4.6,"['hindu_temple', 'place_of_worship', 'point_of_interest', 'establishment']",23,-1,hindu_temple,-1,-1,26.8981776,75.7906527
CLOSED_TEMPORARILY,"Chanakya Marg, Pink City, Jaipur, Rajasthan 302002, India",Shree Ramjanki Mandir,TRUE,ChIJBbvv4DWxbTkRjSQ50fNdy2U,"{'compound_code': 'WRHJ+5H Jaipur, Rajasthan', 'global_code': '7JRQWRHJ+5H'}",0,"['hindu_temple', 'place_of_worship', 'point_of_interest', 'establishment']",0,-1,hindu_temple,-1,-1,26.9279699,75.8314779
CLOSED_TEMPORARILY,"Ganpati Nagar, Jaipur, Rajasthan 302006, India",Kabariya Balaji Temple,TRUE,ChIJfTSZrh9cbDkRCes-kkT1_vQ,-1,4,"['hindu_temple', 'place_of_worship', 'point_of_interest', 'establishment']",4,-1,hindu_temple,-1,-1,26.9124336,75.787271
CLOSED_TEMPORARILY,"34, Sundar Nagar Road, Jai Ambey Colony, Civil Lines, Jaipur, Rajasthan 302007, India",Jai Ambey Mandir,TRUE,ChIJrYvDHHO0bTkRPs1mbM1po8Q,"{'compound_code': 'WQ5J+HJ Civil Lines, Jaipur, Rajasthan', 'global_code': '7JRQWQ5J+HJ'}",0,"['hindu_temple', 'place_of_worship', 'point_of_interest', 'establishment']",0,-1,hindu_temple,-1,-1,26.9089394,75.781548
CLOSED_TEMPORARILY,"Behind Amer Fort, Amer Rd, Jaipur, India",Jagat Shiromani Temple,TRUE,ChIJUcN1gjexbTkRGIvj8VUHYGI,"{'compound_code': 'XVQ2+JG Jaipur, Rajasthan', 'global_code': '7JRQXVQ2+JG'}",4.7,"['hindu_temple', 'tourist_attraction', 'place_of_worship', 'point_of_interest', 'establishment']",163,-1,hindu_temple,-1,-1,26.9890594,75.8512714
CLOSED_TEMPORARILY,"Shivaji Nagar, Jaipur, Rajasthan 302007, India",Temple,TRUE,ChIJq3Io9xC0bTkRXQrEKJ55lyI,"{'compound_code': 'WQ3V+G8 Jaipur, Rajasthan', 'global_code': '7JRQWQ3V+G8'}",0,"['hindu_temple', 'place_of_worship', 'point_of_interest', 'establishment']",0,-1,hindu_temple,-1,-1,26.9038164,75.7932826
CLOSED_TEMPORARILY,"Shankar Colony, Gatore, Jagatpura, Jaipur, Rajasthan 302029, India",Bheru Temple,TRUE,ChIJXZh_JwK2bTkRnBglJ0I2yKM,"{'compound_code': 'RRJ7+43 Jagatpura, Jaipur, Rajasthan', 'global_code': '7JRQRRJ7+43'}",4.4,"['hindu_temple', 'place_of_worship', 'point_of_interest', 'establishment']",15,-1,hindu_temple,-1,-1,26.8302637,75.8127426
CLOSED_TEMPORARILY,"Surajpal Bazar, Jaipur, Rajasthan 302003, India",Temple Of Veshnav Mata,TRUE,ChIJj8pDZMu2bTkRYrfsJPrRRk0,"{'compound_code': 'WRCP+95 Jaipur, Rajasthan', 'global_code': '7JRQWRCP+95'}",0,"['hindu_temple', 'place_of_worship', 'point_of_interest', 'establishment']",0,-1,hindu_temple,-1,-1,26.9209306,75.8354986
CLOSED_TEMPORARILY,"MI Road, New Gate, Jayanti Market, New Colony, Jaipur, Rajasthan 302007, India","Tatkal Bhairav Mandir, New Gate, Jaipur",TRUE,ChIJlbb8N7m3bTkRq0NEH38LHq4,"{'compound_code': 'WR87+M2 Jaipur, Rajasthan', 'global_code': '7JRQWR87+M2'}",0,"['hindu_temple', 'place_of_worship', 'point_of_interest', 'establishment']",0,-1,hindu_temple,-1,-1,26.9167416,75.812545
