business_status,formatted_address,name,permanently_closed,place_id,plus_code,rating,types,user_ratings_total,opening_hours,tag,price_level,results,lat,long
CLOSED_TEMPORARILY,"Gangawal Park, Adarsh Nagar, Jaipur, Rajasthan 302004, India","Babaji Maharaj Temple, Jaipur",TRUE,ChIJQwbI16K2bTkRmFeJ_5Ur6ww,"{'compound_code': 'WR29+85 Adarsh Nagar, Jaipur, Rajasthan', 'global_code': '7JRQWR29+85'}",3,"['hindu_temple', 'place_of_worship', 'point_of_interest', 'establishment']",1,-1,hindu_temple,-1,-1,26.9008141,75.8179298
CLOSED_TEMPORARILY,"C-12, Subash Nagar, Shastri Nagar, Jaipur, Rajasthan 302016, India",Mahakaleshwar Mandir Subhash Nagar Jaipur,TRUE,ChIJDfGGz_azbTkRI4WlNVoD_Sc,"{'compound_code': 'WQPW+6F Shastri Nagar, Jaipur, Rajasthan', 'global_code': '7JRQWQPW+6F'}",0,"['hindu_temple', 'place_of_worship', 'point_of_interest', 'establishment']",0,-1,hindu_temple,-1,-1,26.9355053,75.7961564
CLOSED_TEMPORARILY,"Civil Lines, Jaipur, Rajasthan 302007, India",Durga Mandir,TRUE,ChIJE_whhgu0bTkR57M5v9Y0u_k,-1,0,"['hindu_temple', 'place_of_worship', 'point_of_interest', 'establishment']",0,-1,hindu_temple,-1,-1,26.9124336,75.7872709
CLOSED_TEMPORARILY,"Jaipur, Rajasthan 302001, India",Shiva Temple,TRUE,ChIJMyW16w-0bTkRWBc6Pa-CCI8,"{'compound_code': 'WQ5V+8J Jaipur, Rajasthan', 'global_code': '7JRQWQ5V+8J'}",3.7,"['hindu_temple', 'place_of_worship', 'point_of_interest', 'establishment']",3,-1,hindu_temple,-1,-1,26.9082703,75.7940159
CLOSED_TEMPORARILY,"190, Shri Ram Marg, Gopalbari, Jaipur, Rajasthan 302016, India",Khade Wale Balaji Mandir...,TRUE,ChIJcdR8tvazbTkRP8xWFtSeEQQ,"{'compound_code': 'WQFR+F8 Gopalbari, Jaipur, Rajasthan', 'global_code': '7JRQWQFR+F8'}",0,"['hindu_temple', 'place_of_worship', 'point_of_interest', 'establishment']",0,-1,hindu_temple,-1,-1,26.9236417,75.7907557
CLOSED_TEMPORARILY,"Agra Rd, Near Ankur Cinema Hall, Amratpuri, Transport Nagar, Jaipur, Rajasthan 302001, India",Magaleshwar Mahadev Mandir,TRUE,ChIJtYej7sW2bTkR2mCkRapBxIo,"{'compound_code': 'WR6P+6R Transport Nagar, Jaipur, Rajasthan', 'global_code': '7JRQWR6P+6R'}",0,"['hindu_temple', 'place_of_worship', 'point_of_interest', 'establishment']",0,-1,hindu_temple,-1,-1,26.9105141,75.8370425
OPERATIONAL,"Jadon Nagar, Prithviraj Nagar, Arjun Nagar, Jaipur, Rajasthan 302020, India",balaji temple,-1,ChIJbYrBNr-1bTkRJ8TxcWs7Y_Y,"{'compound_code': 'VQ3J+CQ Arjun Nagar, Jaipur, Rajasthan', 'global_code': '7JRQVQ3J+CQ'}",4.3,"['hindu_temple', 'place_of_worship', 'point_of_interest', 'establishment']",4,-1,hindu_temple,-1,-1,26.8535129,75.7819265
CLOSED_TEMPORARILY,"2, Jacob Rd, Madrampur, Civil Lines, Jaipur, Rajasthan 302006, India",महादेव मंदिर IOW Office OLD GM Office,TRUE,ChIJjT0jke6zbTkR1OtgHAStGZo,"{'compound_code': 'WQ9P+M8 Civil Lines, Jaipur, Rajasthan', 'global_code': '7JRQWQ9P+M8'}",0,"['hindu_temple', 'place_of_worship', 'point_of_interest', 'establishment']",0,-1,hindu_temple,-1,-1,26.9191678,75.7858335
CLOSED_TEMPORARILY,"Kamala Nehru Nagar, Kamala Nagar, Hasanpura, Jaipur, Rajasthan 302006, India",Hasanpura - Mandir,TRUE,ChIJU5zbX3S0bTkR02fZbxzN2WQ,"{'compound_code': 'WQ7J+57 Hasanpura, Jaipur, Rajasthan', 'global_code': '7JRQWQ7J+57'}",3.1,"['hindu_temple', 'place_of_worship', 'point_of_interest', 'establishment']",7,-1,hindu_temple,-1,-1,26.9129599,75.7806353
OPERATIONAL,"S-34, Shanti Nagar, Near Labour Court, opp. NBC Bearing Factory, Rajasthan 302006, India",Hotel Moon Light Palace Jaipur,-1,ChIJb6H5rXW0bTkRixXWyj_K75A,"{'compound_code': 'WQ8H+2C Civil Lines, Jaipur, Rajasthan', 'global_code': '7JRQWQ8H+2C'}",4.2,"['lodging', 'restaurant', 'food', 'point_of_interest', 'establishment']",235,{'open_now': True},lodging,-1,-1,26.9151215,75.7786117
OPERATIONAL,"IIIrd Lane, 24, Hawa Sadak Rd, Nandpuri Colony, Jaipur, Rajasthan 302006, India",Hotel Rani Mahal,-1,ChIJ922iwRS0bTkRdOphwwLdqcQ,"{'compound_code': 'VQXP+F2 Jaipur, Rajasthan', 'global_code': '7JRQVQXP+F2'}",3.7,"['lodging', 'point_of_interest', 'establishment']",560,{'open_now': True},lodging,-1,-1,26.8987454,75.7850969
OPERATIONAL,"AC-4-C, Gayatri Marg, Sawai Jai Singh Hwy, Bani Park, Jaipur, Rajasthan 302016, India",Welcom Heritage Traditional Haveli,-1,ChIJ61BEmfGzbTkRERSYD7d_Dc8,"{'compound_code': 'WQGR+M5 Bani Park, Jaipur, Rajasthan', 'global_code': '7JRQWQGR+M5'}",4.5,"['lodging', 'point_of_interest', 'establishment']",748,-1,lodging,-1,-1,26.9266917,75.7904742
OPERATIONAL,"E-26, Durga Marg, near Collectorate Circle, Bani Park, Jaipur, Rajasthan 302016, India",Krishna Palace,-1,ChIJFzsS9PKzbTkRC2p50yVD-WA,"{'compound_code': 'WQHP+4H Bani Park, Jaipur, Rajasthan', 'global_code': '7JRQWQHP+4H'}",4,"['lodging', 'point_of_interest', 'establishment']",454,{'open_now': True},lodging,-1,-1,26.9277786,75.7864833
OPERATIONAL,"Mangalam GeejGarh House, Village, Hawa Sadak, Sudarshanpura, Civil Lines, Jaipur, Rajasthan 302006, India",Ginger Jaipur,-1,ChIJ-b0CTxO0bTkRDLjMSGGz5_Y,"{'compound_code': 'WQ2M+HV Civil Lines, Jaipur, Rajasthan', 'global_code': '7JRQWQ2M+HV'}",4.1,"['lodging', 'point_of_interest', 'establishment']",1929,{'open_now': True},lodging,-1,-1,26.9013889,75.7847222
OPERATIONAL,"Railway Station, B-9, opp. Hotel Rajputana Sheraton, Fateh Singh Market, Gopalbari, Jaipur, Rajasthan 302001, India","HOTEL ABHINEET PALACE, FAMILY HOTEL NEAR JAIPUR RAILWAY STATION",-1,ChIJV2013gm0bTkRRCUYohwps7I,"{'compound_code': 'WQ9R+7C Jaipur, Rajasthan', 'global_code': '7JRQWQ9R+7C'}",4.1,"['lodging', 'point_of_interest', 'establishment']",633,{'open_now': True},lodging,-1,-1,26.9181555,75.791046
OPERATIONAL,"A3,H2, Sunder Path, Banipark Near Crystall,mall, Jaipur, Rajasthan 302016, India",Hotel Golden Heritage,-1,ChIJMR5d2vazbTkRCyxPgkVgARk,"{'compound_code': 'WQFR+8V Jaipur, Rajasthan', 'global_code': '7JRQWQFR+8V'}",4.6,"['lodging', 'point_of_interest', 'establishment']",1848,{'open_now': True},lodging,-1,-1,26.923356,75.7921651
OPERATIONAL,"First Floor, 85-A, Rajamal Ka Talab, Icici Bank Building, Chandi ki Taksal, Opposite Tourist Police Station, Jaipur, Rajasthan 302002, India",Zostel,-1,ChIJtUTIFnK0bTkRgoPie3ECx0c,"{'compound_code': 'WRHH+P6 Jaipur, Rajasthan', 'global_code': '7JRQWRHH+P6'}",4.6,"['lodging', 'point_of_interest', 'establishment']",1477,{'open_now': True},lodging,-1,-1,26.9292998,75.8281061
OPERATIONAL,"B-16, First Floor, Bhawani Singh Rd, Durgadas Colony, C Scheme, Ashok Nagar, Jaipur, Rajasthan 302001, India",Blue Beds Jaipur,-1,ChIJ0ZENvBC0bTkR-YKMUQn0SLs,"{'compound_code': 'WQ2V+XP Ashok Nagar, Jaipur, Rajasthan', 'global_code': '7JRQWQ2V+XP'}",4.6,"['travel_agency', 'lodging', 'point_of_interest', 'establishment']",275,{'open_now': True},lodging,-1,-1,26.9024769,75.79427
OPERATIONAL,"Panch Batti, Dhuleshwar Garden, Hathroi, Jaipur, Rajasthan 302001, India",The Mellow,-1,ChIJV6OCZQa0bTkRz7AUt_0iIj8,"{'compound_code': 'WQ7X+J2 Hathroi, Jaipur, Rajasthan', 'global_code': '7JRQWQ7X+J2'}",3.8,"['lodging', 'point_of_interest', 'establishment']",16,-1,lodging,-1,-1,26.9141136,75.7975047
OPERATIONAL,"7, Park House, MI Road, near Ganpati Plaza, Jaipur, Rajasthan 302001, India",Moustache Jaipur,-1,ChIJ7cSGfPizbTkR1-KDSgp4T5o,"{'compound_code': 'WQ9X+R4 Jaipur, Rajasthan', 'global_code': '7JRQWQ9X+R4'}",4.4,"['lodging', 'point_of_interest', 'establishment']",1181,{'open_now': True},lodging,-1,-1,26.9195383,75.7978272
OPERATIONAL,"D-76, C Scheme, Chomu, Prithviraj Rd, Devi Niketan Compound, Jaipur, Rajasthan 302001, India",goStops Jaipur,-1,ChIJHwe5RQ-0bTkRe8DUXLRjHF8,"{'compound_code': 'WQ6V+QV Jaipur, Rajasthan', 'global_code': '7JRQWQ6V+QV'}",4.2,"['lodging', 'point_of_interest', 'establishment']",524,{'open_now': True},lodging,-1,-1,26.911921,75.7946985
OPERATIONAL,"Hathroi Fort, 59, Ajmer Rd, Jaipur, Rajasthan 302001, India",Hotel Kalyan,-1,ChIJG9_VoRy0bTkRPztag-IhVME,"{'compound_code': 'WQ8W+CC Jaipur, Rajasthan', 'global_code': '7JRQWQ8W+CC'}",4.3,"['lodging', 'point_of_interest', 'establishment']",1923,{'open_now': True},lodging,-1,-1,26.9161,75.796008
OPERATIONAL,"Station Road, Near Central Bus Stand, Jaipur, Rajasthan 302001, India",Fort Chandragupt,-1,ChIJ7Uepzv6zbTkRZZ88WC5sw8k,"{'compound_code': 'WRF2+CM Jaipur, Rajasthan', 'global_code': '7JRQWRF2+CM'}",4,"['lodging', 'point_of_interest', 'establishment']",1413,-1,lodging,-1,-1,26.9235625,75.8016944
OPERATIONAL,"Plot No. 9, opp. ITC Rajputana Sheraton, Fateh Singh Market, Goplabari, Jaipur, Rajasthan 302006, India",Hotel Metro Inn,-1,ChIJ7RkuaG-1bTkRBadoTcQZ5TI,"{'compound_code': 'WQ9R+5P Jaipur, Rajasthan', 'global_code': '7JRQWQ9R+5P'}",3.9,"['lodging', 'point_of_interest', 'establishment']",591,{'open_now': True},lodging,-1,-1,26.9178929,75.7918352
OPERATIONAL,"Building no. C10, 2nd floor, Shyam Nagar, Jaipur, Rajasthan 302019, India",Jaipur Sundeck Hostel,-1,ChIJZS1Tx2a0bTkReswuj30aX1Q,"{'compound_code': 'VQW8+VW Shyam Nagar, Jaipur, Rajasthan', 'global_code': '7JRQVQW8+VW'}",4,"['lodging', 'point_of_interest', 'establishment']",126,{'open_now': True},lodging,-1,-1,26.897126,75.767309
OPERATIONAL,"D1-2A, Behind Collectorate, Via Bank Road, Bani Park, Jaipur, Rajasthan 302016, India",Umaid Bhawan Hotel,-1,ChIJ5w_4AfGzbTkRQtcJSYEZtVw,"{'compound_code': 'WQHR+9W Jaipur, Rajasthan', 'global_code': '7JRQWQHR+9W'}",4.3,"['lodging', 'point_of_interest', 'establishment']",1158,{'open_now': True},lodging,-1,-1,26.928435,75.792362
OPERATIONAL,"54, Lane Number 2, Ajmer Road, Gopalbari, Jaipur, Rajasthan 302001, India",Pearl Palace Heritage,-1,ChIJ7RlVqwm0bTkRZISybPIzj7s,"{'compound_code': 'WQ8R+9W Gopalbari, Jaipur, Rajasthan', 'global_code': '7JRQWQ8R+9W'}",4.7,"['lodging', 'point_of_interest', 'establishment']",251,-1,lodging,-1,-1,26.9159108,75.792374
OPERATIONAL,"D-249, Devi Marg, Bani Park, Jaipur, Rajasthan 302016, India",Anuraag Villa,-1,ChIJsxoYKfKzbTkRmXNR4I2cnA4,"{'compound_code': 'WQGQ+VM Bani Park, Jaipur, Rajasthan', 'global_code': '7JRQWQGQ+VM'}",4.5,"['lodging', 'restaurant', 'food', 'point_of_interest', 'establishment']",400,{'open_now': True},lodging,-1,-1,26.9272302,75.7892074
OPERATIONAL,"Plot No, 4, Kabir Marg, Sen Colony, Bani Park, Jaipur, Rajasthan 302016, India",Vinayak Guest House,-1,ChIJf2K9TfGzbTkRJnspOu5IyuI,"{'compound_code': 'WQFR+M3 Bani Park, Jaipur, Rajasthan', 'global_code': '7JRQWQFR+M3'}",4.1,"['lodging', 'point_of_interest', 'establishment']",196,{'open_now': True},lodging,-1,-1,26.9242095,75.790163
CLOSED_TEMPORARILY,"Johri bazar near jama masjid shop no 167 Johri bazar near jama masjid shop no167, Jaipur, Rajasthan 302001, India",Jaipur Handicraft,TRUE,ChIJbZhjzLS2bTkRBNlUtpn-9-0,"{'compound_code': 'WRCG+QF Jaipur, Rajasthan', 'global_code': '7JRQWRCG+QF'}",4.2,"['mosque', 'place_of_worship', 'point_of_interest', 'establishment']",500,-1,mosque,-1,-1,26.9218754,75.8261712
OPERATIONAL,"Packers And Movers, Packers And Movers In Sanganer Packers And Movers Sanganer Packers And Movers In, Pratap Nagar, Jaipur, Rajasthan 302029, India",Pacckers and Moѵers 𝟡𝟞𝟟𝟚𝟜 𝟜𝟚𝟞𝟛𝟠,-1,ChIJXero4hLKbTkRHLnK5YC2IiQ,"{'compound_code': 'RQ98+P5 Pratap Nagar, Jaipur, Rajasthan', 'global_code': '7JRQRQ98+P5'}",4.2,"['mosque', 'place_of_worship', 'point_of_interest', 'establishment']",142,{'open_now': True},mosque,-1,-1,26.8193172,75.7654789
CLOSED_TEMPORARILY,"Jawahar Nagar, Bajaj Nagar, Jaipur, Rajasthan 302015, India",Mosque,TRUE,ChIJQxLkAi20bTkROVD_zHIOhHE,"{'compound_code': 'VQGX+36 Bajaj Nagar, Jaipur, Rajasthan', 'global_code': '7JRQVQGX+36'}",4.8,"['mosque', 'place_of_worship', 'point_of_interest', 'establishment']",17,-1,mosque,-1,-1,26.8752128,75.7980411
CLOSED_TEMPORARILY,"C Scheme, Ashok Nagar, Jaipur, Rajasthan 302001, India",Raiyan Masjid,TRUE,ChIJo-XJbBC0bTkRlvU8RYP3N2w,"{'compound_code': 'WQ4V+7R Ashok Nagar, Jaipur, Rajasthan', 'global_code': '7JRQWQ4V+7R'}",4.5,"['mosque', 'place_of_worship', 'point_of_interest', 'establishment']",121,-1,mosque,-1,-1,26.9056401,75.7945128
CLOSED_TEMPORARILY,"Hawa Mahal Rd, Kamal Gatta Colony, Kanwar Nagar, Jaipur, Rajasthan 302002, India",Masjid Gudajgaran Jaipur,TRUE,ChIJs4AdjkmxbTkRt7GSdrayBxQ,"{'compound_code': 'WRHH+C8 Kanwar Nagar, Jaipur, Rajasthan', 'global_code': '7JRQWRHH+C8'}",4.1,"['mosque', 'place_of_worship', 'point_of_interest', 'establishment']",13,-1,mosque,-1,-1,26.928597,75.8282797
CLOSED_TEMPORARILY,"Mansarovar Sector 3, Mansarovar, Jaipur, Rajasthan 302020, India",Mansarover Mosque,TRUE,ChIJF26hKQC1bTkRUPpuHFxTrwY,"{'compound_code': 'VQ95+G7 Mansarovar, Jaipur, Rajasthan', 'global_code': '7JRQVQ95+G7'}",4.3,"['mosque', 'place_of_worship', 'point_of_interest', 'establishment']",174,-1,mosque,-1,-1,26.8687895,75.7581544
CLOSED_TEMPORARILY,"Jalupura Main Road, Jaipur, Rajasthan 302001, India",Noorani Masjid,TRUE,ChIJR_ZiW1WxbTkRNEbGSKoVnoQ,"{'compound_code': 'WRC5+C2 Jaipur, Rajasthan', 'global_code': '7JRQWRC5+C2'}",4.5,"['mosque', 'place_of_worship', 'point_of_interest', 'establishment']",82,-1,mosque,-1,-1,26.9210206,75.8075359
CLOSED_TEMPORARILY,"89, Lane Number 4, Hawa Sadak, Geejgarh Vihar Colony, Bais Godam, Jaipur, Rajasthan 302007, India",Masjid Bais Godam,TRUE,ChIJ4zJY8BS0bTkRn-dzp3FX_A0,"{'compound_code': 'VQXP+9C Jaipur, Rajasthan', 'global_code': '7JRQVQXP+9C'}",4.4,"['mosque', 'place_of_worship', 'point_of_interest', 'establishment']",90,-1,mosque,-1,-1,26.8984808,75.7860095
CLOSED_TEMPORARILY,"makka colony fectory area jhotwara jaipur rajasthan, makka colony, Bismilla Colony, Shivaji Nagar, Jhotwara, Jaipur, Rajasthan 302012, India",Makka Masjid Fectory Area Jhotwara Jaipur,TRUE,ChIJPTjZYQ-zbTkRrH3s9Ff2Noc,"{'compound_code': 'WQX3+H5 Jhotwara, Jaipur, Rajasthan', 'global_code': '7JRQWQX3+H5'}",4.4,"['mosque', 'place_of_worship', 'point_of_interest', 'establishment']",54,-1,mosque,-1,-1,26.9489606,75.7528917
CLOSED_TEMPORARILY,"Sodala, Jaipur, Rajasthan 302006, India",Sushilpura Mosque,TRUE,ChIJk_vLxGO0bTkRzfTUhV9nPvk,"{'compound_code': 'VQX7+HQ Jaipur, Rajasthan', 'global_code': '7JRQVQX7+HQ'}",4.1,"['mosque', 'place_of_worship', 'point_of_interest', 'establishment']",84,-1,mosque,-1,-1,26.8989781,75.7643967
CLOSED_TEMPORARILY,"NBC Rd, Rajiv Nagar, Shanti Nagar, Civil Lines, Jaipur, Rajasthan 302006, India",Ajmeri Masjid,TRUE,ChIJf7fBYHa0bTkRzGJ4gvZVvts,"{'compound_code': 'WQ7G+MH Civil Lines, Jaipur, Rajasthan', 'global_code': '7JRQWQ7G+MH'}",3.7,"['mosque', 'place_of_worship', 'point_of_interest', 'establishment']",29,-1,mosque,-1,-1,26.9142177,75.7764886
CLOSED_TEMPORARILY,"Ghat Gate, Ghat Gate Bazar, Pink City, Jaipur, Rajasthan 302003, India",Behlol Khan Masjid,TRUE,ChIJo3MXesm2bTkRigenfy-yjJw,"{'compound_code': 'WR8M+G7 Jaipur, Rajasthan', 'global_code': '7JRQWR8M+G7'}",4.4,"['mosque', 'place_of_worship', 'point_of_interest', 'establishment']",118,-1,mosque,-1,-1,26.9162911,75.833218
CLOSED_TEMPORARILY,"277, Char Darwaja, Chokdi Gangapol, Jaipur, Rajasthan 302002, India",Shai jama masjid subhash chowk Jaipur,TRUE,ChIJAR69VTaxbTkRDp-xiU_CnGg,"{'compound_code': 'WRJM+C5 Chokdi Gangapol, Jaipur, Rajasthan', 'global_code': '7JRQWRJM+C5'}",3,"['mosque', 'place_of_worship', 'point_of_interest', 'establishment']",2,-1,mosque,-1,-1,26.931003,75.832957
CLOSED_TEMPORARILY,"Pulia Mosque, near railway 3rd Gate, Hasanpura flyover, Jaipur, Rajasthan 302006, India",Mosque Sultan Fatakwali,TRUE,ChIJvySpAfazbTkRs_PrpjCwrug,"{'compound_code': 'WQ9Q+8V Jaipur, Rajasthan', 'global_code': '7JRQWQ9Q+8V'}",4.6,"['mosque', 'place_of_worship', 'point_of_interest', 'establishment']",28,-1,mosque,-1,-1,26.9183355,75.7896848
CLOSED_TEMPORARILY,"Jaipur, Berava Basti, Purani Basti, Jaipur, Rajasthan 302001, India",Nilgero Ki Masjid,TRUE,ChIJr9L3xlqxbTkRFaY__pQ_CBE,"{'compound_code': 'WRM9+M2 Purani Basti, Jaipur, Rajasthan', 'global_code': '7JRQWRM9+M2'}",4,"['mosque', 'place_of_worship', 'point_of_interest', 'establishment']",17,-1,mosque,-1,-1,26.9342292,75.8176207
CLOSED_TEMPORARILY,"Hasanpura Rd, Gopalbari, Jaipur, Rajasthan 302001, India",Kausar-e-Deen Mosque,TRUE,ChIJu078KvazbTkRQsGKzPdkJOY,"{'compound_code': 'WQ9R+FW Gopalbari, Jaipur, Rajasthan', 'global_code': '7JRQWQ9R+FW'}",4.3,"['mosque', 'place_of_worship', 'point_of_interest', 'establishment']",15,-1,mosque,-1,-1,26.918632,75.792291
CLOSED_TEMPORARILY,"Ghat Gate, Ghat Gate Bazar, Pink City, Jaipur, Rajasthan 302003, India",Luharo Ki Masjid,TRUE,ChIJI6jIxcu2bTkRIKz_j5Qbqm0,"{'compound_code': 'WR9M+3G Jaipur, Rajasthan', 'global_code': '7JRQWR9M+3G'}",4.6,"['mosque', 'place_of_worship', 'point_of_interest', 'establishment']",69,-1,mosque,-1,-1,26.9177406,75.8338189
CLOSED_TEMPORARILY,"Jamuna Nagar, Sodala, Jaipur, Rajasthan 302006, India",Masjid Noor,TRUE,ChIJY76EvnC0bTkRZtb3ieHoVec,"{'compound_code': 'WQ5F+G7 Sodala, Jaipur, Rajasthan', 'global_code': '7JRQWQ5F+G7'}",4.1,"['mosque', 'place_of_worship', 'point_of_interest', 'establishment']",38,-1,mosque,-1,-1,26.9087729,75.7731822
CLOSED_TEMPORARILY,"Subhash Chowk, Motikatla Bazar, Ramchandra Chaukari, Jaipur, Rajasthan 302002, India",Shia Jame Masjid,TRUE,ChIJxeTabDaxbTkRD3DTeo66te8,-1,4.6,"['mosque', 'place_of_worship', 'point_of_interest', 'establishment']",10,-1,mosque,-1,-1,26.9291588,75.8316613
OPERATIONAL,"Jai Mahal Palace, Jacob Rd, Civil Lines, Jaipur, Rajasthan 302006, India",Marble Arch,-1,ChIJr6wHJgy0bTkRWlnPE7es48Y,"{'compound_code': 'WQ6P+V3 Civil Lines, Jaipur, Rajasthan', 'global_code': '7JRQWQ6P+V3'}",4.5,"['restaurant', 'food', 'point_of_interest', 'establishment']",66,{'open_now': True},restaurant,-1,-1,26.912209,75.7851361
OPERATIONAL,"Amer, Jaipur, Rajasthan 302028, India",Zeeman Restaurant,-1,ChIJ-dQvzLSxbTkRnZZltEXLveA,"{'compound_code': 'XVQ3+X6 Amer, Jaipur, Rajasthan', 'global_code': '7JRQXVQ3+X6'}",4.7,"['restaurant', 'food', 'point_of_interest', 'establishment']",122,{},restaurant,-1,-1,26.9899745,75.8530768
OPERATIONAL,"405, Tonk Rd, Jai Jawan-2, Choti Chopad, Chandrakala Colony, Durgapura, Jaipur, Rajasthan 302018, India",Atsui Restaurant,-1,ChIJDyEmQu-1bTkR7CiJLEOeeWc,"{'compound_code': 'RQRV+XM Durgapura, Jaipur, Rajasthan', 'global_code': '7JRQRQRV+XM'}",4.4,"['restaurant', 'food', 'point_of_interest', 'establishment']",33,{'open_now': False},restaurant,4,-1,26.8424036,75.7942104
OPERATIONAL,"Hotel The Radiant Star, C 28, Pankaj Singhvi Marg, Lal Kothi, Jaipur, Rajasthan 302015, India",Fusion Restro,-1,ChIJ38cnWiG0bTkR7AlLXt1SURA,"{'compound_code': 'VRR2+FP Jaipur, Rajasthan', 'global_code': '7JRQVRR2+FP'}",4.4,"['meal_takeaway', 'cafe', 'restaurant', 'food', 'point_of_interest', 'store', 'establishment']",89,{'open_now': True},restaurant,-1,-1,26.8911436,75.8018728
OPERATIONAL,"plot no 5,6,7-D villa khasa kothi, Station Rd, Jaipur, Rajasthan 302001, India",ataari roof top cafe & restaurant,-1,ChIJSxq_hPezbTkRwQ4tz_FkpC8,"{'compound_code': 'WQCV+CV Jaipur, Rajasthan', 'global_code': '7JRQWQCV+CV'}",4.5,"['restaurant', 'food', 'point_of_interest', 'establishment']",49,{'open_now': False},restaurant,-1,-1,26.9211199,75.7946331
OPERATIONAL,"14, Motilal Atal Rd, opp. Neelam Restaurat, Sindhi Camp, Jaipur, Rajasthan 302001, India",Mohan Restaurant,-1,ChIJ9-X4jvizbTkRuv5_bbsAHxs,"{'compound_code': 'WQCX+2F Sindhi Camp, Jaipur, Rajasthan', 'global_code': '7JRQWQCX+2F'}",4.1,"['meal_delivery', 'meal_takeaway', 'restaurant', 'food', 'point_of_interest', 'establishment']",879,{'open_now': True},restaurant,2,-1,26.9201124,75.7987493
CLOSED_TEMPORARILY,"Tonk Rd, near mazar, Taron Ki Koont, Jaipur, Rajasthan 302029, India",Tree House Sweets & Restaurants,TRUE,ChIJf4a_dfK1bTkRZA2NZw658Cg,"{'compound_code': 'RQMV+PJ Taron Ki Koont, Jaipur, Rajasthan', 'global_code': '7JRQRQMV+PJ'}",4.9,"['restaurant', 'food', 'point_of_interest', 'establishment']",45,-1,restaurant,-1,-1,26.8343136,75.7940987
OPERATIONAL,"Plot No 726 Morija House, Mishra Rajaji Ka Rasta, Jaipur, Rajasthan 302001, India",Old street restaurant,-1,ChIJu7XDNpK3bTkRL8Cz46Wn10g,"{'compound_code': 'WR98+F3 Jaipur, Rajasthan', 'global_code': '7JRQWR98+F3'}",4.6,"['restaurant', 'food', 'point_of_interest', 'establishment']",27,{'open_now': True},restaurant,-1,-1,26.918741,75.815127
OPERATIONAL,"Shop No.273, Choura Rasta, Pink City, Bapu Bazar, Biseswarji, Jaipur, Rajasthan 302003, India",Samrat Restaurant,-1,ChIJda0wLLO2bTkRc3FVR8w45JE,"{'compound_code': 'WRCC+FV Biseswarji, Jaipur, Rajasthan', 'global_code': '7JRQWRCC+FV'}",4.2,"['cafe', 'restaurant', 'food', 'point_of_interest', 'establishment']",785,{'open_now': True},restaurant,1,-1,26.921231,75.8221565
OPERATIONAL,"80, Madhyam Marg, Sector 21, Mansarovar, Jaipur, Rajasthan 302020, India",Swaad Restaurant And Tiffin Center,-1,ChIJr-pKOUK0bTkRaf01hEdWtOM,"{'compound_code': 'VQG3+W4 Mansarovar, Jaipur, Rajasthan', 'global_code': '7JRQVQG3+W4'}",4.7,"['restaurant', 'food', 'point_of_interest', 'store', 'establishment']",107,{'open_now': True},restaurant,-1,-1,26.8773196,75.7527896
OPERATIONAL,"Streets Food Truck, 145-146, Kings Rd, near Ajmera Garden, Ajmera Garden, Shanti Nagar, DCM, Jaipur, Rajasthan 302019, India",Dosa and more,-1,ChIJ5755dQ21bTkREP13qavY7YM,"{'compound_code': 'VQV2+W9 Jaipur, Rajasthan', 'global_code': '7JRQVQV2+W9'}",4.6,"['restaurant', 'food', 'point_of_interest', 'establishment']",43,{'open_now': True},restaurant,-1,-1,26.8948362,75.7509675
OPERATIONAL,"C/11, 3rd Floor, Prithviraj Rd, C Scheme, Ashok Nagar, Jaipur, Rajasthan 302001, India","Little Italy Restaurant, Jaipur",-1,ChIJKXwKvq22bTkRAGQgNuOau-I,"{'compound_code': 'WQ6X+8C Ashok Nagar, Jaipur, Rajasthan', 'global_code': '7JRQWQ6X+8C'}",4.3,"['restaurant', 'food', 'point_of_interest', 'establishment']",1444,{'open_now': True},restaurant,3,-1,26.9108494,75.7986025
OPERATIONAL,"Near JECC, Tonk Rd, Sitapura, Jaipur, Rajasthan 302033, India",The CaveLand Restaurant,-1,ChIJmxmUNpvJbTkR3n9DVAo1boI,"{'compound_code': 'QRR9+3J Sitapura, Jaipur, Rajasthan', 'global_code': '7JRQQRR9+3J'}",4.1,"['restaurant', 'food', 'point_of_interest', 'establishment']",195,{'open_now': True},restaurant,-1,-1,26.7902264,75.8191237
OPERATIONAL,"E-54, near Agarwal Caterers, Shastri Nagar, Jaipur, Rajasthan 302032, India",Tipsy Restaurant,-1,ChIJIZK9cuezbTkRkns5Vq9WXd4,"{'compound_code': 'WQRX+8G Shastri Nagar, Jaipur, Rajasthan', 'global_code': '7JRQWQRX+8G'}",4.2,"['restaurant', 'food', 'point_of_interest', 'establishment']",1542,{'open_now': True},restaurant,2,-1,26.9408068,75.7988556
OPERATIONAL,"Shop 98, Ram Gali 1, Panchwati Circle, Sector 1, Raja Park, Jaipur, Rajasthan 302004, India",Pritam Family Restaurant,-1,ChIJ8YNrTuu2bTkRhi0tIsxZTeQ,"{'compound_code': 'VRVJ+Q6 Jaipur, Rajasthan', 'global_code': '7JRQVRVJ+Q6'}",4,"['restaurant', 'food', 'point_of_interest', 'establishment']",146,{'open_now': True},restaurant,2,-1,26.8943845,75.8306156
OPERATIONAL,"G-3,B-2/530, Chitrakoot, Jaipur, Rajasthan 302021, India",The Banna's Recipes,-1,ChIJkSerNZy1bTkR11dGi6b3XyU,"{'compound_code': 'WP2P+R4 Chitrakoot, Jaipur, Rajasthan', 'global_code': '7JRQWP2P+R4'}",4.9,"['restaurant', 'food', 'point_of_interest', 'establishment']",38,{'open_now': True},restaurant,-1,-1,26.902118,75.735259
OPERATIONAL,"Hotel OM Tower, M I Road, Church Road, Jaipur, Rajasthan 302001, India",Revolving Restaurant,-1,ChIJXSKhQQe0bTkRxOkGmC3Ety4,"{'compound_code': 'WQ9X+5X Jaipur, Rajasthan', 'global_code': '7JRQWQ9X+5X'}",3.9,"['restaurant', 'food', 'point_of_interest', 'establishment']",162,{'open_now': True},restaurant,3,-1,26.917919,75.799985
OPERATIONAL,"F 163, Chaitanya Marg, C Scheme, Ashok Nagar, Jaipur, Rajasthan 302001, India","Looters restaurant, c scheme,",-1,ChIJYdwl8YG1bTkRlnqYXGPQBUM,"{'compound_code': 'WQ5X+V4 Jaipur, Rajasthan', 'global_code': '7JRQWQ5X+V4'}",4.4,"['restaurant', 'food', 'point_of_interest', 'establishment']",412,{'open_now': True},restaurant,-1,-1,26.909691,75.797771
OPERATIONAL,"C 84, Prithviraj Rd, C Scheme, Ashok Nagar, Jaipur, Rajasthan 302001, India",Culture Restaurant,-1,ChIJE68c_QS0bTkRiCPYmeEaUp8,"{'compound_code': 'WQ5X+W8 Ashok Nagar, Jaipur, Rajasthan', 'global_code': '7JRQWQ5X+W8'}",4.1,"['restaurant', 'food', 'point_of_interest', 'establishment']",604,{'open_now': True},restaurant,3,-1,26.9098278,75.798351
OPERATIONAL,"C-10, Opp WTP, Lal Bahadur Nagar, Jai Jawan Colony, Malviya Nagar, Jaipur, Rajasthan 302017, India",Celebration Restaurant jaipur,-1,ChIJXW8UdWO1bTkRk2MBw0Kj_wo,"{'compound_code': 'VR23+53 Malviya Nagar, Jaipur, Rajasthan', 'global_code': '7JRQVR23+53'}",4,"['restaurant', 'food', 'point_of_interest', 'establishment']",411,{'open_now': True},restaurant,2,-1,26.8504453,75.802729
-1,-1,-1,-1,-1,-1,-1,-1,-1,-1,rv_park,-1,0,,
CLOSED_TEMPORARILY,"Nandan Apartment, C-72(B), Sarojini Marg, C-Scheme, Panch Batti, Ashok, Nagar, Ja, Jaipur, Rajasthan 302001, India",Indo- Cosmétique et Trichologie,TRUE,ChIJ8X0XGKi2bTkR_4KxFDXEgzM,"{'compound_code': 'WR55+W2 Jaipur, Rajasthan', 'global_code': '7JRQWR55+W2'}",5,"['synagogue', 'place_of_worship', 'point_of_interest', 'establishment']",1,-1,synagogue,-1,-1,26.909757,75.807537
CLOSED_TEMPORARILY,"Shop No 3105, Bagrun Walo ka Rastha, Last Crossing, Chand Poll, Jaipur, Rajasthan 302001, India",Bajranj Bali Asscoits,TRUE,ChIJ7fboyQC0bTkRf6A85ZwApdo,-1,0,"['synagogue', 'place_of_worship', 'point_of_interest', 'establishment']",0,-1,synagogue,-1,-1,26.917892,75.801538
OPERATIONAL,"2/526, Malviya Nagar Rd, Sector 2, Malviya Nagar, Jaipur, Rajasthan 302017, India",Satguru Sai Foundation,-1,ChIJ0-A5Wg22bTkRh6Hj7a9XYPw,"{'compound_code': 'RRXC+46 Jaipur, Rajasthan', 'global_code': '7JRQRRXC+46'}",4.3,"['point_of_interest', 'establishment']",12,{'open_now': True},synagogue,-1,-1,26.84779,75.8205312
OPERATIONAL,"Devisinghpura, Amer, Jaipur, Rajasthan 302001, India",Amber Palace,-1,ChIJ-w3Sy1qwbTkRK34UR2ffIWI,"{'compound_code': 'XVP2+5G Amer, Jaipur, Rajasthan', 'global_code': '7JRQXVP2+5G'}",4.6,"['tourist_attraction', 'premise', 'point_of_interest', 'establishment']",93670,{'open_now': False},tourist_attraction,-1,-1,26.9854865,75.8513454
