,Name,Rating,Link,Distance,Location,About
60,Secretariat Park,,https://www.holidify.com/places/chennai/secretariat-park-sightseeing-125002.html,5 km  from city center,,"Located opposite the Secretariat at Fort St. George near the Chennai Port, the Secretariat Park is beautiful urban park in the city. Initially an underdeveloped piece of land, the area has now been transformed into a vast green space ideal for morning and evening walks or/and to spend some outdoor time amidst fresh air and lush greenery."
61,Anna Nagar Tower Park,,https://www.holidify.com/places/chennai/anna-nagar-tower-park-sightseeing-125003.html,5 km  from city center,,"Anna Nagar Tower Park, also known as Dr. Visveswaraya Tower Park is an urban park located in the Anna Nagar suburb of Chennai. The highlight of the park is the 135 ft. tower built at the centre of the park. The tower was constructed in 1968 as part of the World Trade Fair and is still the major attraction of the garden."
62,People's Park,,https://www.holidify.com/places/chennai/peoples-park-sightseeing-125004.html,3 km  from city center,,"Built in the 19th century, People's Park is one of the oldest and among the most popular parks in Chennai. Spread over 112 acres of land, the park is home to 12 lakes which also facilitate boating. Laced with shady green trees, the park is ideal for morning and evening walks."
63,Semmozhi Poonga,,https://www.holidify.com/places/chennai/semmozhi-poonga-sightseeing-125005.html,1 km  from city center,,"Opened in November 2010, Semmozhi Poonga is the first botanical park of Chennai. Boasting of over 500 species of plants, the collection includes herbs and medicinal plants as well. The entire park has been divided into 8 zones with an individual theme. The park is one of the most popular tourist spot of the city owing to its charm, beauty and bounteous nature."
64,Nageswara Rao Park,,https://www.holidify.com/places/chennai/nageswara-rao-park-sightseeing-125006.html,3 km  from city center,,"Located in Mylapore in Chennai, Nageswara Rao Park is an urban park spread over 4 acres of land. It has a badminton area and a separate play section for kids. Besides, the park also hosts civic forums and musical functions."
65,Jeeva Park,,https://www.holidify.com/places/chennai/jeeva-park-sightseeing-125007.html,2 km  from city center,,"Located on the GN Jetty Road, Jeeva Park is a popular green park in Chennai. Especially popular among the joggers and kids, the park is also visited by groups of friends and family for a day's picnic or to spend some quality time amidst nature and lush greenery."
66,May Day Park,,https://www.holidify.com/places/chennai/may-day-park-sightseeing-125008.html,3 km  from city center,,"Originally named as Napier Park and later renamed, May Day Park is located in Chintadripet in Chennai. Opened in 1950, the park used to hold political rallies and May Day celebrations. Now it has facilities for sports like cricket, football, volleyball and badminton and is replenished with lush green trees."
67,Natesan Park,,https://www.holidify.com/places/chennai/natesan-park-sightseeing-125009.html,3 km  from city center,,"Located in T. Nagar in Chennai, Natesan Park sprawls over an area of 4 acres. Maintained by Chennai Corporation, the park has a separate tennis coaching for children. Besides it has a plant propagation  centre and a separate play area for kids."
68,Sivan Park,,https://www.holidify.com/places/chennai/sivan-park-sightseeing-125010.html,5 km  from city center,,"Situated in KK Nagar, Sivan Park is a relatively smaller park in Chennai. Blooming with vibrant flowers and buzzing with activity, the park is a haven for joggers. The park is generously graced with numerous green trees and is visited by friends and family to spend some time in bounteous nature."
69,Phoenix MarketCity,,https://www.holidify.com/places/chennai/phoenix-marketcity-sightseeing-125138.html,8 km  from city center,,"Phoenix MarketCity Mall is the largest mall in Chennai and is situated in Indira Gandhi Nagar, Velachery. The mall boasts of a number of brand outlets for apparels, footwear, accessories, electronic gadgets etc, both international and domestic. It also has a food court, cinema multiplex, gaming zone and parking facility."
70,Guindy National Park,,https://www.holidify.com/places/chennai/guindy-national-park-sightseeing-125235.html,6 km  from city center,,"One of the must-visit attractions in Chennai is Guindy National Park. Ranked as the eighth smallest National Park in India, Guindy National Park is spread over 2.70 km square in the Protected area of Tamil Nadu, Chennai. These protected areas are maintained by the Ministry of Environment and Forests. You must also know that this the only park which is located inside a city. Before the park came into existence, this space was considered as an extended part of the Guindy Lodge which is presently referred to as the Raj Bhavan, the Governor of Tamil Nadu’s official home"
71,Ripon Building,,https://www.holidify.com/places/chennai/ripon-building-sightseeing-125257.html,3 km  from city center,,"A classic example of Neoclassical style architecture, Ripon Building was constructed in the year 1913 to seat the Madras Corporation. Currently, it is occupied by the Greater Chennai Corporation. The building is splendid to look at and can only be visited with prior appointment."
72,Higginbotham's,,https://www.holidify.com/places/chennai/higginbothams-sightseeing-125258.html,2 km  from city center,,"Built in 1905, Higginbotham's is the oldest bookstore in the city. Situated on the Mount Road in Chennai, the bookstore was originally opened by Abel Joshua Higginbotham- a British stowaway."
73,St,,https://www.holidify.com/places/chennai/st-thomas-mount-church-sightseeing-125259.html,9 km  from city center,,"St. Thomas Mount Church is a shrine situated atop a hillock called St. Thomas Mount in Chennai, which is also known as Parangimalai. The shrine was built in 1523 and is dedicated to Mother Mary - ""Our Lady of Expectation"". You can reach the church through 160 steps leading to the hill top."
74,Madras High Court,,https://www.holidify.com/places/chennai/madras-high-court-sightseeing-125260.html,5 km  from city center,,"Constructed in 1892, Madras High Court is an important landmark in the city of Chennai. It is one of the three courts in the country established by letters patents granted by Queen Victoria."
75,Napier Bridge,,https://www.holidify.com/places/chennai/napier-bridge-sightseeing-125261.html,4 km  from city center,,"Napier Bridge is the oldest bridge in the city, built by Francis Napier in 1869 who the then Governor General. The bridge is constructed over River Coovam and connects Fort St. George and Marina Beach."
76,Apparao Art Gallery,,https://www.holidify.com/places/chennai/apparao-art-gallery-sightseeing-1253338.html,0 km  from city center,,"Apparao is one of the oldest and the most popular privately owned art galleries situated in Nungambakkam, Chennai. The gallery promotes the art, skilled and talented works of the budding contemporary artists."
77,Lalit Kala Akademy,,https://www.holidify.com/places/chennai/lalit-kala-akademy-sightseeing-1253339.html,1 km  from city center,,"Situated on the Greams Road, Thousand Lights West in Chennai, Tamil Nadu, Lalit Kala Akademy is run by Ministry of Culture, GOI and is known to be the country's premium institute for fine arts. Besides conducting various workshops and exhibitions, it is also the best place to study traditional and modern art."
78,Focus Art Gallery,,https://www.holidify.com/places/chennai/focus-art-gallery-sightseeing-1253340.html,1 km  from city center,,"Focus Art Gallery is situated on the Rukmani Lakshmipathi Rd, Balaji Nagar, Egmore in Chennai and is known to be one of the finest art galleries in the city. The gallery is invested in the contemporary art forms and displays works of both the international and domestic artists."
79,Cholamandalam Artists’ Village,,https://www.holidify.com/places/chennai/cholamandalam-artists-village-sightseeing-1253341.html,15 km  from city center,,"Cholamandalam Artists’ Village is situated in Injambakkam in Chennai. The gallery is spread over 10 acres and was established by the brilliant artist KCS Paniker in 1966. The gallery exhibits and displays works of artists who contributed for the ""Madras Movement""."
80,The Faraway Tree Art Gallery,,https://www.holidify.com/places/chennai/the-faraway-tree-art-gallery-sightseeing-1253342.html,2 km  from city center,,"Situated along the Parthasarathi Puram Road on T Nagar in Chennai, The Far Away Tree Gallery is a wonderful done and decorated gallery focusing on contemporary Indian art. The gallery is predominated by artists from the south region. Some of the popular names in the gallery are Gopinath P, Keiko Mima, Akmal Husain etc."
81,Forum Art Gallery,,https://www.holidify.com/places/chennai/forum-art-gallery-sightseeing-1253343.html,6 km  from city center,,"Located in Adyar, Chennai, Forum Art Gallery is one amongst the most popular art galleries of the town. It was founded in 1997 by Shalini Biswajit and focuses on the contemporary art forms. The wide variety of exhibits in the gallery include paintings, sculptures, ceramics, photographs etc."
82,Gallery Veda,,https://www.holidify.com/places/chennai/gallery-veda-sightseeing-1253346.html,0 km  from city center,,"Gallery Veda was started by Preeti Garg and currently has two branches in Chennai- one at Nungambakkam and the other at OMR. The gallery was started with the idea to reach out to the masses and introduce them to the different facets of art. For the same reasons, the gallery conducts various workshops and exhibitions throughout the year."
83,Artworld Sarala's Art Centre,,https://www.holidify.com/places/chennai/artworld-saralas-art-centre-sightseeing-1253347.html,3 km  from city center,,"Artworld Sarala's Art Centre is located on the 3rd Street, Off Cenotaph Road, Teynampet in Chennai and caters to the interest of art lovers from all across the country. Started by Bishwajit Banerjee and Sarala Banerjee in 1965, the gallery continues to stay one of the oldest and most significant in the city."
84,Birla Planetarium Chennai,,https://www.holidify.com/places/chennai/birla-planetarium-chennai-sightseeing-1255014.html,5 km  from city center,,"Housed in Periyar Science and Technology Center in Kotturpuram is the infamous and large Birla Planetarium, known for its virtual tours of the night sky as well as for hosting regular cosmic shows in the inner spherical shaped dome composed of aluminium. Birla Planetarium in Chennai had been founded around 30 years ago, yet it considered to be one of the most modern planetariums in the country, serving as a popular place for school trips in Chennai and a wonderful place for stargazing and exploring the galleries and parks."
85,Gurudwara Sahib,,https://www.holidify.com/places/chennai/gurudwara-sahib-sightseeing-1255129.html,3 km  from city center,,"A cleanly maintained Gurudwara, located at a calm distance from the central hustle of Chennai, was built in 1949. Gurudwara Sahib is well known for its services of langar, low-cost rooms, peaceful environment and gentle learning of the Sikh culture and its value."
86,Madhya Kailash,,https://www.holidify.com/places/chennai/madhya-kailash-sightseeing-1257355.html,6 km  from city center,,"Located at the junction between Adyar, Sardar Patel Road and Rajiv Gandhi Salai in South Chennai, Madhya Kailash is a revered Hindu temple which is enshrined by Venkata Ananda Vinayakar. The main deity is enveloped by shrines of Lord Siva, Vishnu, Surya and Devi. However, the highlight of the temple is the unique idol of 'Adhyantha Prabhu' which is part Lord Ganesha and part Lord Hanuman, meaning the right half is Lord Ganesha and the left half is Lord Hanuman. Locally known as Nadukkayilai, the temple has a lot of legend and myth associated with it and is thronged by thousands of pilgrims and devotees."
87,Quibble Island,,https://www.holidify.com/places/chennai/quibble-island-sightseeing-1257943.html,5 km  from city center,,"Based in the Adyar River in Chennai in Tamil Nadu, Quibble Island is the largest of the four tiny islands formed in the salt water lagoon. The island is famous for the large European cemetery situated in the centre. This cemetery is believed to have been built  here after a battle was fought between French-led Indian soldiers and Nawab forces. Quibble Island abuts the southern stretch of Marina Beach. The tranquil place boasts of utter serenity along with the soothing sound of the waves crashing against the shores."
88,Vanagaram Fish Market,,https://www.holidify.com/places/chennai/vanagaram-fish-market-sightseeing-1258407.html,11 km  from city center,,"Home to the largest variety of fish in Chennai, the Vanagaram Fish Market is an all-day wholesale market on the north-eastern outskirts of the city. Open from 6am to 11pm everyday, the market offers various fish and other sea delicacies that are sold fresh."
