,Name,Rating,Link,Distance,Location,About
0,Pangong Lake,4.4,https://www.holidify.com/places/ladakh/pangong-lake-sightseeing-2583.html,114 km  from city center,Hemis,"At an altitude of 4350m and a five hour drive away from Leh, the Pangong Lake is an endorheic (landlocked) lake. The prime attraction of Ladakh, it changes colours from azure to light blue to green and grey. It became a tourist hotspot owing to the Bollywood movie ""3 idiots"" that was shot here."
1,Magnetic Hill,4.3,https://www.holidify.com/places/ladakh/magnetic-hill-sightseeing-2579.html,63 km  from city center,Leh,The popular Magnetic Hill of Ladakh is a cyclops hill where vehicles defy the force of gravity and move upwards on the hill when parked at the marked location. The hill lies at a distance of 30 km from the town of Leh on the Leh-Kargil highway.
2,Zanskar Valley,4.0,https://www.holidify.com/places/ladakh/zanskar-valley-sightseeing-8108.html,119 km  from city center,Zanskar,Located in the Kargil district to the east of Ladakh (around 105 km) lies the bewitching Zanskar Valley. The semi-desert region is flanked by snow-capped mountains and sparkling clean rivers along with distinct flora and fauna. The easiest way of reaching Zanskar is from Kargil through Suru Valley.
3,Khardung La,4.3,https://www.holidify.com/places/ladakh/khardung-la-pass-sightseeing-2575.html,49 km  from city center,Leh,"Khardung La, also known as Khardzong La, is a high mountain pass in Ladakh region of Jammu and Kashmir, near Leh. It serves as the gateway to Shyok and Nubra Valley. Khardung La is popular as the highest motorable road in India at an elevation of 5602 metres."
4,Nubra Valley,3.6,https://www.holidify.com/places/nubra-valley/,97 km  from city center,Nubra Valley,"Nubra Valley lies in the union territory of Jammu & Kashmir, at a distance of around 140 Km from Leh. With arid mountains in the backdrop, it is famous for the Bactrian camel rides, orchards and monasteries. Surrounded by snow-dusted Himalayan mountains, it can be reached via Khardung La."
5,Kargil,3.3,https://www.holidify.com/places/kargil/,182 km  from city center,Kargil,"Kargil lies near the Line of Control facing Pakistan-administered Kashmir's Baltistan to the west, and Kashmir valley to the south. Zanskar is part of Kargil district along with Suru, Wakha and Dras valleys. Kargil was at the center of a conflict between India and Pakistan in 1999."
6,Tso Moriri,4.3,https://www.holidify.com/places/ladakh/tso-moriri-lake-sightseeing-2589.html,125 km  from city center,,"Between Ladakh and Tibet, lies Moriri Lake, the largest high altitude lakes in India, at an altitude of 4,595m. Located in the Changtang region, it is a twin to the Pangong Lake. This stretch of sparkling, crystal clear, alkaline water is accessible only during summer months. An inner line permit is required for visiting Tso Moriri."
7,Shanti Stupa Ladakh,4.3,https://www.holidify.com/places/ladakh/shanti-stupa-sightseeing-2585.html,44 km  from city center,Leh,"The Shanti Stupa in Leh is a magnificent white-domed Buddhist monument located atop a steep hilltop at a dizzying height of 11,841 feet. It is a religious place for the Buddhists as it holds the relics of Buddha, consecrated by the 14th Dalai Lama. It is also popular amongst tourists as it offers a sweeping view of Leh and the nearby Changspa village."
8,Hemis National Park,3.3,https://www.holidify.com/places/hemis/hemis-national-park-sightseeing-2027.html,35 km  from city center,Hemis,"At an altitude ranging from 3,300 m to 6,000 m above sea level, this sanctuary is known to be the highest in the world as well as the largest park of South Asia. It is also a habitat to the rare Snow Leopards."
9,Leh Palace,4.3,https://www.holidify.com/places/ladakh/leh-palace-sightseeing-2577.html,42 km  from city center,Leh,"The Leh Palace is a 17th-century former royal palace and one of the central attractions in Leh. Built under the patronage of by King Sengge Namgyal, it used to house his family. The nine-storey dun-coloured palace now houses a museum and a prayer room, while the highlight is the sweeping view of Leh and the surrounding Zanskar mountain from the rooftop."
10,Spituk Monastery,4.2,https://www.holidify.com/places/ladakh/spituk-monastery-sightseeing-2586.html,46 km  from city center,Leh,"Spituk Monastery also called Spituk Gompa, is a Buddhist monastery located about 8 kms from Leh. One of the most dazzling monasteries in India, it houses 100 monks and a giant statue of Kali. It is famous for its collection of Buddhist objects of antique arms, icon, ancient masks and numerous Thangka paintings."
11,Phugtal Monastery,4.2,https://www.holidify.com/places/ladakh/phugtal-monastery-sightseeing-6243.html,111 km  from city center,Zanskar,"The Phugtal (Phuktal) Monastery is a Buddhist monastery situated in the south-east part of Zanskar region in Ladakh. Situated at the mouth of natural cave on a cliff, it is one of the most isolated monasteries in the region, built around 2500 years ago. The Phugtal Monastery looks like a honeycomb from a distance. It is popular amongst trekking enthusiasts."
12,Hemis Monastery,3.5,https://www.holidify.com/places/hemis/hemis-monastery-sightseeing-2028.html,28 km  from city center,Hemis,"Hemis Monastery is a Buddhist monastery located 45 kms south of Leh. Built by the Ladakhi king Sengge Namgyal, it is ranked as one of the wealthiest monasteries in India. Hemis Monastery is most visited during the annual Hemis Festival, held every year in early June."
13,Chadar Trek,4.0,https://www.holidify.com/pages/chadar-trek-frozen-river-trek-1327.html,74 km  from city center,Zanskar,"The Chadar Trek or The Frozen River Expedition is one of the most unique and challenging treks in India. The 6-day chadar trek across the frozen Zanskar River in Ladakh takes place during the latter part of January till the end of February or sometimes even in the first week of March, depending on the weather."
14,Stok Palace,3.6,https://www.holidify.com/places/ladakh/stok-palace-sightseeing-2587.html,42 km  from city center,Leh,"Located around 15km from Leh, the Stok Palace is the summer home to the royal family of Ladakh and descendants of King Sengge Namgyal. It was established in 1820 by King Tsepal Namgyal and was opened to the public in 1980 by the Dalai Lama. The Stok Palace has been converted into a heritage hotel and houses the Stok Palace Museum and Temple."
15,Diskit Monastery,3.2,https://www.holidify.com/places/ladakh/diskit-monastery-sightseeing-6254.html,74 km  from city center,Nubra Valley,"Also known as Deskit/ Diskit Gompa, this is the oldest and largest monastery in Nubra valley, belonging to Gelugpa (yellow hat) sect of Tibetan Buddhism."
16,Alchi Monastery,3.5,https://www.holidify.com/places/ladakh/alchi-monastery-sightseeing-8100.html,80 km  from city center,Lamayuru,"Located in the Alchi Village of Ladakh, Alchi Monastery is a complex of Buddist temples of which Alchi Monastery is the oldest and most famous. Cemented on a flat ground unlike other monasteries in Ladakh, the traditional architecture of the monastery is a monastic complex which has 3 separate temples, known as Dukhang, Sumstek and the Temple of Manjushri."
17,Namgyal Tsemo Monastery,3.5,https://www.holidify.com/places/ladakh/namgyal-tsemo-monastery-sightseeing-2581.html,42 km  from city center,Leh,"Traveling to the Namgyal Tsemo Gompa makes you encounter the steep mountains and submerges you in its serene and spiritual folds. The monastery has long lured travelers seeking Buddhist experience but surprises them with something unexpected- the moon like, quiet and mystic expanse of Ladakh's landscape."
18,Chemrey Monastery,3.2,https://www.holidify.com/places/ladakh/chemrey-monastery-sightseeing-6244.html,20 km  from city center,Hemis,Chemrey Monastery is a 400-year-old yet unexplored Buddhist monastery located approximately 40 kilometres (25 mi) east of Leh in northern India. It is known for housing a staggering statue of Padmasambhava (almost a storey-high)and a collection of ancient scriptures with the text emboldened in gold letters with the titles in silver.
19,Tso Kar,3.5,https://www.holidify.com/places/ladakh/tso-kar-lake-sightseeing-8106.html,77 km  from city center,,Tso Kar is a fluctuating salt lake located in the Rupshu Plateau of scenic Ladakh Valley. It is popularly known as the White Lake owing to the white salt deposits it leaves on the shores. Tso Kar Lake is the most peaceful and calm of the three high-altitude lakes (Pangong Lake and Tso Moriri) and also the smallest of the three. It is popular for bird-watching.
20,Likir Monastery,3.6,https://www.holidify.com/places/ladakh/likir-monastery-sightseeing-2578.html,79 km  from city center,Leh,"The Likir Monastery is the oldest monastery in Ladakh, located around 52 km from Leh in the scenic Likir village. Belonging to the Gelugpa sect of Tibetan Buddhism, the main attraction here is a 75 feet large seated statue of Maitreya Buddha gilded in gold. There are also various paintings of guardian divinities, murals and thangkas that adorn the walls of assembly halls."
21,Trekking in Ladakh,3.6,https://www.holidify.com/collections/treks-in-ladakh,609 km  from city center,,"Know for its majestic and moon like terrains, Leh is attracted by many natural lovers and adventurous tourist. Some popular trekking routes include Spiti to Ladakh, Markha Valley trekking, Ladakh Zanskar trekking and the Nubra Valley trekking."
22,Shopping in Ladakh,3.6,https://www.holidify.com/pages/shopping-in-ladakh-431.html,"2,020 km  from city center",,"For all those who like to fill their bags with souvenirs and local produce, the markets in Ladakh offers beautiful Tibetan jewellery, motifs, decorated carpets and woolen clothes."
23,Lamayuru,3.5,https://www.holidify.com/places/lamayuru/,117 km  from city center,Lamayuru,"Lamayuru is a tiny village that's popularly known as the Moonland of Ladakh. It is immensely popular for housing the Lamayuru Monastery, the oldest and largest monasteries in Ladakh. It is an ideal stopover between the Kargil-Leh route."
24,Rafting in Ladakh,4.2,https://www.holidify.com/places/ladakh/rafting-in-ladakh-sightseeing-2591.html,"11,944 km  from city center",,"Rafting expedition is done on Zanskar River, called the Grand Canyon of India, with high cliff like gorges at certain places. The Zanskar Rafting expedition is one of The best river trips in The world."
25,Sankar Gompa,3.2,https://www.holidify.com/places/ladakh/sankar-gompa-sightseeing-2584.html,43 km  from city center,Leh,"Sankar Gompa is a beautiful Buddhist monastery located 6 km from Leh. A subsidiary of Spituk Monastery, it serves as the residence of the Abbot of Spituk, the senior incarnate lama of Ladakh, making it an important religious site. The main attraction is the statue of Avalokitesvara with 1000 arms and heads."
26,Lachung Temple,,https://www.holidify.com/places/ladakh/lachung-temple-sightseeing-1258980.html,"1,239 km  from city center",,"Located in the Nubra Valley, Lachung Temple is a religious pilgrimage found in the Diksit village. Besides housing some of the most colourful and narrative paintings, this temple is also one of the oldest holy sites in the region."
27,Hundur Monastery,,https://www.holidify.com/places/ladakh/hundur-monastery-sightseeing-1258981.html,79 km  from city center,,"Hundur Monastery is a hilltop temple located in the Nubra Valley, quite close to the Diskit monastery and Lachung temple."
28,Dha Hanu,3.5,https://www.holidify.com/places/ladakh/dha-hanu-sightseeing-8173.html,144 km  from city center,Kargil,The villages of Dah and Hanu are amongst the only few villages that are home to the Drogpa tribe. These villages are a must visit for those who are interested in cultural diversity. The Drogpa tribes are known for their distinct ornaments and head gears.
29,Sindhu Darshan Festival,,https://www.holidify.com/places/leh/sindhu-darshan-festival-sightseeing-1253659.html,30 out of 58  places to visit in Leh Ladakh,,"The Sindhu Darshan festival is celebrated Leh Ladakh region, every year on the full moon day. Celebrated over three days, this is a celebration of River Sindhu, the former Indus Valley Civilisation, with the motive of endorsing the river as an icon of communal harmony in India. The Bollywood movie ""Dil Se"" was shot at the first Sindhu Darshan Festival."
30,Nyoma,3.5,https://www.holidify.com/places/ladakh/nyoma-sightseeing-8105.html,107 km  from city center,,Nyoma is a quaint village located 150 km from Leh on the banks of the Indus River. The main attraction of this unexplored village is a Buddhist monastery and the long walks in the peaceful lanes. Nyoma is best visited as a stopover when travelling to Chumathang from Leh. An inner line permit is required to visit Nyoma and its monastery.
31,Changthang Wildlife Sanctuary,3.5,https://www.holidify.com/places/ladakh/changthang-wildlife-sanctuary-sightseeing-8101.html,76 km  from city center,Hemis,"The Changthang Wildlife Sanctuary is located at an altitude of about 4000-9000 feet in the Ladakhi Changthang Plateau. The vast range of exotic flora and fauna attribute the sanctuary to be the second-largest nature reserve. It houses the three popular high altitude lakes - Tso Moriri, Pangong Lake and Tso Kar."
32,Hall of Fame Ladakh,3.3,https://www.holidify.com/places/ladakh/hall-of-fame-museum-sightseeing-2571.html,45 km  from city center,Leh,"Located at approximately 4 km from the main city, this glorified museum was built in memory of the brave soldiers who lost their lives fighting for India at the Indo-Pakistan war."
33,Mountain Biking in Ladakh,3.3,https://www.holidify.com/places/ladakh/mountain-biking-sightseeing-2580.html,19 km  from city center,,"Often termed the paradise of mountain bikers, Leh has thousands of tourists coming in every year to experience the thrill of driving on its steep slopes and adrenaline gushing paths."
34,Bactrian Camel Safari in Nubra Valley,3.3,https://www.holidify.com/places/nubra-valley/bactarian-camel-safari-sightseeing-5551.html,97 km  from city center,Nubra Valley,Nubra Valley is famous for the Bactrian Camel Safari. These camels are not even the usual ones that you must have seen in Rajasthan or in pictures. These camels having two humps were the major mode of transport to travel to silk route. These are now used for the safari in the region is hugely popular among the tourists.
35,Panamik Village,3.2,https://www.holidify.com/places/nubra-valley/panamik-village-sightseeing-5554.html,98 km  from city center,Nubra Valley,"Located at a distance of about 140 Km from Leh, Panamik Village is the northernmost part of India. It lies on the bank of Nubra river and is well known for its hot water spring, Pashmina goats and the bactarian camels."
36,Yarab Tso Lake,3.2,https://www.holidify.com/places/ladakh/yarab-tso-sumur-sightseeing-6255.html,43 km  from city center,Nubra Valley,"Popular as the hidden lake, Yarab Tso is located in the Nubra Valley region. It is an uninhabited lake with crystal clear water. Being located in a remote location, the only way to reach it is through an uphill hike."
37,"MoonLand, Lamayuru",3.2,https://www.holidify.com/places/lamayuru/moonland-sightseeing-2606.html,118 km  from city center,Lamayuru,"A peculiar landscape near Lamayuru on Leh-Kargil Road is the MoonLand. It is called so fondly, because the landscapes here are said to be like that of the moon."
38,Darcha Padum Trek,3.5,https://www.holidify.com/places/ladakh/darcha-to-padum-trek-sightseeing-8221.html,120 km  from city center,Zanskar,"Located on river Bhaga, Darcha is a small Lahaul region in the Himachal district of Spiti. Whereas Padum is among the two primary capital cities of the Zanskar society. There are plenty of camping sites en route, spread across a variety of nomadic sites travellers would pass by."
39,Maitreya Buddha,3.3,https://www.holidify.com/places/nubra-valley/maitreya-buddha-sightseeing-5553.html,72 km  from city center,Nubra Valley,Near the Diskit monastery in Nubra Valley stands a 32 meter tall statue of Maitreya Buddha facing towards the Shyok river. This statue is built with 8 Kg gold which was donated by the head of Gompa and was sanctified by the Dalai Lama.
40,Handicrafts Industrial Cooperative Shop,3.2,https://www.holidify.com/places/ladakh/handicrafts-industrial-cooperative-shop-sightseeing-2572.html,"2,020 km  from city center",,This place is good to buy souvenirs for friends and family. Wooden choktse tables carved with images of mythical beasts are available from the Handicrafts Industrial Cooperative Shop .
41,Samstanling Monastery,3.2,https://www.holidify.com/places/nubra-valley/samstanling-monastery-sightseeing-5555.html,87 km  from city center,Nubra Valley,"Samstanling Monastery in Sumlur village is an important Buddhist shrine in Nubra Valley. Founded 140 years ago, the monastery houses 50 monks who look after its daily functioning. The main attraction is the spectacular murals and paintings of Buddha."
42,Wanla Monastery,3.2,https://www.holidify.com/places/lamayuru/wanla-gompa-sightseeing-2607.html,117 km  from city center,Lamayuru,The Wanla monastery is Buddhist monatery located in the Lamayuru region. It is popular for housing an 11 headed Avalokitesvara statue and one of the earliest known Drigung Kagyu prayer chambers. It is located closed to the Lamayuru monastery.
43,"Lamayuru Monastery, Lamayuru",3.2,https://www.holidify.com/places/lamayuru/lamayuru-monastery-sightseeing-2605.html,117 km  from city center,Lamayuru,"The main attraction of the Lamayuru region, the sprawling Lamayuru Monastery, lies at a distance of about 127 km from Leh. Murals, frescoes and column paintings exemplifying the Kashmiri style of Buddhist iconography are what stand out in this monastery."
44,"Stakna Gompa, Hemis",3.2,https://www.holidify.com/places/hemis/stakna-gompa-sightseeing-2030.html,29 km  from city center,Hemis,"A small shaky bridge over the Indus, leads one to the Stakna Gompa, on the banks of the river and looking out onto perhaps some of the most panoramic and beautiful views of Hemis."
45,"Gotsang Gompa, Hemis",3.2,https://www.holidify.com/places/hemis/gotsang-gompa-sightseeing-2026.html,30 km  from city center,Hemis,"A 45-minute walk away from the world, is a retreat centre above Hemis Gompa is a retreat centre called Gotsang Gompa."
46,Umling La Pass,,https://www.holidify.com/places/ladakh/umling-la-pass-sightseeing-124352.html,"1,576 km  from city center",,"Umling La is the most famous highest motorable road situated at an elevation of 19,300 feet in the state of Jammu and Kashmir. If you are a motorbike enthusiast, you would be surprised to know that Umling La is the world's highest motorable road filled with a lot of adventure and thrill. T"
47,"Shang Gompa, Hemis",3.2,https://www.holidify.com/places/hemis/shang-gompa-sightseeing-2029.html,71 km  from city center,Hemis,"In midst the snow peaked mountains and wrinkled terrains of Leh and Ladakh, Shang Gompa is a symbol of composure, tranquility, placidity and spending. The chanting of the monks is almost hypnotizing."
48,Hemis Festival,,https://www.holidify.com/places/ladakh/hemis-festival-sightseeing-1253582.html,49 out of 58  places to visit in Leh Ladakh,,"The Hemis Festival, a two-day festival hosted at the Hemis Gompa Monastery celebrates the birth of Padmasambhava, the founder of Tibetan Buddhism. Celebrated on the 10th day of the Tibetan Lunar month, the main highlight of Hemis festival is the gathering of the lamas around the central flagpole of monastery, where they perform the mystic mask dances (Chams) and sacred plays."
49,Ladakh Festival,,https://www.holidify.com/places/ladakh/ladakh-festival-sightseeing-1253590.html,50 out of 58  places to visit in Leh Ladakh,,"The Ladakh Festival is an annual fiesta organised by the Jammu and Kashmir Tourism Department in Leh. Events such as folk dances, musical performances, mask dances, art and craft exhibitions, etc. form an integral part of this festival. It provides an excellent opportunity for the tourists to experience the culture and lifestyle of the people in Ladakh. A blend of Tibetan, Central Asian and Northern India; the Ladakh Festival is a week-long extravaganza that shouldn't be missed if you're visiting Leh-Ladakh."
50,Matho Nagrang Festival of Ladakh,,https://www.holidify.com/places/ladakh/oracle-matho-nagrang-festival-sightseeing-1253623.html,51 out of 58  places to visit in Leh Ladakh,,"The Oracle Matho Nagrang Festival is held at the Matho Monastery or Matho Gompa in Ladakh in the first month of the Tibetan new year. It is believed that two oracles, or Ronstang, inhabit the bodies of two specially chosen monks to predict the future of the village and individual villagers. Such traditions might seem unbelievable to the outsiders, but for the people living here, it's a way of life. Matho Nagrang Festival is one of the most important festivals of the Tibetan Buddhism Sakya School which like other Tibetan festivals, is celebrated with great pomp and show."
51,Dosmoche Festival,,https://www.holidify.com/places/ladakh/dosmoche-festival-sightseeing-1253773.html,52 out of 58  places to visit in Leh Ladakh,,"The festival of Dosmoche is one of the most popular festivals celebrated in Leh-Ladakh region. Falling right at the beginning of the Tibetan New Year, the festival is held in the majestic Leh Palace. Monks from different monasteries gather at the courtyards of the palace to perform Chams. ""It marks the victory of the forces of good over evil. """
52,Losar Festival,,https://www.holidify.com/places/ladakh/losar-festival-sightseeing-1254223.html,53 out of 58  places to visit in Leh Ladakh,,The Losar festival of Ladakh is one of the major Tibetan Buddhist festivals that is celebrated with performances of traditional songs and folk dances of the region. The Ladakh area of Jammu & Kashmir witnesses an outburst of mirth in the form of festivities and high surged devotion on the occasion of Losar.
53,Watch a Chhams Performance,,https://www.holidify.com/places/ladakh/watch-a-chhams-performance-sightseeing-1254363.html,54 out of 58  places to visit in Leh Ladakh,,One of the most exotic things to do in Leh Ladakh is to watch the Llams perform the Chhams. The performance involves a dance drama executed by the Llams in colorful costumes. The whole event is filled with euphoria and is a delight to witness. These performances get especially popular during the Hemis Festival or the Ladakh Festival.
54,Donkey Sanctuary,,https://www.holidify.com/places/ladakh/donkey-sanctuary-sightseeing-1254683.html,55 out of 58  places to visit in Leh Ladakh,,It might come as a surprise to even some of the most hardcore animal rights enthusiasts but there exits such a thing as the Donkey sanctuary. It caters to the old and sick donkeys in the region that are always needed by the locals owing to the geographical conditions but left when sick or old. The place in Leh Ladakh is a very lively barn and will probably set a smile on the face of children and adult alike with its witty posters and graffiti.
55,Experience the Local Culture,,https://www.holidify.com/places/ladakh/experience-the-local-culture-sightseeing-1254685.html,56 out of 58  places to visit in Leh Ladakh,,Ladakh is a very friendly place and you’ll find many people willing to share their own experiences and stories of Ladakh with you. The monks and children are particularly helpful and will go out of their way to get you accustomed to the culture of Leh and make you feel at home.
56,Stargazing,,https://www.holidify.com/places/ladakh/stargazing-sightseeing-1254686.html,57 out of 58  places to visit in Leh Ladakh,,"Leh-Ladakh, as already mentioned earlier, is a must visit place for all photography lovers – especially, Astro-photographers! The Major reason why Ladakh is a favourite among astrophotographers is because it provides clear night skies to complement the scenic beauty. Cities don’t generally have such pellucid skies owing to the pollution around."
57,Chang La,,https://www.holidify.com/places/ladakh/chang-la-sightseeing-1258330.html,8 km  from city center,,"Ladakh is already known for its high altitude mountain passes and highest motorable roads. Another feather in the cap of Ladakh is the Chang La Pass, which is the third highest motorable road in the mountains, in all the world. Perched at an altitude of 5360 m above the sea level, Chang La Pass is one of the hot spots of travel among all the adventure enthusiasts and bike riders. It is also home to the highest research station in the world that is run by Defence Research and Development Organisation (DRDO), India."
